video_id,title,channel_title,views,likes,dislikes,comment_total
7wsYiuNERZA,"Early THOR Reactions Are Outstanding, Zelda Movie Chances - The John Campea Show",John Campea,29403,1240,48,808
TP0PsCb371E,Stelter: Weinstein firing is an earthquake in Hollywood,CNN,43901,330,295,1061
yWatz9TAgT0,GET READY WITH ME | Teacher Evolution Ep 10,Pocketful of Primary,32485,1404,36,498
d6a4AGg_TsI,Eater's Top 5 Favorite Barbecue Joints In America — The Meat Show,Eater,43518,597,252,171
T2rqOvijMBk,Stray Puppy Befriends Travelers Who Find Him a Home  | The Dodo,The Dodo,139700,4736,51,397
20yqGk-M-iI,Jacob Sartorius Gives RAW Interview,RAW,18750,1379,208,117
hVQPVGPAUtc,Gov. Mike Huckabee's Full Interview with President Trump | TBN,Huckabee,386745,0,0,0
0s8oYNL1M-A,Goodnight Moon as read by LeVar Burton to Neil deGrasse Tyson,StarTalk Radio,107792,3498,56,395
RIz3klPET3o,Line Rider - Mountain King,DoodleChaos,948600,36715,169,830
b7xndvitLa8,Gaming Beyond the Iron Curtain: East Germany,Super Bunnyhop,135122,9072,118,1535
7_HboVYEkWw,Rick and Morty Szechuan Sauce Riot in LA,Not Dan Harmon,293564,1311,663,2839
IMcVhfQfvow,Will it Steamroll? Giant Gummy Bear vs. Steamroller,Vat19,1295505,17820,739,2888
fM6JOfiAPgQ,FENTY BEAUTY HOLIDAY COLLECTION BY RIHANNA TUTORIAL | SONJDRADELUXE,sonjdradeluxe,82598,6594,128,688
biKYH7o8j7k,UFC 216: Post-fight Press Conference,UFC - Ultimate Fighting Championship,258327,2087,164,845
wF38WmiVIW4,Governor Brown Signs SB 17 into Law,California Senate Democrats,755,0,0,0
BoN3hlHjDnQ,Cara Delevingne Hopes Talking About Her Mental Health Will Help Others | This Morning,This Morning,161315,2579,121,0
8I0pqPWfjWU,The Greatest Nancy Panel Ever Drawn,Glyph Jockey,28613,105,13,30
4MEv1k9aQXA,Hurricane Nate leaves path of destruction along Gulf Coast,ABC News,29837,203,46,174
tv19Sd9dS38,People Didn't Believe My Mental Illness,Boldly,1103102,40042,724,3450
xyDIy9ggcTc,UF's Tom Petty tribute,Joel Hartley,43131,207,25,154
D1IBXE2G6zw,Lin-Manuel Miranda - Almost Like Praying feat Artists for Puerto Rico [Music Video],Atlantic Records,2912165,97756,3007,8001
mvuN2LQf09o,Prince Harry and Michael Fallon unveil MOD mental health initiative,The Royal Family Channel,4961,151,6,19
fUjicxMPDzs,Pacific Rim Uprising - Official Trailer (HD),Legendary,5741857,49038,6865,14773
cmznoInjg1U,Happy Birthday Sonja,Lady Gaga,86709,5783,220,742
QKgUwKuhQmo,Get a Royal Ride Through the Streets of NYC | PDA with Ben Aaron,SoulPancake,10729,277,11,30
oZlJZ0BhXsA,The Struggles of Watching ASMR,ASMR Darling,1306136,62466,3109,11939
ZB_g0QnYMkM,Animal Adventure Park Giraffe Cam,Animal Adventure Park,35450,1834,21,12
0dWj2k4FMM8,Nature’s Wonderland | A Mickey Mouse Cartoon | Disney Shorts,Mickey Mouse,856592,10075,713,1648
TF0TRv7Fw94,MY 2017 YOUTUBE REWIND **365 DAYS OF VLOGS**,Jake Paul,4041272,155844,40763,41376
vpJba2qIXjs,2. Keaton (2007),MIT OpenCourseWare,7985,78,1,3
PpGyVCu2n9g,Chris Rock Had to Reassure Michelle Obama at the White House Party | The Graham Norton Show,The Graham Norton Show,767861,7008,769,1059
fwDZ8uhqJg0,"Eric Church - Why Not Me | October 4, 2017",Grand Ole Opry,6078326,36535,2939,3101
J4QLJiv-Eo4,TRAGEDI HP MELEDAK! KARYAWAN HOTEL CIPUTRA,Rista Casmiaa,765111,206,23,67
76WkDuiAjeY,TROPHY CAKE ft Lindsey Stirling and Mark! - (Dancing with the Stars) - NERDY NUMMIES,Rosanna Pansino,620093,26584,279,5116
KGb5yAdkcFw,HELP ME CONTOUR | Teach Me How To Beauty Tour EP3 ft. Nicol Concilio,Simply Nailogical,1306863,68708,798,7464
HPRQwI5uvBM,Bu Reveals What Ended Relationship With Tracee Ellis Ross,thejasminebrand,33142,87,235,156
XTqx6VU0Wqk,Issa Rae & Yvonne Orji Throw The Blackest Party of 2017 - [#LemonPepperShawties],The Film Culture Media,2075,6,1,0
VH1RwkrHPvA,Canelé de Bordeaux - Crispy Baked French Custard Cakes - How to Make Canelés,Food Wishes,284006,8561,204,993
6v-oVPROexw,Alec Benjamin - The Wolf and the Sheep (Rough),Alec Benjamin,31524,4353,4,1245
pXFIMdJduvY,Rudy Mancuso & Poo Bear - Black & White (Official Video),Rudy Mancuso,2548167,181332,3293,17267
dRX0wDNK6S4,Kane Brown - Heaven,KaneBrownVEVO,1623878,49038,1085,1850
WP98DDNKQ0U,Steven Malcolm - Cereal Remix [Official Music Video] Featuring Sadie Robertson,Steven Malcolm,113394,1290,55,328
q68xUVH3qiM,Nick Kroll & John Mulaney Give Teens Puberty Advice,BuzzFeed Celeb,213027,5103,456,496
941Bl3oxk8Y,Invitation - Why Don't We [Official Music Video],Why Don't We,1593139,119521,961,16936
jsR0dclw060,Daniel Harrison: The Man Behind the Mustache,Studio C,333732,11336,280,2371
c2BcR39AtxE,😜 New iOS 11 Emojis!,iJustine,619290,22244,2053,11169
J7MYJ8Kxhwc,NF - Outcast,NFVEVO,1289652,59764,1042,6853
O3D8d2QNShY,"Торпедо vs Текстильщик: футбол, который не нужен?",Томикс-ТВ online,552670,2268,82,736
ruTB5jBGXsE,Spider Cat - Simon's Cat (Halloween Special) | BRAND NEW B&W,Simon's Cat,576907,19225,301,831
2qiBTkVRp1U,RECREATING MY HOMECOMING LOOK (A TAG!) // Grace Helbig,Grace Helbig,277422,14240,138,515
8VzoqU5IQT4,LeBron James Fearless | Intel,Intel,61415,194,28,38
S6Mnl6kocLw,Jeremy Lin addresses Kenyon Martin's comments about his dreads,NBA Highlights · YouTube,112628,1192,48,629
bO-cI25XaAk,"Ok, Cam....Im only going to say this once",The Mighty EROCK,63832,1330,1129,0
G0cDl-vZKkg,NEW SHADE! MILANI CONCEAL + PERFECT 2 in 1 Foundation {First Impression Review & Demo!},thataylaa,259165,11704,584,2446
RE-far-FvRs,PUPPIES FIRST BATHTIME!,VLOGTOWSKI,323280,13781,292,2024
_0d3XbH12cs,Kimbra - Everybody Knows (Official Music Video),kimbramusic,116762,7611,79,810
adfcVmu1bmM,"DUSK TILL DAWN - Zayn ft. Sia | Kirsten Collins, Blake Rose, KHS Cover",Kurt Hugo Schneider,662150,47384,776,1969
JLIAuvpdRTc,Friday Press Conference on 1 October Shooting Incident,Las Vegas Metropolitan Police,38624,0,0,0
odhMmAPDc54,Every Cat At 3AM,Gus Johnson,1159836,41168,1411,2424
lQX0jvVQywQ,DENY U by SUPERFRUIT,SUPERFRUIT,301553,26242,199,3707
txvKrTplOVs,Clueless Gamer: Shadow Of War With Kumail Nanjiani  - CONAN on TBS,Team Coco,1529009,37314,1099,3084
FRjPEOPr6pA,New Orleans readies for storm surge from Hurricane Nate,CBS This Morning,7386,56,15,69
UXdbCReBTR8,Did You Call My Girl!? | Anwar Jibawi,Anwar Jibawi,3181840,109643,2638,4965
oWDy7_W9cpM,Video shows man clinging to front of moving school bus,WBAL-TV 11 Baltimore,16977,31,1,70
LunHybOKIjU,Eminem Rips Donald Trump In BET Hip Hop Awards Freestyle Cypher,BETNetworks,24786774,780500,127204,265461
rgbnZG85IRo,What Americans Heard in Cuba Attacks: The Sound,Associated Press,185798,768,483,0
VX4MQYwAh80,Star Wars Trash Compactor Challenge!!,Team Edge,1042303,20603,2224,7213
j6cv-6WuDK0,Seth Gives His Fans Eminem's Trump Ultimatum,Late Night with Seth Meyers,718223,15007,4742,3274
M16CGK1T9MM,Why Photos of the Eiffel Tower at Night are Illegal,Half as Interesting,287053,10265,643,1511
iALfvFpcItE,Why Are You Anxious?,AsapSCIENCE,261553,11975,145,1159
BRhR9_tiPTo,Didi homers twice as Yanks advance to ALCS: 10/11/17,MLB,253110,1671,198,742
KnE3055j-A0,McDonald’s Rick and Morty Szechuan Sauce TASTE TEST! (Cheat Day),ClevverTV,434367,13029,1455,1373
p1RKkRCiU90,having a non-white name,ProZD,756795,55874,1196,5249
PgeJ0XYuI2E,DxOMark Smartphone Ratings: Explained!,Marques Brownlee,485033,42134,535,4337
udnGW3E1vxY,Kane Brown - What's Mine Is Yours,KaneBrownVEVO,95856,5065,75,290
ZczwzVhai9E,Arnold Set off to the Center of the Earth,Meet Arnold,1862708,72931,2024,10539
KCNvREKTnQc,Seth MacFarlane Calls Out Harvey Weinstein Back In 2013,Cracken News,2607785,19116,804,3511
Z7R8XRKqHAI,Hey Ya! - Walk off the Earth (Outkast Cover),Walk off the Earth,264375,22884,275,1288
n8t9yJIKkvM,"Spill Your Guts or Fill Your Guts w/ Charlie Puth, Josh Gad, Michelle Dockery & Rachel Bloom",The Late Late Show with James Corden,886790,28399,400,2282
t8sgy0faXyg,"Guns N' Roses Feat. PINK! - Patience (Msg, Nyc) 10.11.17 (P!NK)",markit aneight,161398,1768,84,216
QrNk6lHyDbk,Box of Lies with Margot Robbie,The Tonight Show Starring Jimmy Fallon,1109607,19554,482,1040
jASAxU0Uqk4,Stranger Things | Friday the 13th Trailer Teaser | Netflix,Netflix,168788,9700,120,675
1ShHf1Ym1h0,American Made by Upchurch (OFFICIAL MUSIC VIDEO),Ryan Upchurch,165112,10228,461,1595
jUrpOg4fBs0,Gucci Mane - Enormous feat. Ty Dolla $ign [Official Audio],OfficialGucciMane,166711,8620,207,888
Xtqr1C6eDmY,Splitting Pellets with a Knife in Slow Motion - The Slow Mo Guys,The Slow Mo Guys,1198361,42180,552,2555
3wsegE01zUE,"U.S.P.S Postman Delivers Mail Santa Rosa Fires Drone Video By Douglas Thron   October 10, 2017",Douglas Thron,495553,0,0,0
doUdRCrK80E,73 Questions With Daisy Ridley | Vogue,Vogue,1634485,46174,1655,7964
Oo0NJsr5m4I,Tourist terrified by new glass walkway that cracks under weight,CGTN,3873250,34664,6624,7501
S5Esa9L4nvE,TOP HALLOWEEN COSTUMES of 2017 (YIAY #365),jacksfilms,890874,51039,351,27312
DeTu8xSGpEM,John Legend - Penthouse Floor ft. Chance the Rapper,johnlegendVEVO,186321,10169,338,877
abeF5zQbQEM,My First Job turned into a heist movie,itsAlexClark,280441,15475,364,4587
dpGMUuXJbGU,Andrew Garfield Says The World Doesn't Need Movie Stars,The Late Show with Stephen Colbert,283117,4359,198,799
uCVuyIQZ-lA,Tour Documentary - Episode 2,Camila Cabello,42341,11538,23,673
f24IrRsf-lQ,The Swift Life™ – First Look,Taylor Swift,459875,30731,2476,3450
H7H0ZWwWKCw,The Fire Whisperer - Cyanide & Happiness Shorts,ExplosmEntertainment,931276,41515,1352,3055
CNwYcyRAl1Y,Michael Jackson - Blood On The Dance Floor X Dangerous (The White Panda Mash-Up),michaeljacksonVEVO,259965,27376,335,4057
Q0CbN8sfihY,Star Wars: The Last Jedi Trailer (Official),Star Wars,26208268,610220,21122,98683
11S5tcT2Tm0,Lindsey Stirling - Mirage,Lindsey Stirling,981403,83305,1331,5076
iv1zeGSvhIw,Echostar 105 / SES-11 Launch Webcast,SpaceX,369675,8721,117,1020
5fYkPljB9Zk,Making a Sword with THERMITE!,TheBackyardScientist,575851,23437,560,3392
1KCZHHMZVGQ,Adam Ruins Everything - Why Toxins Are a Myth (Tease) | truTV,truTV,161081,2920,168,367
0lDRz8qmXpE,"Standing Up For Yourself as a Woman, But Not Too Much",CollegeHumor,261158,17223,1506,2121
8NArIVIQ4BI,soap tips,bill wurtz,1329790,139481,3019,14044
JoNj0KDuDR8,I Accidentally Became Famous In Another Country,BuzzFeedVideo,1064749,51783,2485,4625
sRAp2MO6TUY,"CHINESE Street Food Tour DEEP in Sichuan, CHINA - SPICY & INCREDIBLE STREET FOOD ADVENTURE!",The Food Ranger,366400,9443,286,2437
jK6BesOrfws,KYLO REN REACTS to The Last Jedi Trailer,Auralnauts,40488,3052,31,413
9E3wYGXnUqY,FULL FACE USING ONLY MIRANDA'S LIPSTICK!,PsychoSoprano,1180354,54389,560,5551
mQwnQS25xpE,Kate Hudson Is Eager to Rock a Mullet,TheEllenShow,246394,2986,94,353
G3fZBW_okks,AN INCREDIBLE MOMENT | World Championships Final Vlog,Nile Wilson,174904,9648,45,441
wWK5W1b17uw,MAC N' CHEESE INSIDE FRIED CHICKEN - VERSUS,HellthyJunkFood,386348,11952,378,2577
Hhg7Cv50SWY,After Show: Lea Michele Rates John Stamos’ Kiss | WWHL,Watch What Happens Live with Andy Cohen,14568,137,10,23
2K57-24FnIM,How We Lie to Ourselves,The School of Life,64686,3683,122,496
2jvi4e0NIHs,"GROUP HALLOWEEN COSTUME IDEAS | Walking Dead, Riverdale + more!",Tess Christine,148914,9494,102,574
GLbJCklVVJU,NYYC 2017 1A Finals 1st Place - Evan Nagao,National Yo-Yo Contest,477216,4320,180,454
-bQUBzPZHHQ,Introducing Oculus Go,Oculus,234826,1694,398,701
nZtpLKCoUWg,The Unfortunate Truth About The Civil War,Cracked,197462,10907,1488,2877
_F-vmhCq6uw,"Cavuto: Loyalty works both ways, Mr. President",Fox News,423436,5184,1120,2549
ofzjzf_rhZc,How to Make a Remote Hose Pipe Controller,colinfurze,483860,16318,727,1236
dJ_p4Z_yVpM,Call Me By Your Name - Clip - Dance Party,SonyPicturesClassics,64394,969,26,129
3zrZE68Qrrg,Jessie Ware - Alone (Official Video),JessieWareVEVO,51248,4256,24,251
Y5fwGxJjn5E,Super-easy Blueberry & Yoghurt Popsicle Recipe | Cupcake Jemma,CupcakeJemma,23145,1548,8,79
T6x-kDiQsWM,Matt Damon Ruins Chris Hemsworth Interview,Jimmy Kimmel Live,3159145,47379,2907,3764
QeBCu1ZSORs,Kris Wu - Deserve ft. Travis Scott (Official Audio),Kris Wu,581951,53946,698,6505
WFb0EDl-JS8,Will I Raise a Son Like Harvey Weinstein?,Mayim Bialik,93700,5379,1188,1918
eXyHRnDNH64,How granite countertops took over American kitchens,Vox,486103,11772,714,1678
DBxTCFDo0WM,Asiah Collins & Crystal Smith Get Into a Shouting Match | The Platinum Life | E!,E! Entertainment,12012,114,9,17
Ik15Y5lDeJw,"Joel Embiid 2017 Preseason Debut | October 11 at Nets - 22 Pts, 7 Rebs, 3 Ast in 15 Mins!",FreeDawkins,101265,908,18,523
a6Zj09zFXbI,How to Get Your Face Through Halloween- Skincare Routine,Glam&Gore,228101,17322,100,1672
vUC8-qbCVWk,Paramore: Hard Times (Green Screen Outtakes),Paramore,94468,10519,88,688
48dQekjzI6U,Dealing with Cancer (This is my SECRET),Wil Dasovich,194148,9707,140,1836
YCYXUi_5kns,Spiny Lizard Catches Me!,Brave Wilderness,750038,25932,257,3987
BJFQz8A2Kjs,Hundreds are missing as out-of-control California fires burn,PBS NewsHour,7569,60,5,0
WMAtfhATTLg,Sam Smith - The Thrill Of It All (Album Trailer),SamSmithWorldVEVO,655109,46287,223,2804
SmTvoFcy4_Q,Hazelnut Swiss Roll Recipe,SORTEDfood,108380,3513,70,243
eig-wx_83Do,See The Devastation of California's Still-Roaring Wildfires  (HBO),VICE News,25934,396,17,315
6u9LNN9HwC4,Everything You Missed In The Last Jedi Trailer,Looper,804710,6964,554,1472
g4xW9aCg2zY,"Jump Up, Super Star! - Super Mario Odyssey Musical",Nintendo,1196387,66552,1074,13493
Kn4KUvDzQFg,Introducing Context Cards,Snapchat,155407,0,0,0
h2K_SWpQtb4,Taylor Twellman says there's an 'arrogance' to the U.S. men's soccer team | SportsCenter | ESPN,ESPN,54867,836,18,631
9yUZTTLpDtk,Secrets to measuring a piece of paper - Numberphile,Numberphile,236767,16015,194,1166
YlQYciVYhVA,Arctic Foxes Destroy Filmmaker's Camera,Nature on PBS,190538,333,6,25
c5vSFtnWkDA,OFFICIAL HOUSE TOUR!!!!!!!!,Domo and Crissy,1021587,69459,1679,9208
wHf01y69Ae4,Megan Mullally Hijacks A Stranger’s Tinder | Vanity Fair,Vanity Fair,367922,9952,329,653
wRe9jBoBwFY,Finding Ralphie | A CHRISTMAS STORY LIVE!,FOX,9182,70,37,32
mPw8v7Zix5c,Men Try False Lashes Challenge | Try This Challenge | Refinery29,Refinery29,5078,117,7,16
T6iLJTy6LNQ,EXTREME PUMPKIN CARVING | for National Coming Out Day,GOTDAMN ZO,72299,7118,38,795
rjlXcMhQgPU,The Crazy Story Of The Barefoot Bandit,BuzzFeedBlue,191413,5329,452,544
raNcTqw-I-o,Cut for Time: The Last Fry (Gal Gadot) - SNL,Saturday Night Live,1165873,21986,2147,1846
aRgTLb5EbiQ,My Mama Wears Timbs,Ari Fitz,13895,2043,12,240
do-9G1s9LSY,Autumn Makeup Tutorial for Straight Men,AnthonyPadilla,172377,24234,349,3267
0TP1zVBdosw,"The Shield reunite: Raw, Oct. 9, 2017",WWE,6167747,158892,3376,22076
Y8kAZAQ5dX0,100 PUPPIES PRANK ON GIRLFRIEND!,Wassabi Productions,876315,44314,1664,4449
bpDylTwwunc,Demi Lovato: Simply Complicated - Official Trailer - Coming to YouTube Oct 17th,Demi Lovato,803709,44494,681,1792
3BMgV8jj9IU,Freedom - International Day of the Girl,The Global Goals,2946711,47337,28557,0
cXQUObfBXYk,Adam Savage Becomes an Extra in Blade Runner 2049 Short!,Tested,204252,7834,88,768
Qg7YzqCRoZ0,Top 10 Reasons LAVA Is The Best Pixar Short,SuperCarlinBrothers,215229,9120,342,2122
zkIrbVycAeM,People are accusing this Dove ad of being racist,Business Insider,719160,2203,6022,6923
WSFJsq_jwMs,Bruno Mars That's What I Like Acoustic Remix | Charlie Rose,Charlie Rose,219255,6115,74,390
wvkkLRRAT4I,Riverdale Season 2 Q&A answering your questions! (Part 1) | Madelaine Petsch,Madelaine Petsch,268024,19273,42,2394
QfINpLDE_s4,Star Wars Theme Song Made ENTIRELY Out of Porg Sounds!!!,Volpe Music,97424,1899,33,316
tfHCtgyT-oQ,Turtles All the Way Down!!! A Reunion Video,vlogbrothers,246029,15603,217,2189
FcPs-bMkUjo,FULL FACE USING CHEAP AMAZON MAKEUP... OMG | Casey Holmes,Casey Holmes,321736,12490,504,1331
WQjO1mMCPg4,EVERY MCDONALD'S EVER,Smosh,2128629,62045,6299,7437
y4BQEzQieEU,Russell Wilson Goes Undercover!,Braun,35477,72,1,8
jiRAinnkfwI,TheYBF Exclusive : Amina Buddafly + Peter Gunz from WE tv's “Marriage Boot Camp Reality Stars,YBF Chic,12758,2,0,1
czeMrUoy8kw,Angry Ex-Girlfriend Gets Revenge,ViralHog,15642,35,10,26
RaKxVWJxA2U,Star Wars The Last Jedi Trailer Breakdown! (Nerdist News w/ Amy Vorpahl),Nerdist,97372,2972,175,557
5QCv3dJBPyQ,Recreating My FIRST Makeup Tutorial! | Jackie Aina,Jackie Aina,443860,37337,362,4089
H0bVlfJsR4Q,TEENS READ 10 WRONG NUMBER TEXTS (REACT),REACT,932717,23327,1002,2553
Z0mzCVe_onw,Interview With A 2-Year-Old | Preschool,La Guardia Cross,69193,6705,23,908
zFnvAbX96gM,Jake Bugg - Waiting ft. Noah Cyrus,JakeBuggVEVO,55208,9091,71,821
Lk7iJthBk6I,DEMON HALLOWEEN LOOK | DESI PERKINS,Desi Perkins,427827,33411,325,4007
-B9z3az6Axc,Halloween ASMR: Spooky Sounds (feat. Mamrie Hart),Tyler Oakley,192861,15692,382,2441
SmfWvo4cMpU,My EXCITING News!!,Courtelizz1,94839,10721,24,2187
YjtRY28Pe2o,Coming Out?,MyHarto,43702,4268,22,371
fOmwkTrW4OQ,The Marvelous Mrs. Maisel - Official Trailer [HD] | Amazon Video,Amazon Video,59180,602,31,60
q0B8k3UPZNc,QATAR AIRWAYS A350 BUSINESS CLASS REVIEW; INCREDIBLE,CaseyNeistat,3155205,109934,5368,11069
fBR-MFpVKuc,Sean Evans Learns How to Make Sushi | Sean in the Wild,First We Feast,444028,11880,198,1161
FUBXKn1oP0g,DIY Giant Spider AKA Aragog AKA HARRY POTTER HALLOWEEN BIT*HES!,ThreadBanger,922069,65230,566,6331
KQ19fT4BQQU,"Arcus3D C1 - It moves, kinda",Arcus-3D,3600,15,0,2
hwFx0ROBf7o,St. Vincent - Pills (official audio),St. Vincent,191719,3730,182,559
7LhdGh1Oy34,Perfect Party: 30,Crate and Barrel,35093,222,227,0
yG-yfbDscbo,Star Wars: The Last Jedi - Trailer Review,Jeremy Jahns,383552,17138,416,2703
aDuB1arf8aE,#CakeSlayer Halloween: SPIDER CAKE | Man About Cake with Joshua John Russell,Man About Cake,137286,7529,68,901
CrwmpuwLBiI,The only The Last Jedi Trailer Reaction you need,Jenny Nicholson,135791,6871,546,1526
xCIfqg4W7-U,Banana Bread Bake-off: Shayna Taylor's Recipe,LIVEKellyandRyan,19720,59,5,19
ktc8XDBq93k,GOT7 You Are” M/V,jypentertainment,7959216,761297,7011,151760
CdHV7Uzw2E4,The most UNDERRATED lens EVERYONE needs!,Peter McKinnon,256223,16598,164,1943
akGWOpcWfrQ,Northern Ontario Moose vs Wolf,Dan Nystedt,1654276,5095,190,656
eN6JVKmMUhw,Johnny Drille - Romeo & Juliet ( Official Music Video ),MavinRecords,65369,1659,84,246
J5b_-TZwQ0I,Confederacy: Last Week Tonight with John Oliver (HBO),LastWeekTonight,4773215,128708,11052,28231
P_X6hIyqUxA,Vikings vs. Bears | NFL Week 5 Game Highlights,NFL,684930,5435,319,1738
SpMhnqnbh0g,My Friend Dahmer - Official Trailer (US) - FilmRise,FilmRise Releasing,149669,1136,6,148
JxEj2ZjgNzs,DANCING QUEEN  **RAINBOW**  CUPCAKES - The Scran Line,The Scran Line,45488,3016,26,214
rJTkHGXMdb0,What Would Happen If You Were Born In Space?,Life Noggin,776401,20048,651,3818
bkxoHhafkqQ,How To Make A PUMPKIN SPICE LATTE CAKE With COFFEE BUTTERCREAM | Yolanda Gampp | How To Cake It,How To Cake It,539203,25812,218,2438
y8fZDZHSl7Q,Trying out the ENTIRE Fenty Beauty Line!,Dulce Candy,32248,1430,52,159
4CyvvCx6Us0,Best Wash-N-Go EVER! | Natural Hair,Mini Marley,61995,5711,61,382
3JYl1XREYLE,TASTING EXTREMELY BIZARRE POCKY FLAVORS!,DavidParody,366650,17743,708,2998
fhYYdeAC3BI,"Last Week Tonight with John Oliver - Oct 8, 2017",TV Shows,847286,5662,1714,1520
URvC6T_xhE0,In Real Life #BeStrong,In Real Life,215197,5506,1130,1735
5Vd10gwNJRs,Frankie and​ ​Witney’s - Quickstep - Dancing with the Stars,Dancing With The Stars,280431,1322,15,72
bB01zORIGkA,Making a Plasma Coil Bottle Launcher,NightHawkInLight,220491,7444,115,1092
-UAdFerZMWc,"Watch Us Build a 7,500 Piece Lego Millennium Falcon | WIRED",WIRED,35730,1311,44,160
N1bJ5Vv3iUg,3AM Challenge In A Haunted Castle (SCARY),Rclbeauty101,292191,11673,233,6334
yARn15Ks1DE,COVERGIRL #IAmWhatIMakeUp | Made In The Mirror,COVERGIRL,1429939,449,119,147
R7y6fm0XTpg,Cod Liver Taste Test,Good Mythical MORE,438430,9521,434,1192
r9-DM9uBtVI,JUSTICE LEAGUE - Official Heroes Trailer,Warner Bros. Pictures,18497518,294413,15813,55331
nrzbCPOcIJk,I Wore The Ugliest Jacket In The World For A Week,Safiya Nygaard,2605124,125753,1657,11614
SeUyzOP3mys,Intense 🎙️ ASMR 🎙️ Sounds,Gentle Whispering ASMR,780795,22541,972,5018
p-xtcaAOTEE,Post Sugar Crisp Sugar Bear vs Granny Goodwitch Cereal Commercial,VintageTVCommercials,12117,21,0,11
0uUFf8IomLg,Metro Manners PSA: Super Kind - Aisle Blocking ブロキング,Metro Los Angeles,54303,666,17,59
iGHDJ2_hsKE,The Efrons | Tested Tough,Columbia Sportswear,296980,4309,368,397
4RPso1_xMYk,Racist Lawyer Rant,Video Library,4517,10,9,31
mKee5Xezp_0,I LET A BOY PICK MY HALLOWEEN COSTUMES | ft. Caspar Lee!,MyLifeAsEva,614477,38094,399,3206
WStmFKp1x3g,Hot hand fallacy,Davide Quaranta,150485,730,1980,871
W_E9wivFlpE,Why I Left GMM,Good Mythical Morning,3115373,110378,34120,32349
a5F05Qpi6lM,Meghan McCain Joins 'The View' As Co-Host | The View,The View,230041,1502,1627,1945
5al17hlhowA,Boyfriend Buys My Outfits | Grav3yardgirl,grav3yardgirl,417189,33214,345,6216
kRW3Y-rgaOs,100 People Tell Us a Secret,WatchCut Video,718460,20738,256,2366
-LoSw4o2zDQ,How to Make Pusheen Brownie Pops! 💕,kawaiisweetworld,56094,4430,27,449
UJKl7ToDi20,UCF Football: Space Game Uniform Reveal,UCF Knights,8812,37,0,3
GttcbM4GxLo,100 TUBES of MASCARA - Faves & Hates - MAKEUP GRAVEYARD,Tati,572297,24926,637,4391
IP81Je7APoQ,"I Love You, America: The Song (Official) • I Love You, America on Hulu",Hulu,1480971,946,3691,2166
I4qv0c2-lfw,"Cassie On Marriage, Dealing w/ Rumors & Short Film",HOT 97,61658,592,50,310
ucWPplMZnH4,MAKING RIHANNA'S CLOTHES *for cheap!*,Amber Scholl,436110,22080,805,2388
gWzPYsSCExM,The ONE thing every artist NEEDS to know,ANDREW HUANG,104215,6261,50,868
RsYU2f3Q6kI,Rogers 6047 Additron,uniservo,2675,44,1,12
j8ziXMTpkL4,5 Sushi Gadgets put to the Test,CrazyRussianHacker,2007905,45033,2472,8300
RVSSCN2ts_g,A very persistent brat,RM Videos,95764,642,54,114
KbYCmEptlL8,Blindfolded Makeup Challenge | Jordyn Does Kylie's Makeup While Blindfolded,Kylie Cosmetics,1479383,63020,2070,2728
cqpg9IJ0jbg,Star Wars: The Last Jedi - Trailer Reaction,Jody's Corner,45289,869,122,177
iZFWRi3npiA,Chance the rapper gets pulled over in Chicago I have Faith,AMAZING HOODFACTSUNCUT,190799,191,679,398
IRdrt8nPyy8,NY Comic-Con Official Trailer: THE X-FILES | Season 11 | THE X-FILES,The X-Files,887297,11406,532,1985
r8qWc9X4f6k,Is DNA the future of data storage? - Leo Bear-McGuinness,TED-Ed,156314,9183,81,795
QvP8fd2W_6A,Extraordinary Kids fly in ZERO GRAVITY !  4K,AIRBORNE-FILMS,21739,273,5,24
ufE-HaySXSg,Here's the age you peak at everything throughout life,Tech Insider,202127,4805,699,679
y_nuMEtwUW4,Mike Leach Goes Off: Expand the College Football Playoff,KREM2,22543,81,0,39
tetLuLLWxKM,"Future, Baby Future and Fam Do Disneyland | TMZ",TMZ,6435,16,5,5
wmca2wWi1CM,Kit Harington’s Epic April Fools Day Prank On Rose Leslie - The Jonathan Ross Show,The Jonathan Ross Show,3368868,8061,216,447
lIkbdfBAdZQ,S.S. CORNMUFFINS GOES FOR THE FLIGHT OF A LIFETIME,APaperPlaneADay,32211,0,0,43
6eHExt8C0qw,PROFESSOR MARSTON & THE WONDER WOMEN | Final Trailer,Annapurna Channel,578603,564,180,228
aiUq5xksJy0,3 Surprising Things Matter Does Under Extreme Pressure,SciShow,358494,11959,179,658
px1WIBaFseE,What Are the LARGEST Creatures That Exist RIGHT NOW?,The Infographics Show,149498,4326,120,717
o6H0OPgg1qA,The Walking Dead Season 8: Season Premiere NYCC Sneak Peek,amc,855013,13768,1232,3623
pqdaskhEa0I,"Tim McGraw, Faith Hill - The Rest of Our Life",TimandFaithVEVO,833978,9825,431,406
XCWmONajkOg,"Hailee Steinfeld, Alesso - Let Me Go (Lyric Video) ft. Florida Georgia Line, watt",HaileeSteinfeldVEVO,860667,58272,348,1980
y4D1KtVetKM,PANCAKE ART CHALLENGE WITH COLLINS KEY! Learn To Make Emojis Out Of DIY Pancake!,Wengie,8059718,656526,7516,172790
Mhfg2lVpW8k,GoPro: Nate Adams - GoPro Kind of Day,GoPro,105214,3841,75,202
Xa-FV6Oxp1M,Pumpkin Spice PASTA?! Testing 20 Pumpkin Spice Foods! Alisha Marie,AlishaMarie,1403986,69101,1194,12025
b-3YW03RR0I,Husband VS Best Friend | Tom Daley,Tom Daley,136218,10165,62,764
5NX-U36VDis,Building the Ultimate PS4 Pro,Austin Evans,889108,30310,1506,4431
Y61Q5w8qdSw,IT PENNYWISE GLAM HALLOWEEN MAKEUP TUTORIAL,James Charles,1036744,76161,11376,11924
qCH73iQAZS4,Demetrious Johnson vs Ray Borg | Highlights | UFC 216,UFC ON FOX,370255,2020,403,1190
20yqGk-M-iI,Jacob Sartorius Gives RAW Interview,RAW,20710,1508,213,122
GmrFu7I-bBE,"MNT vs. Panama: Highlights - Oct. 6, 2017",U.S. Soccer,49378,563,38,296
7wsYiuNERZA,"Early THOR Reactions Are Outstanding, Zelda Movie Chances - The John Campea Show",John Campea,29894,1249,49,810
MRNqDbd2rdE,Nick Saban tells media they're feeding his team rat poison following Alabama's win over Texas A&M,Alabama Crimson Tide on AL.com,106619,753,92,316
s7u5igc-lFg,How Pink Was Once A Boy Color,KnowledgeHub,148641,8945,215,1994
VC7ZqkV1_yw,Why rap swept the nation,1791L,152236,11671,740,3241
TP0PsCb371E,Stelter: Weinstein firing is an earthquake in Hollywood,CNN,45080,331,299,1070
9chSjcOM5og,Brian Lewerke's 14-Yard Touchdown vs. Michigan,Big Ten Network,155230,586,352,234
yWatz9TAgT0,GET READY WITH ME | Teacher Evolution Ep 10,Pocketful of Primary,34053,1444,37,502
T2rqOvijMBk,Stray Puppy Befriends Travelers Who Find Him a Home  | The Dodo,The Dodo,154748,4855,52,402
R1ZXOOLMJ8s,Stranger Things | Season 2 Final Trailer [HD] | Netflix,Netflix,4244755,172239,1807,16676
i3-Nf3cxlmg,Russell's four RBIs lead Cubs to NLCS: 10/12/17,MLB,346675,1993,580,686
bu9e410C__I,The New Mutants | Official Trailer [HD] | 20th Century FOX,20th Century Fox,3250607,24306,3582,6886
oKzFGhlFqqE,"Harvey Weinstein, Donald Trump and Systemic Sexism: A Closer Look",Late Night with Seth Meyers,1627553,26896,4054,4931
OlI8r3nNUVw,NO POMEGRANATES,Jan N,620290,23216,334,4336
rgbnZG85IRo,What Americans Heard in Cuba Attacks: The Sound,Associated Press,574050,2088,1627,0
uB_Kx6T3wq4,Rose Gold & Purple Smokey Eye | Jaclyn Hill,Jaclyn Hill,603428,36875,1452,5367
M16CGK1T9MM,Why Photos of the Eiffel Tower at Night are Illegal,Half as Interesting,1054604,21227,2323,3834
