video_id,title,channel_title,views,likes,dislikes,comment_total
5qkgFES0r-U,LEAVING YOUTUBE... chit chat get ready with me,James Charles,704354,30330,2852,2832
o7H7xdjGnCc,Pennywise IT Halloween Costume & Makeup Tutorial,Jordan Hanz,74054,6872,38,556
e7acWkAb1dA,Hack It Like a Chef - The Effortless Midweek Meal,SORTEDfood,105917,3595,48,218
6IlVWeI_0yo,Audi Think Faster: Episode 2 Featuring Elizabeth Banks,Audi USA,37915,192,44,42
6QZiqFAeK_g,Lindsey Vonn | UNLIKE ANY,Under Armour,259243,84,15,9
uE_hF1R20rg,Jared Leto says he never gifted used condoms | SiriusXM | Entertainment Weekly Radio,SiriusXM,24703,402,4,54
-6Zc8Co2H3w,Honest Trailers - Star Trek: The Next Generation,Screen Junkies,1956813,49656,1287,6894
BNJUsE7pEs4,Hansen Unplugged: Anthem protests not about disrespecting the flag,WFAA,768040,18795,2062,2487
LtJ60u7SUSw,Darkest Hour - Official International Trailer (Universal Pictures) HD,Universal Pictures UK,443500,361,11,91
4AsSp0AhlBc,The Hidden Detail You Missed about Stranger Things’ Shadow Monster! (Nerdist News w/ Jessica Chobot),Nerdist,53340,1700,33,94
R42GHW6RY20,Terror Jr - Fight And Fuck,Terror Jr,13671,921,8,71
s7eVr-OUYkQ,Grateful (Official Lyric Video) - Elevation Worship,Elevation Worship,32572,1447,19,0
noVEvsozyug,Date Meal  [pasta] - You Suck at Cooking (episode 66),You Suck At Cooking,613640,25595,350,1968
cq50fkILrwM,September FAVOURITES | Fleur De Force,Fleur DeForce,98036,3029,69,153
LVPIM06bMJo,Man Feeds WILD SNAKE Friend A Snack | The Dodo,The Dodo,314551,9745,188,974
LXAU1VqbYbo,Eating The WHOLE Animal! NINE Course NOSE to TAIL Feast in Singapore,Strictly Dumpling,265279,7939,182,741
Rg_Msa0CAqk,Dating the IT Clown | Hannah Stocking,Hannah Stocking,3619723,127552,4725,5506
Kz-3PgnD1vM,Katy Perry: Will You Be My Witness? - Official Trailer,Katy Perry,131589,9512,261,605
PD7OWHNAUqY,Is It Art? The Rise of Made-for-Instagram Exhibits | WIRED,WIRED,17248,667,143,141
Gv69uNr3Tf4,The Voice 2017 Blind Audition - Dave Crosby: I Will Follow You into the Dark,The Voice,2732335,37996,1039,1674
QpfgRpL1VVk,Grey - Wings Clipped (ft. Avril Lavigne & Anthony Green) (Official Audio),Grey,28770,1763,15,248
15ugV2ASveg,Camila Cabello - Havana Acoustic | Elvis Duran Live,Elvis Duran Show,469549,34958,316,1694
Y12lF3cYufo,Clash of Clans - Builder Hall 7 UPDATE!,Clash of Clans,1953823,45960,2708,2048
IKaMejA5J34,Sam Smith - Too Good At Goodbyes (Galantis Remix),Galantis,116912,7495,205,437
7e4vFMJmBIc,The Chaos President Cold Open - SNL,Saturday Night Live,4133628,40667,8129,8455
y_v-3_sPsRM,Poppin Bottles w/ Instagram Models,sWooZie,905808,52993,1195,4551
zrOHeEA14kQ,O.J. Simpson Freed From Prison After 9 Years,Inside Edition,201754,2905,592,1751
JJ5WP2BKigc,Unboxing The Mind Bending Wallpaper TV...,Unbox Therapy,1883596,59722,1968,7593
zHdJwBrT3WA,Game Theory: The Pokedex is FULL OF LIES! (Pokemon),The Game Theorists,1544314,59195,4309,29024
96LawfHPh6s,"250,000 DOMINOES! - The American Domino Record - Smarter Every Day 178",SmarterEveryDay,802983,25037,976,5252
9sjLzdix70w,Pittsburgh Steelers Vs Baltimore Ravens National Anthem 10/1/17,Random Ryan,100378,565,1131,971
p-305IQw6-I,BOUGHT MY PARENTS A MANSION! *emotional*,Wassabi Productions,1141430,101981,1157,18682
0bcHEsmmpzU,HOT DOG INSIDE A BURGER - VERSUS,HellthyJunkFood,639212,14084,1223,3574
8RlChzDl1Tw,"Eat, Clay, Love | Original Short Film",Julien Solomita,217574,40553,521,4671
qbRKHpE-30Y,THE MICROWAVE CHRONICLES | Microwave Moments on Kitchen Nightmares,Kitchen Nightmares,710868,10968,205,2035
K7pQsR8WFSo,Schlieren Imaging in Color!,Veritasium,472072,24247,234,1980
h3M-3SrmDok,Moments after Raw went off the air - WWE Top 10,WWE,2083525,36482,1677,2788
bY8-TUD3_Zo,"Film Theory: Pickle Rick ACTUALLY WORKS! (Rick and Morty, Feat. DAN HARMON!)",The Film Theorists,3222303,122462,12650,18060
BnxkuaQxe9A,The best photos taken through a microscope,Quartz,43589,974,18,54
c3JbJmXInOs,Every Tinder Ever,Sam O'Nella Vlog,943802,16870,783,1152
iwGP_FeheLM,How to be Gangster 2.0,nigahiga,3319745,196656,3091,19958
RCWDMmJHv0w,The perfect thing for a hangover!,JennThe Mermaid,369619,1878,3882,0
_dJbQayd4MQ,When your kid annoys you part 4,Jamie Baker,438822,8495,477,730
OZ5kXgYW5cE,The Shark Tier List,TierZoo,294791,22609,163,4256
eVIezLcwc7s,Margot Robbie TATTOOS One of the Production Staff! | The Graham Norton Show,The Graham Norton Show,1215597,16926,407,1260
Wp21hAL1mOU,I put YouTubers on my nails and they all saw,Simply Nailogical,1387283,96417,1222,10920
APHgDFRpCi0,"J Balvin, Willy William - Mi Gente featuring Beyoncé",jbalvinVEVO,10736487,389230,19957,31269
JV1NB70gLQI,Most Powerful Corporations in the World?,The Infographics Show,273250,6554,418,1479
ON3x2wWZLHk,Catalonia referendum: Voters confront police in Barcelona,Al Jazeera English,181018,1001,167,1733
pCHmqeHEybg,Is Superman Too Overpowered?,VariantComics,222336,6510,574,2837
5pvkw5KkQuw,콜린퍼스가 직접 말해주는 신사답게 옷입는법!!?,영국남자 Korean Englishman,740491,20834,218,2024
tl6w1-IlyDs,I Dressed Like Store Mannequins For A Week,Safiya Nygaard,2744830,157519,1245,11913
x5Ps13AeXxQ,Letting a Dream Die,katilette,1251500,71542,3096,19848
VSrEIdhrXB4,How to Build a Teleporter with Aliens,minutephysics,379275,15934,605,1817
khRWGSllNKw,Shameless | Season 8 Official Trailer | Only on SHOWTIME,Shameless,482303,11897,215,1253
w7h--c54_O8,WE BARE BEARS CUPCAKES - NERDY NUMMIES,Rosanna Pansino,409047,23639,219,7733
HUUsEgAe8x4,MONSTER FROGFISH FOUND!,Brave Wilderness,2526125,43626,1232,6597
VPo2k2z7Xqg,New Yorkers Help Us Write An Inspirational Jam! The Key of Awesome #126,The Key of Awesome,54154,2432,124,423
IUkNNDg18mY,Real Life: THE GAME!  (w/ Lilly Singh),AnthonyPadilla,719639,47905,787,2186
zmg9tVaMVd4,Shania Twain - Swingin' With My Eyes Closed,ShaniaTwainVEVO,780343,10736,1303,1578
xGuGjvIfof8,My Favorite Tech of the Month - September!,UrAvgConsumer,252038,9790,386,912
F5D1x-OtGME,Top 10 Saddest Deaths in Harry Potter (SPOILERS) (VERY SAD),jacksfilms,817225,74530,2013,9661
JhyTKIwar1k,Message Impossible | Lele Pons,Lele Pons,2897731,128601,5205,6362
Mw5T62dJzhQ,The ancient city designed to track time,Vox,339963,11853,266,1057
2UMfEfUR7wM,Echosmith - Get Into My Car [Official Music Video],Echosmith,283716,12539,545,1454
2eAuJIGlp9I,Stephen Colbert Becomes Steven Seagal,The Late Show with Stephen Colbert,1432660,16279,3009,3332
WfjZ1otkS3o,Lt Gen Silveria addresses cadets about racism incident,USAFAOfficial,1036474,19759,761,4822
-q47sHA4eAo,What Happens If You Drop a Nuclear Bomb Into a Hurricane?,RealLifeLore,1731165,39149,2073,6557
GO6qs83CHpc,Sneaky toddler steals Prince Harry's popcorn,The Royal Family Channel,14643773,54935,6244,6245
zyPIdeF4NFI,Guess the YouTuber's Voice Challenge with LILLY SINGH AKA SUPERWOMAN!,Molly Burke,29349,2269,55,221
tmGMd2bqh6o,Casually Explained: Evolution IV - Hello Universe,Casually Explained,665451,35906,655,1594
Ri4xPHGS5f8,O.J. Simpson walks out of prison after release,CNN,34131,235,108,545
KPqtlI3aJIE,Sam Smith - Too Good At Goodbyes (Live From Hackney Round Chapel),SamSmithWorldVEVO,2318484,116997,756,5604
htpR770aP2k,"Trump Lies About Taxes, Health Care Amid Cabinet Scandals: A Closer Look",Late Night with Seth Meyers,2039320,24145,3737,5019
zqE-ultsWt0,BFR | Earth to Earth,SpaceX,2390080,45519,880,7945
g85RGiOgUtI,"I Spent $1,000 on MILK Makeup, And....",Jackie Aina,551196,31962,901,3901
q3br7KKr67o,Pumpkin Spiced White Hot Chocolate | Episode 1197,Laura in the Kitchen,68650,4096,69,261
8I8G5XQI9_w,BUG PUPPET + DRUM PADS,barnabydixon,41130,5151,29,510
_cu4FHyCcT8,Would you eat an Apple like this? - Food Life Hack,DaveHax,367723,6206,932,911
EWeJ7OM3mo4,What's This Video About?,vlogbrothers,162877,9013,228,1287
tp9aQXDFHbY,Cats Can Be A Real Pain In The Grass - Simon's Cat | STORYTIME,Simon's Cat,248729,9103,183,481
03IUgOd4GH4,73 Questions with Helga | Vogue Parody,Liza Koshy,6153971,421517,6692,19474
-FMGfnYJ1hE,Syracuse Football: Dino Babers Post Game NC State,Syracuse Orange sports on syracuse.com,2466,1,1,0
2nFO0sMs9Zs,Sam Smith - Father Figure in the Live Lounge,BBCRadio1VEVO,124278,3132,62,161
xmZ1ppujkXg,Harrison Ford and Jimmy Sip Glasses of Scotch and Tell Each Other Jokes,The Tonight Show Starring Jimmy Fallon,723786,10493,365,934
3X3xtRNb20s,David Guetta ft Justin Bieber - 2U (Official Video),David Guetta,1521496,76531,3473,4912
QKy1OazdMD0,Free gifts at your neighbors door...,David Carter,205636,452,57,108
qiUKuZQRsWo,Bears vs. Packers | NFL Week 4 Game Highlights,NFL,1110677,9310,1068,1860
uKQ8iy3U1lw,Upchurch Johnny Cash (Official Music Video),Ryan Upchurch,368317,12057,1291,1819
5Wiio4KoGe8,Maroon 5 - What Lovers Do ft. SZA,Maroon5VEVO,5132921,209456,3985,11279
JkqTeQHFoBY,Guardians of the Galaxy Vol. 2 | VFX Breakdown | Framestore,Framestore,90020,917,9,48
UQBNfV9sTCE,Picking up my NEW Mclaren LIVE!! Take 3,Salomondrin,239311,7924,236,744
8-M7WA1qX1g,finding out i can never run again,CaseyNeistat,4341179,149235,20274,14690
Ap5hoCTkTUM,"Hold the Door! | Anwar Jibawi, Inanna Sarkis, Hannah Stocking & Lele Pons",Anwar Jibawi,1986284,82241,2190,4372
e21VLQGCJTg,KB - DNOU,Reach Records,55199,2793,43,474
439iY0844xI,Aladdin Makes No Sense,SuperCarlinBrothers,494218,17705,1230,3158
4xbFVdoRzLQ,How To Stop A North Korean Nuclear Missile,Real Engineering,353758,12580,347,1513
8rhb5wTCero,dodie - 6/10,dodieVEVO,489193,80492,481,8374
5PaDeyRNUyc,Introducing the Kylie Cosmetics Fall Lip Kits,Kylie Cosmetics,2205743,69723,6375,6956
nIZb34JnFEw,HURRY UP BLOOPERS!,SUPERFRUIT,162081,11278,111,803
1z3cp_Mh8bA,Prince Harry's popcorn swiped by toddler,CBC News,1616537,8359,346,1083
7uOvL5eLpeE,Jeremy Camp - Never Stopped Loving,JeremyCampVEVO,40106,2280,23,163
_Pom2EYv3NM,Kelly Clarkson - Move You [Nashville Sessions],Kelly Clarkson,58651,3372,18,256
BBn_fo8NprY,"What Really Happens In A Women’s Washroom (ft. Inanna Sarkis, Hannah Stocking, & Lele Pons)",IISuperwomanII,3194027,215367,3385,8980
QB5JOnDYeHY,Wanda Sykes Confesses Everything While Eating Spicy Wings | Hot Ones,First We Feast,1302368,39808,2283,6041
nvAhI3ZjnjU,Jamie Foxx and Jay Pharoah Play the Impressions Game,TheEllenShow,1139711,16968,638,617
GWKI-CoCCTU,"HANDSTAND AT 40,000Ft!! | World Championships Vlog (1)",Nile Wilson,186994,7738,122,554
gLj21uNEzqA,Demi Lovato - Sorry Not Sorry (Vevo X Demi Lovato),DemiLovatoVEVO,1022106,80554,430,2548
aTF84_CqzxQ,Mosby's Motto,Tyler H,203727,3046,148,102
omdov-S2tSA,Kaley Cuoco Reveals Awkward TSA Encounter,Jimmy Kimmel Live,239849,2054,102,293
_r5eTelhpmQ,Darius Rucker - Life's Too Short (Audio),DariusRuckerVEVO,37400,1595,43,89
WQyiY5qC_us,Is DC Rethinking a Shared Universe After Justice League? - SJU,ScreenJunkies News,45402,1137,142,678
T58NGMrUp0M,AT&T: The Company Behind the Telephone,Business Casual,68560,1945,42,239
FlwK54Qun3Q,Chris Young - Hangin' On (Lyric Video),ChrisYoungVEVO,52316,2275,21,97
2DTwXdqmRiM,Channing Tatum Grooms James Corden for Magic Mike Live,The Late Late Show with James Corden,2098986,38293,925,1140
pyb7UqbdYTs,Alex Aiono - Does It Feel Like Falling ft. Trinidad Cardona,AlexAionoVEVO,183219,18427,142,1104
fmIGnd98DX4,How You Really Use Exercise Machines,CollegeHumor,872733,26550,790,842
B9SptdjpJBQ,How To Learn Faster,AsapSCIENCE,960993,46095,485,1528
V_U6czbDHLE,The surprising cause of stomach ulcers - Rusha Modi,TED-Ed,366528,14476,214,605
ZaB6kENkGVg,New Thor: Ragnarok International Trailer Featuring More Hela - Movie Talk,ColliderVideos,51925,1614,77,419
1k_whpRADOE,The Last Word: Hugh Hefner,The New York Times,163364,1812,224,594
tq7tHN9HBJU,"WTF !? DO YOU EVEN KNOW ME, FT. SVEN | DESI PERKINS",Desi Perkins,436205,27943,337,2574
mkrTKyhONJ4,"Great Job, C U Next Tuesday! | September 27, 2017 Act 1, Part 1 | Full Frontal on TBS",Full Frontal with Samantha Bee,300412,3891,1713,613
cpvUG_fo6lU,Carmelo Anthony or Dwyane Wade: Who was bigger pick-up? | First Take | ESPN,ESPN,420519,3312,181,1379
i29zfPUHRAQ,Rush Limbaugh on the Pat Sajak Show: Part 3/3,Mike Gardner,6469,15,3,12
41taYOq1kVY,P!nk - Beautiful Trauma (Audio),PinkVEVO,2090385,75157,988,3020
uHCW6nfbosQ,Kimbra - Everybody Knows (Official Lyric Video),kimbramusic,24461,2564,11,337
ufaDurSCKOk,Annihilation (2018) - Teaser Trailer - Paramount Pictures,Paramount Pictures,5520472,28421,2684,3508
aw28GKtWxBw,The $100 14-inch Pizza Challenge (I did it twice),Matt Stonie,1666414,53292,1840,4716
lfPvOEN5vaA,Woman forcibly removed off Southwest flight,CBS This Morning,972059,3286,4460,3299
NSFXDaMFUN4,Tara where are we?,LTavvy,235022,0,0,95
xnSew-tCuPo,Building a Solar Powered Workshop,HomeMadeModern,349266,23613,495,1176
cyN6GMY78D4,BØRNS - Sweet Dreams (Audio),BØRNSmusicVEVO,106384,11276,40,1064
GNTtR6ZpUOo,The Floppotron: Doom E1M1 - At Doom's Gate,Paweł Zadrożniak,93873,7341,26,710
pgCtsVdK4HA,Joe Goes To The Juggalo March,Joe Goes,66524,3055,108,537
H3YE_oGD05M,How To Make Every Popular Mexican Dish... VEGAN,Brothers Green Eats,28076,1262,106,230
AJK_eE9TfkU,President Donald Trump Addresses National Association of Manufacturers (Full) | NBC News,NBC News,14532,146,111,0
DtsWj9XiOIY,"1,000,000 THANK YOU!",Amber Scholl,275080,51626,248,10611
GuEQtn2nm9A,Meet The Black Comedian Who Has Become Japan’s Most Unlikely Star (HBO),VICE News,81757,2528,177,636
FwT9nx8GHxE,What Will Happen To You in The Microwave?,Meet Arnold,2192954,74544,2722,7834
rh8b-Ibzkfg,WILD SPACEAGE HALLOWEEN ALIEN TRANSFORMATION | John Maclean,John Maclean,30166,2663,44,552
JQAYFbcgf60,DARKEST HOUR - Official Trailer 2 [HD] - In Select Theaters November 22nd,Focus Features,946492,184,18,34
i86M4zj_Kec,Steven Seagal Calls NFL Protests 'Disgusting' | Good Morning Britain,Good Morning Britain,656690,3129,5696,0
H1YGg8nYkv0,VIDEO: Woman dragged off Southwest Airlines flight,CBS North Carolina,1252355,4164,1846,7422
Z_GR_l5QtdM,Little Dragon - Peace Of Mind (feat. Faith Evans) [Official Music Video],Little Dragon,41287,2249,18,181
lSsTCiC93WI,Green Lantern - Nostalgia Critic,Channel Awesome,827684,27898,1504,5656
TO5cYWd12lQ,My First PC Build with Austin Evans !!!!,Sara Dietschy,52055,3290,65,647
S_DltnHeJ-M,32 THINGS I'VE LEARNED THIS YEAR // Grace Helbig,Grace Helbig,135260,10907,49,480
rrZk9sSgRyQ,BLADE RUNNER 2049 - Black Out 2022 Anime Short,Warner Bros. Pictures,429818,16182,172,1187
Y5wOTID9JmY,New Dad Andy Samberg’s Epic CONAN Entrance  - CONAN on TBS,Team Coco,239430,4669,167,265
MHzktkbjDOE,Under $300 Bedroom Makeover | Mr. Kate Decorates on a Budget,Mr. Kate,1020561,49907,617,2541
9j9RrWgo5rE,Jane Fonda Recalls The Moment She Knew Robert Redford Would Be A Star | Megyn Kelly TODAY,TODAY,312196,204,237,187
De9hDyIN6JY,Samoa Hotshot crew 61.  2017,Lori Light,66342,468,10,31
R3dQpGJQI18,FLETCHER - You Should Talk (Official Audio),FLETCHERVEVO,30110,3401,4,255
GRDoasFyesU,Trying $3000 Lace Front Wigs With Pia Muehlenbeck!,Chloe Morello,193778,5611,290,530
v90yrcg6q9I,Hugh Hefner Dead at 91 | E! News,E! News,119136,644,193,1247
Y2GVVC_cD_E,73 Questions With Zac Efron | Vogue,Vogue,4397111,145752,2664,8974
SHobkpQ9GOM,What Emmy Eats in a Week #6,emmymadeinjapan,93878,4032,145,409
-Jdc7FXupWQ,Gwen Stefani - Santa Baby (Audio),GwenStefaniVEVO,47618,2794,63,309
ml8Dj5OSR-M,What's the Northernmost Town in the world?,Half as Interesting,216941,7319,248,732
zV0dpCG-8go,Adam Ruins Everything - Why Filing Taxes Is So Hard (Tease) | truTV,truTV,331101,6914,185,624
7qLrKUtV0Kw,Not a baby brother!,Siobhan O'Brien,146392,358,90,137
MHMdv2D7ndc,EDEN - start//end (official video),EDEN,284649,26990,144,3316
aeUyLiIlDVE,Peter Helliar in a Finnish Sauna - The Project,TheRealFake00,127287,230,18,22
xffuHHjO_Us,Bea Miller - brand new eyes (From Wonder/Official Video),BeaMillerVEVO,146689,18183,54,765
3ImE5jhnOt8,Cider-Braised Pork Shoulder - Pork Stewed in a Creamy Apple Cider Sauce,Food Wishes,158477,5615,69,440
G_wmoWfZQAM,Makeup Tips & Secrets With Superstar Ariel Tejada | Shay Mitchell,Shay Mitchell,808999,40030,729,2245
vr0qNXmkUJ8,GoPro HERO6: This Is the Moment in 4K,GoPro,826192,20915,193,1229
ELQfBOJOds0,Kate McKinnon Improvises a PowerPoint Presentation | Vanity Fair,Vanity Fair,120659,3379,87,201
IvQQJmWdtH8,First Aid Kit - It's a Shame (Audio),FirstAidKitVEVO,56504,2095,20,187
AYrTkoRr6hk,Rep. Steve Scalise returns to Congress (C-SPAN),C-SPAN,13317,299,34,114
BqL9T0_ClUg,'Playboy' Founder Hugh Hefner Dead at 91,Entertainment Tonight,44540,528,45,568
ZymSrDfLhW8,"Randall Cunningham Seizes the Means of Production | Pretty Good, Episode 13",SB Nation,53744,2772,76,544
tJfIZlZVhqM,Reese Witherspoon Passionately Speaks About Roles for Women | Lorraine,Lorraine,12877,34,1,0
mC1qPDqV6hM,Google Ultra Pixel - New Pixel 2 Smartphone LEAKED?,Mrwhosetheboss,505869,9500,1084,1339
OmTb_ea1K5U,WHAT IS THIS CHANNEL? / Gaby & Allison,Just Between Us,79144,6451,40,367
VcMuDnnaBvw,KUWTK | Kim Kardashian Calls Caitlyn a Liar Over Her Book | E!,E! Entertainment,1010709,5566,681,864
tqUKbEfW-B8,IGN Live: Red Dead Redemption 2 Trailer Reveal,IGN,315637,6223,691,399
nd_EYo96lmo,U2 - You’re The Best Thing About Me (Official Video),U2VEVO,881163,20543,874,1626
RxIh_0q524c,Chemotherapy Effects Not Working!,Wil Dasovich,359654,14511,134,2224
_SzWAfsdZXY,The Killing of a Sacred Deer | Playdate | Official Trailer 2 HD | A24,A24,134056,1373,48,146
C-V1uXeyGmg,Laser + mirror + sound,Steve Mould,122440,7736,46,840
eImtYyuQCZ8,How Quicksand Causes Dam Failures,Practical Engineering,191850,7653,181,379
_38JDGnr0vA,Blue Planet II : The Prequel,BBC Earth,1280236,33381,289,2278
Co31CGEMeLs,Watford Richarlison Chant - Richarlison Plays For Watford In Silva's Army,Watford Fc,31300,40,0,0
cFVRCo6-FUU,Trader Joe's Pumpkin Spice Taste Test,Good Mythical Morning,1564867,40014,723,3846
ALae1tWyTS8,"Hill, offense lead Dodgers' 10-0 victory: 9/27/17",MLB,25871,203,12,18
wAcD3mIjZcc,Nick Jonas Plays With Puppies (While Answering Fan Questions),BuzzFeed Celeb,337021,18204,58,810
r3wQ8ISV4wc,Preview: The Most Surprising Adventure Yet | Season 1 Ep. 5 | THE ORVILLE,The Orville,11397,264,4,74
-QL9dvmddYs,Ollie's Baby is BORN!! (And MARK STRONG NAMED HER!!!),JOLLY,936084,41787,255,4821
0AaApxaD170,WHITE WALKER GAME OF THRONES  -  HALLOWEEN MAKEUP TUTORIAL,Glam&Gore,251705,20754,130,1098
xQ4oE_tL7IA,BANKS - Underdog (Audio),banksVEVO,201346,12556,103,875
GSmUd7p3r34,Miley Cyrus and Zane Lowe on Beats 1 [Full Interview],Beats 1 Radio,19650,692,20,69
px7dYqZPk6I,PRETTYMUCH - Teacher (Audio),PrettyMuchVEVO,117128,13686,89,1794
mSYEzJ7LM54,Roman Bürki's funny pre-match ritual for Borussia Dortmund ⚽😂,Borussia Dortmund,580190,9237,322,391
8kpD3XCp49o,iPhone 8 Plus vs. Galaxy Note 8 Speed Test,PhoneBuff,452856,9070,953,3598
LnuUkfwqz3c,Watch This,ULOOK2,69349,31,4,34
yJZh9NWdXrE,James Blunt - Don't Give Me Those Eyes [Official Video],James Blunt,174633,8083,91,342
qQGY4NerwOg,Sean Hayes On Working With Debbie Reynolds | WWHL,Watch What Happens Live with Andy Cohen,39712,319,3,15
LaZQ_gj919U,ABN AMRO launches Kaan’s Stream Store - Worlds First Livestream Store,ABN AMRO,80610,574,22,34
scQBjsQNgVQ,Jacob Sartorius - Hang Me Out To Dry,Jacob Sartorius,214045,25578,746,3152
UkMZJrbCRdQ,Why Farming Is Broken (And Always Has Been),MinuteEarth,370200,14416,836,1449
s7eVr-OUYkQ,Grateful (Official Lyric Video) - Elevation Worship,Elevation Worship,37229,1552,19,4
bd7IGZ6dulM,I Spent 24 Hours in Complete Darkness & Silence and It Sent Me Crazy (No Senses Challenge),Kill'em,460448,16812,1467,4370
OLTXWUWcwOo,Queen Sugar Star Kofi Siriboe!,Wendy Williams,203718,4163,119,958
MuhbA_bB418,RAPPING FOR A JOB AT VAYNERMEDIA,DKIRK,1224851,25127,1577,1537
3uxsHmxQBHA,"Jon Cozart Roasts Lilly Singh, Liza Koshy & Casey Neistat with a Song - Streamys 2017",Streamy Awards,1788736,86388,1415,3922
03jeumSTSzc,Reading More Fables (I swear I'm not a furry),TheOdd1sOut,3578130,197198,2988,41119
vgDiV94Hz1I,Luis Fonsi - Despacito (Beatbox Cover) | Hiss & Bigman | Shout out,Korea Beatbox TV,856071,22753,603,1537
LDXr12ToYuM,i'm not okay.,The Gabbie Show,2232484,173964,3539,15569
iTUsiJh9PgE,Dramatic Vampy Fall Makeup Tutorial,Christen Dominique,251501,20853,204,1497
K20YGjVkZRw,HUSBAND + FATHER STRUGGLES || #MOMTEMBER,From Head To Toe,74711,4035,46,299
yAZwhN-WKGg,"76ers' Ben Simmons: Donald Trump is an 'idiot,' 'd***head'",NBA Highlights · YouTube,21837,71,38,97
QJVlhvyLmPw,The Ford GT drives the iconic Atlantic Ocean Road in Norway (+Arctic Circle Raceway),Ford Europe,50372,469,4,34
ckXN4Tc6-c8,GET UNREADY WITH ME!,AndreasChoice,227156,13076,263,412
mJSViC_Sx20,Stranger Things | Love in the Upside Down | Netflix,Netflix,383616,12566,229,846
nOQh4NXZ2wo,Petit Biscuit - Waterfall Ft. Panama (Official Audio),Petit Biscuit,114941,6111,64,328
6QZiqFAeK_g,Lindsey Vonn | UNLIKE ANY,Under Armour,339187,86,17,9
yNaLblrdflU,GOTTI (2017 Movie) – Official Trailer – John Travolta,Lionsgate Movies,1004188,4911,554,1593
IKaMejA5J34,Sam Smith - Too Good At Goodbyes (Galantis Remix),Galantis,133705,7989,224,466
88IdVnUESJw,"50 Cent Confronts Ebro + Keeps It Real On ‘4:44’, Trump & Mayweather",HOT 97,795809,8179,463,1888
gDf4RpaMFrk,We Tried 3 Iconic Kim Kardashian Looks KUWTK 10 Year Anniversary | Beauty Evolution | Refinery29,Refinery29,28508,375,34,34
LtJ60u7SUSw,Darkest Hour - Official International Trailer (Universal Pictures) HD,Universal Pictures UK,631815,401,12,110
5qkgFES0r-U,LEAVING YOUTUBE... chit chat get ready with me,James Charles,733261,31013,2926,2898
OFzoFhRlEnY,Las Vegas shooting: GMB SLAMMED over 'unprofessional' Mariah Carey interview,news usa,888010,1157,4600,2299
ruYeBXudsds,Jimmy Kimmel on Mass Shooting in Las Vegas,Jimmy Kimmel Live,465996,35096,2090,7958
-otJ1LJGzcc,Explanation of where the shooting took place on Las Vegas Strip,KTNV Channel 13 Las Vegas,1188032,3580,635,6731
ScmJvmzDcG0,Forensic Science: Last Week Tonight with John Oliver (HBO),LastWeekTonight,2447979,58418,1303,4320
7e4vFMJmBIc,The Chaos President Cold Open - SNL,Saturday Night Live,5702992,52290,13380,13006
QQ6KZN9s5yY,LVMPD Sheriff Briefs Media Regarding Active Shooter 10/2/2017,Las Vegas Metropolitan Police,387189,0,0,0
tUPR5-igTVY,Dear Hate (feat. Vince Gill),MarenMorris,318895,0,0,228
pRnbzkMsgmM,Las Vegas: Mass casualties in Mandalay Bay shooting - BBC News,BBC News,902141,2062,355,5149
0PKthlZtLDo,John Oliver - Puerto Rico and Hospitalized Senator,consumer,340731,4138,550,622
y_v-3_sPsRM,Poppin Bottles w/ Instagram Models,sWooZie,1496462,68366,2114,5538
LGAfo5unZaw,Cookbook drops tomorrow!,Binging with Babish,146981,6832,77,622
-PQBaYuvujw,100 People Tell Us the Worst Thing They've Ever Done,WatchCut Video,514666,15409,283,1872
zrOHeEA14kQ,O.J. Simpson Freed From Prison After 9 Years,Inside Edition,482284,4829,1219,2889
HRNq5O2ieOs,4 Movies You Won't Believe Exist,Good Mythical Morning,609094,18828,341,1827
uoTIcwHK_aw,Things I Feel Guilty About,Jaiden Animations,1844713,128635,846,26185
9zX2BQFZ_BI,"$399 Suit Vs. $7,900 Suit",BuzzFeedBlue,3601422,73509,2701,7723
q2KehxKQ3Zk,Why Puerto Rico will be without power for months,Vox,304266,9416,309,1759
D3bj3PH7PGg,Eyewitness describes chaotic scene of Las Vegas shooting | ABC News,ABC News,367726,1595,311,2585
nBAvUSZSEf8,"Las Vegas Concert Shooting Deadliest Mass Shooting in US History, officials hold morning newscast",ABC Action News,163624,617,112,1725
8z2RgsLSn-c,Miley Cyrus Opens The Tonight Show with Moving Performance of No Freedom,The Tonight Show Starring Jimmy Fallon,114788,11489,118,846
9sjLzdix70w,Pittsburgh Steelers Vs Baltimore Ravens National Anthem 10/1/17,Random Ryan,247959,1197,2422,2017
_oO0pd8VJjY,Late Night Pho,Domics,1461387,123192,711,13630
H4_o4thCQpY,TRL Premiere Opens With Tribute to Las Vegas,TRL,31943,561,80,162
4NJYWgb6dQM,HAIM - Little of Your Love,HaimVEVO,132358,9379,190,588
0VfGA5bE1AQ,COOKING TINY FOOD WHILE CONJOINED CHALLENGE!!,Liza Koshy Too,1783238,158972,747,5015
csrYDgBF2nI,Colts vs. Seahawks | NFL Week 4 Game Highlights,NFL,559140,5193,206,951
1eQXF7JbbGE,Vanessa​ and​ Maks’  - Jazz - Dancing with the Stars,Dancing With The Stars,9761,179,7,59
JJ5WP2BKigc,Unboxing The Mind Bending Wallpaper TV...,Unbox Therapy,2884503,77303,2981,9515
4WNHB8vROg4,Tom Petty & the Heartbreakers~Last Two Songs~You Wreck Me/American Girl~Hollywood Bowl~9/25/2017,Kim Roberts,53765,510,14,185
znX0DeVq72o,WATCH: Sarah Sanders discusses Las Vegas shooting at White House news briefing,PBS NewsHour,33337,240,280,0
ZyHipL45pwM,Steve Martin and the Steep Canyon Rangers: NPR Music Tiny Desk Concert,NPR Music,61860,2602,30,178
zHdJwBrT3WA,Game Theory: The Pokedex is FULL OF LIES! (Pokemon),The Game Theorists,1838951,65295,5046,31742
qy-UZ5B38-Y,Self-Conscious Computer (feat. Anna Akana) - JACK AND DEAN,Jack and Dean,171487,20685,151,923
96LawfHPh6s,"250,000 DOMINOES! - The American Domino Record - Smarter Every Day 178",SmarterEveryDay,947694,27899,1141,5857
_lnPimlBnk4,How to survive if you get stranded on an island in the middle of nowhere,Tech Insider,149425,3349,173,572
_yt7xexSbfI,HOA fight over WWII tank,KHOU 11,10002,47,3,13
O2pyRDQgVjk,What Really Happened the First Time We Split a Heavy Atom in Half,SciShow,326185,13400,275,1072
BnxkuaQxe9A,The best photos taken through a microscope,Quartz,103678,2003,36,100
K7pQsR8WFSo,Schlieren Imaging in Color!,Veritasium,582074,27732,266,2513
p-305IQw6-I,BOUGHT MY PARENTS A MANSION! *emotional*,Wassabi Productions,1418943,116929,1695,20601
0bcHEsmmpzU,HOT DOG INSIDE A BURGER - VERSUS,HellthyJunkFood,746550,15444,1401,3244
qbRKHpE-30Y,THE MICROWAVE CHRONICLES | Microwave Moments on Kitchen Nightmares,Kitchen Nightmares,846080,11873,241,2151
j9UGpBZz7WU,Catalonia referendum: 'Spanish authorities are the criminals',Al Jazeera English,208810,1536,356,1587
V_liC4y7alU,Upgrading a $400 Gaming PC,Austin Evans,354149,12576,608,1575
c3JbJmXInOs,Every Tinder Ever,Sam O'Nella Vlog,1045900,18766,904,1246
8RlChzDl1Tw,"Eat, Clay, Love | Original Short Film",Julien Solomita,309579,50598,827,4627
