video_id,title,channel_title,views,likes,dislikes,comment_total
XpVt6Z1Gjjo,1 YEAR OF VLOGGING -- HOW LOGAN PAUL CHANGED YOUTUBE FOREVER!,Logan Paul Vlogs,4394029,320053,5931,46245
K4wEI5zhHB0,iPhone X — Introducing iPhone X — Apple,Apple,7860119,185853,26679,0
cLdxuaxaQwc,My Response,PewDiePie,5845909,576597,39774,170708
WYYvHb03Eog,Apple iPhone X first look,The Verge,2642103,24975,4542,12829
sjlHnJvXdQs,iPhone X (parody),jacksfilms,1168130,96666,568,6666
cMKX2tE5Luk,The Disaster Artist | Official Trailer HD | A24,A24,1311445,34507,544,3040
8wNr-NQImFg,"The Check In: HUD, Ben Carson and Hurricanes",Late Night with Seth Meyers,666169,9985,297,1071
_HTXMhKWqnA,iPhone X Impressions & Hands On!,Marques Brownlee,1728614,74062,2180,15297
_ANP3HR1jsM,ATTACKED BY A POLICE DOG!!,RomanAtwoodVlogs,1338533,69687,678,5643
zgLtEob6X-Q,Honest Trailers - The Mummy (2017),Screen Junkies,1056891,29943,878,4046
Ayb_2qbZHm4,Honest College Tour,CollegeHumor,859289,34485,726,1914
CsdzflTXBVQ,Best Floyd Mayweather Interview | Awkward Puppets,Awkward Puppets,452477,28050,405,2745
l864IBj7cgw,Jennifer Lawrence Challenges Jimmy to an Axe Throwing Contest,The Tonight Show Starring Jimmy Fallon,258781,8085,303,726
4MkC65emkG4,Hand In Hand A Benefit For Hurricane Relief | MTV,MTV,274358,9215,477,838
vu_9muoxT50,Colin Cloud: Mind Reader Predicts Your Tweets - America's Got Talent 2017,America's Got Talent,473691,14740,415,1696
1L7JFN7tQLs,iPhone X Hands on - Everything you need to know,Jonathan Morrison,514972,18936,641,3817
ZQK1F0wz6z4,What Do You Want to Eat?!,Wong Fu Productions,282858,14870,300,1398
T_PuZBdT2iM,getting into a conversation in a language you don't actually speak that well,ProZD,1582683,65749,1531,3598
w8fAellnPns,Juicy Chicken Breast - You Suck at Cooking (episode 65),You Suck At Cooking,479951,23945,640,1941
UCrBICYM0yM,Downsizing (2017) - Official Trailer - Paramount Pictures,Paramount Pictures,2693468,7941,302,1432
-Ifnaxi2LQg,Fergie - You Already Know ft. Nicki Minaj,FergieVEVO,815608,66420,3578,5550
B7YaMkCl3XA,Hurricane Irma death toll rises to 10 in Cuba,Al Jazeera English,382525,1521,270,1168
5ywKal6-anc,"Gigi Hadid Loses High Heel During Fashion Week, Walks It Off Like a Pro | TMZ",TMZ,703750,2921,2196,1042
4Yue-q9Jdbk,SUPERFRUIT REACTS TO TEENS REACT TO SUPERFRUIT,SUPERFRUIT,255967,21817,293,2017
JhA1Wi9mrns,Kid Rock - Tennessee Mountain Top [Lyrics],Kid Rock,96872,3498,482,439
EVp4-qjWVJE,Chargers vs. Broncos | NFL Week 1 Game Highlights,NFL,743947,6126,352,2438
LcZ2AuvxXNA,Nerf Bow Trick Shots | Dude Perfect,Dude Perfect,10535242,384920,7550,23855
MdzGZv3zQ-U,"Action Bronson and Sean Evans Have a Sandwich Showdown, Judged by Mario Batali | Sean in the Wild",First We Feast,483360,16258,245,1588
1ZNZY-gd3K0,Joe Arpaio: Last Week Tonight with John Oliver (HBO),LastWeekTonight,3298456,65730,4360,9504
2wxyDrfwlXQ,What's In This 90s Mystery Caboodle?,grav3yardgirl,321297,15424,280,3317
QBGaO89cBMI,Radiohead - Lift,Radiohead,752844,42290,359,3250
ql0Op1VcELw,What's Actually the Plane of the Future,Wendover Productions,602127,19575,658,2510
JO7X9ZPoAp8,Blind People Describe Beauty,WatchCut Video,136643,6218,127,524
GGm0FQ6i74U,What Hillary Clinton really thinks,Vox,244433,9143,6826,4838
a7Sf_H2cFdM,Drowning for Power - Rooster Teeth Animated Adventures,Rooster Teeth,917643,25456,731,1073
oDIDZ9EmQfA,Jumping Through Impossible Shapes!,Rclbeauty101,796896,39791,1252,3868
zAtHxJvSczA,Does Maggie Gyllenhaal Have Taylor Swift’s Scarf? | WWHL,Watch What Happens Live with Andy Cohen,2932,71,3,15
l_uNfGY3v8E,"From the air, Irma's catastrophic wrath is undeniable",USA TODAY,224532,490,772,597
Rew50oYjRqA,FALL MAKEUP TUTORIAL | Talk  Through Tutorial | Casey Holmes,Casey Holmes,246389,15314,247,1842
WWexI9YiLSc,The Commuter Teaser Trailer #1 (2018) | Movieclips Trailers,Movieclips Trailers,165647,3712,142,524
LDcm6twPEJA,The Problem With Our Phones,The School of Life,162818,9531,416,1079
O78Lpo4ctSE,LANY - Super Far (Official Video),LANYVEVO,163656,19183,137,2154
qJJHhVf3_ZM,Gwyneth Paltrow Crashes James' Goop Magazine Rant,The Late Late Show with James Corden,220661,2070,449,352
3yoGE3v4A8w,FAIL.. + *New* ESTEE LAUDER DOUBLE WEAR NUDE {First Impression Review & Demo!} 15 DAYS OF FOUNDATION,thataylaa,142039,9889,130,1224
zTjcPeb2Gwg,IM GONNA BE A FATHER (Things Got Awkward),Wil Dasovich,807779,26521,522,5996
hQbeB0YXLhs,Fenty Beauty Pro Filt'r Foundation Review|| Nyma Tang #thedarkestshade,Nyma Tang,1936893,74587,1060,6558
L3f7_y9UPh4,Jimmy Kimmel Talks to Kristen Bell in Orlando After Hurricane Irma,Jimmy Kimmel Live,279903,4389,138,338
HwYK5Ay1YNQ,Hurricane Jose 5 a.m. advisory,WPTV News | West Palm Beach Florida,262875,1069,183,0
6vGg-jJl30A,THIS MADE MY DAD CRY! | Story of my Comeback Competition,Nile Wilson,185541,12179,115,827
9CILSvf1snQ,GOLD DIVA MACARONS- The Scran Line,The Scran Line,27794,1692,34,174
WoPtuVbaSKQ,CHOCOLATE CHIP COOKIE CUPCAKES - NERDY NUMMIES,Rosanna Pansino,315347,19538,204,3172
62cWuFjzOgs,Apple Watch Series 3 hands-on live from Apple Event 2017,Engadget,46622,345,47,149
NzRuDD0iYC0,"Last Week Tonight with John Oliver S04E23 - Sep 10, 2017",DeathByPixel,668027,3553,1629,889
eM_FR7I2Ttw,Harry Styles - The Chain (Fleetwood Mac cover) in the Live Lounge,BBCRadio1VEVO,1026622,61409,967,4097
eoArC99zm1M,Real Clowns Creepier than Pennywise from IT,Good Mythical Morning,1862110,38823,1999,6229
IMG0u0_cKNc,Here's what happens when two hurricanes collide,Tech Insider,148998,2123,101,435
bAon04ZJhHE,Season 21 Preview: White People Renovating Houses,South Park Studios,182676,3752,165,1163
LTnl36-0-zU,After Hours: 6 Movies Whose Timelines Don't Add Up,Cracked,379817,14096,323,1338
EmjMWi0MBXQ,Don Lemon Praises ‘Chunky’ CNN Reporter Facing Irma Wrath: ‘Nothing Wrong With a Little Curve’,NN,103807,119,23,67
c7ymY8QEB2g,kirstin - Bad Weather (Official Video),kirstinVEVO,44621,4165,121,537
Ez95rPffd8k,Jim Carrey's Bizarre Fashion Week Interview | Daily Pop | E! News,E! News,48688,141,226,256
08RHSZvixec,BLIND TASTE TEST // Grace Helbig,Grace Helbig,141532,9467,55,956
zAXn-v9RdXo,Surveying Hurricane Irma's Damage in Southwest Florida,The New York Times,7740,70,1,7
_SRNenu07Lw,Day at the Beach - Mayor Steve Fulop,Steve Fulop,16059,139,9,12
iXexmZm3_j8,$3 Seafood Vs. $213 Seafood • Australia,BuzzFeedVideo,4618045,104899,2180,11355
GpAuCG6iUcA,Fifty Shades Freed - Teaser [HD],Fifty Shades,4661584,17517,2543,2157
eRDxDEhEgNY,QB turned Psychic? Tony Romo Predicts Future,Enter Name Here,320880,3858,104,675
AZTGeQ5msaU,"iPhone X walkthrough: Animoji, Face ID, Portrait Mode Lighting effects, more",SlashGear,94123,520,34,96
yiblDn4JGfQ,How to photograph INCREDIBLE ARCHITECTURE!,Peter McKinnon,134994,13901,69,1087
xKXxJcf6_IE,Tommy Wiseau On Why James Franco Was Perfect For 'The Disaster Artist' | Los Angeles Times,Los Angeles Times,135280,2032,17,368
YQYslaA1Lus,How Kanye West’s ‘Graduation’ Changed Music | Genius News,Genius,229235,9746,292,1119
k9bYO7uSnrg,iPhone X hands on,TechCrunch,14577,160,19,51
1nEp6DcHwhs,Tying a Shoe,Buttered Side Down,14706,1619,33,201
brfJuyTADuQ,BIG ANNOUNCEMENT ON MY POPSCICLE,Miranda Sings,543283,33686,931,14935
bp6uJJJMaLs,Things you need to know about Pennywise,Jenny Nicholson,39338,2377,103,484
ah8SQNOXgrQ,Obsessed With Netflix,Gus Johnson,62884,6003,72,364
rHfyvSgvgoo,Game Revealed: Season 7 Episode 3: A Goodbye Kiss,GameofThrones,196016,5080,56,434
-JmNKGfFj7w,Jim Carrey Sounds Off on Icons and More at NYFW 2017 | E! Live from the Red Carpet,E! Live from the Red Carpet,2526119,17110,677,5311
Vjc459T6wX8,更なるフィット感を追求するねこ。-Maru wishes for more fitting feeling.-,mugumogu,43199,3263,7,294
O4pFdLJmG7M,Storm Chaser Battles Hurricane Irma’s Powerful Winds | NBC News,NBC News,1157495,15333,990,4641
uZG_x7m4jBM,Willow's Birthday,Johns Hopkins All Children's Hospital,42734,0,0,0
E-NxvaVWjBM,iPhone 8 Hands-On: Don't Overlook This Big Update,Tom’s Guide,16653,83,10,27
ktl2mLsSq4o,Essential Phone Drop Test - TITANIUM and CERAMIC vs. GRAVITY!,JerryRigEverything,416462,20164,297,2597
S6eJbe5GyDo,"Drone captures aftermath of Hurricane Irma in Naples, Florida",CBS News,470206,942,137,582
NoxKH_v8b-8,Hurricane Size Comparison,Reigarw Comparisons,2604761,28651,2256,6878
aZkqHx5uri4,Can You Assume Sexuality Based on a First Impression? | Tell My Story,SoulPancake,332176,14279,626,1927
1Sm8A-u1vIA,LIVE TRACKING OF HURRICANE IRMA,ABC Action News,7189818,26771,3925,123
JsTptu56GM8,How Computers Compress Text: Huffman Coding and Huffman Trees,Tom Scott,330895,18023,112,1017
ppGCbh8ggUs,The Constitution of the Spartans,Historia Civilis,230701,11767,184,1519
tteLMfFDCb4,Hillary Clinton speaks,CBS Sunday Morning,358661,3498,24056,6420
etn4P80K5WU,Wolf Alice - Beautifully Unconventional,WolfAliceVEVO,101248,4679,93,331
DUFBEamEF0Q,Larry's Back & Nothing Has Changed | Curb Your Enthusiasm Season 9 Trailer #2 (2017) | HBO,HBO,498183,6300,112,789
B_CHjYoqPUU,Casually Explained: Is She Into You II - What's the worst that could happen?,Casually Explained,1462030,74679,1502,3881
kCKTmL5Hn-M,10 EASY MAGIC TRICKS ANYONE CAN DO,#Mind Warehouse,4774911,32276,12757,4103
N4Jb3gkrGXI,I Bought An Entire Outfit Blindfolded,Safiya Nygaard,2433292,123805,1069,9275
0Yhaei1S5oQ,Japan's Ominous Dancing Cats and the Disaster That Followed,SciShow,295156,10918,149,781
oePt4JgdyZo,Rick and Morty Character Studies: Why is Rick Such a Rick?,ScreenPrism,165849,3391,297,374
amds5iNvFD4,I Gave Myself A Celebrity Hair Transformation 💇🏾✂️,Michelle Khare,322896,8516,470,663
OudFElslbh4,Viral Instagram Makeup Trends!! Wavy Eyebrows Tested! Alisha Marie,AlishaMarie,1617247,83419,1014,7114
gmXuUgB7T3Y,Try-On FALL HAUL! Fashion + Drugstore Makeup | Ingrid Nilsen,Ingrid Nilsen,185928,6156,129,320
gQvHtXWlXDE,Minelli - Empty Spaces (Official Video) [Ultra Music],Ultra Music,265833,3995,197,256
LpZqwLZP5Vs,A Moment of Silence at the National 9/11 Memorial & Museum,Inside Edition,28038,845,41,344
fCh5TVGaTSg,Tracking Hurricane Irma 9/11,CBS Miami,91229,270,62,211
Pp19TkIU_fw,"Life of Kylie Recap Season 1, Ep.7 | E!",E! Entertainment,188162,1990,266,192
u6iVspBWzZU,what is derealisation / depersonalisation?,doddlevloggle,157437,19869,78,2027
-cYk6sbe11c,Hurricane Irma Makes Landfall in Florida Keys as Powerful Category 4 | TODAY,TODAY,329459,1158,188,439
Mq9dxmh6JiE,FENTY BEAUTY by RIHANNA FULL REVIEW,James Charles,1153128,45408,4311,5708
_NlKTMvnjIc,"Hurricane Irma Now a Category 3, Could 'Re-Engergize' to Category 4 | MSNBC",MSNBC,1769252,8048,2123,3359
3x-sUsazQ90,#IRMAgerd Hurricane Candy and why it's hard to make candy when it rains.,Lofty Pursuits,381229,11618,452,1663
7Lyo5dCig-U,BBC Anchor Gets LOST on Camera (News Blooper),NewsFunnies,260164,2405,121,259
lwOQbMcXtfU,Dried up Beach in the Bahamas,ViralHog,1275489,2678,494,895
PJZOghDtOCM,Hurricane Irma News Bloopers,Funny Local News,9025,53,1,16
7Gw-lN270qs,Full Face Of First Impressions | Testing New Makeup | Beauty With Mi,Refinery29,13892,327,29,86
qZVm-2nM0sA,Rudimental - Sun Comes Up feat. James Arthur [Official Video],Rudimental,216040,9301,140,349
_uLmn_Dba08,10 Hilarious Thrift Store Items!,Matthias,2036428,41039,2671,15607
vSDCb3bdFlw,Hurricane Irma roars into the Florida Keys and continues up the coast,ABC News,50155,251,27,146
BdV0dkx2oik,"The Honda Civic has a very small feature, that I never noticed. Until now.",Jared's Garage,659749,3964,712,278
U1bpztJkdzk,TESTING WEIRD PUPPY TOYS WITH PUPPY!!! *CUTE*,LaurDIY,1007014,57545,570,3333
rTMibYCQMyk,Served Like A Girl - Trailer,Freestyle Digital Media,7410,48,2,0
PHXkhUJWTXM,Hurricane Irma Emergency Fake Interpreter,Jane Smith,158816,206,67,153
X7ld45pUueQ,CHECK DESCRIPTION! Southern most point live webcam,Kevin Novobilsky,2330211,4893,938,381
3hq2c9vdfls,"Cal Football 2017: HC Justin Wilcox September 11, 2017",Cal Bears,1002,8,0,3
wGQtrwey-TI,SALTED EGG CRAB! Street Food Tour of Old Airport Road Hawker Center,Strictly Dumpling,622951,13260,493,1751
_GC5AVsf528,Nothing But Thieves - Sorry (Stripped Back),NBTVEVO,92783,6491,54,339
BRzPaDMeRks,These Are The Best Features Coming To iPhones.,UrAvgConsumer,352284,13099,508,1297
C3cwtcomilA,Galaxy Note 8 // 8 Things To Do First!,Kevin The Tech Ninja,8692,340,16,36
jehAZhrI7oA,IT - SPOILER Talk,Jeremy Jahns,788310,17141,1054,5521
-tCu0tKrzhc,Sloane Stephens jokes that $3.7 million check inspires her to keep playing | ESPN,ESPN,113400,1049,20,297
qPDZZj6By3Y,Killer Whales Attack Minke - Frozen Planet - BBC Earth,BBC Earth,163404,3337,111,447
J_e77K4n6Ts,Garlic Knot Chicken Alfredo Ring,Tasty,352119,12880,195,517
7nh2Ra-5kY8,2017 US Open: Sloane Stephens Takes The Title,US Open Tennis Championships,119124,742,48,404
0tOUQt5fem0,First Tuned Run of Terry Mayhugh's Quarter Scale V12 Merlin,mayhugh1,7009,45,0,9
zJufeAMRHy8,"Rainbow Connection - The Muppets at The Hollywood Bowl - September 8, 2017 HD",Synthetik Films,92656,895,22,143
UpONjs5kLPc,Los jugadores de Sacachispas entraron vestidos de guerreros vs Sarmiento (Copa Argentina),Futbol La Pasion,53712,203,4,25
AHrCI9eSJGQ,"30 Days Timelapse at Sea | 4K | Through Thunderstorms, Torrential Rain & Busy Traffic",JeffHK,763632,51890,194,4852
4LwpGaDKmZ8,FENTY BEAUTY by RIHANNA... HIT OR MISS?! | Jeffree Star,jeffreestar,5044462,183483,16582,19443
f5F2whaRzqw,Teardown and Experiments with a Doppler Microwave Transceiver,Kerry Wong,2874,104,0,15
Alp_a88C8dY,Stephen King's IT - What's the Difference?,CineFix,1307902,19734,984,3029
MmAL1EOkLUo,SVU 9.11 Opener Dedication.wmv,DarthLucifer08,19431,87,2,10
5kZi3J2S52E,The Final Steps of Making Pyrimethamine (Daraprim),NurdRage,229636,7897,47,781
a6sywFdvURE,Steve Bannon: Trump's Access Hollywood tape was a litmus test,CBS This Morning,171000,454,85,290
WAwRqecvMSY,ROASTING YOUTUBERS' NAILS (nail diss),Simply Nailogical,1812471,133824,5380,23176
uAipi4V5g34,Dancing in 80's Movies Supercut - Vol. 2,Robert Jones,11830,200,3,22
pAsN4lSa7O0,Blake Shelton - I'll Name The Dogs (Official Music Video),Blake Shelton,1851893,24779,2844,2242
9e6WeQeBjOI,Dad Builds Palace For Dogs,Caters Clips,4801,28,0,8
xtDJ6uEyvnw,Hurricane Irma Warning With Sign Language,Cole Truax,55214,258,5,99
frv64BFwGFY,Kmart - I Can,Kmart,116337,17,10,2
8QgMh02JvS8,The $80 Smartphone Challenge,Austin Evans,387873,12099,458,1771
fQxLlq7lxVM,"FENTY BEAUTY | FULL FACE BEAT,  IMPRESSIONS + REVIEW",Shameless Maya,406327,20499,516,6361
T2W7UocH0Hs,How to Save Your Seat in Japan,Life Where I'm From,108653,3606,109,699
zPGRU49esCU,How to Cook With No Power During a Hurricane #Irma,Brothers Green Eats,77640,2223,221,390
ykvX-E1nuag,How to Win Australia,vlogbrothers,173773,9188,166,876
8fH_PAi6Yf4,RIHANNA FENTY BEAUTY My First Impressions Full Face + Review For Dark Skin | MsDebDeb,Ms Deb Deb,1106140,38670,1576,1470
WCKJPn1UcXc,One America Appeal: Our Friends In Texas,One America Appeal,952945,17703,3207,0
TDskW3JvTAY,ANVIL Vs. WATERMELON PYRAMID! (CRAZY 45m DROP TESTS),How Ridiculous,277903,13343,212,6348
pwHvK07tUuw,24 Genres. Two Artists. One song. All voices. - Shape of You Ed Sheeran,Peter Hollens,700036,49257,995,4863
U2CqZNd6rgM,Welcome to JURASSIC FALLS!,Brave Wilderness,2384595,50009,1918,6584
7Ag2oDIeLvo,1976 Buick Skyhawk Commercial,OsbornTramain,1712,15,0,4
UR9k1Pjx5eg,Nicholls Postgame | Kevin Sumlin 9.9.17,Texas A&M Athletics,13794,40,49,0
bF5sIEuv83k,Kane Brown - Found You (Audio),KaneBrownVEVO,834567,20322,876,862
CayHgjP1YNQ,Game of Thrones sings Look What You Made Me Do,Matthijs Vlot,443606,4231,68,246
FTIStPerVNw,Bernie Sanders Tries To Say Something Nice About Trump,The Late Show with Stephen Colbert,1493731,23472,3490,5872
AX8-YzMKZhQ,Sam Smith - Too Good At Goodbyes (Official Audio),SamSmithWorldVEVO,13728070,468636,6597,20989
REyxoxScrbU,Calvin Harris - Hard to Love (Official Video) ft. Jessie Reyez,CalvinHarrisVEVO,4850078,146460,8649,4896
c3pFWJCQy5E,Update: Problem with Chemo Pills,Courtelizz1,108839,3677,107,732
eJB1gcydsbU,If kids shows were honest about life,AnthonyPadilla,614717,49443,1986,3970
AR4UgRJOUQY,What Does Your Search History Say About You?,AsapSCIENCE,1244953,29748,2639,4112
DGlYMJRwevI,Nerf meets Call of Duty: Gun Game 8.0 | First Person in 4K!,Aaron Esser,1862718,21516,1960,2108
PGfSaVDymjk,"G-Eazy - No Limit (Audio) ft. A$AP Rocky, Cardi B",GEazyMusicVEVO,2114219,77679,1874,4529
a2B9pA8aGUc,Rutgers Falls To Eastern Michigan,Big Ten Network,11533,51,7,29
4Ltc4HO3NIE,Florida Weather Cameras - Hurricane Irma (19 cameras across Florida),stere0123,109422,200,14,0
A-fofQ9VpPQ,Alias Grace | Official Trailer [HD] | Netflix,Netflix,349856,4403,140,335
pCSgWJzEvrM,The only dating advice you'll ever need,Anna Akana,447037,25068,710,1299
bnON1y-fKag,Home Again - Movie Review,Chris Stuckmann,226012,9353,156,1282
VCVjbrt30tY,Fifth Harmony - Deliver,FifthHarmonyVEVO,3998451,291383,11624,24246
2caEL5ATPX4,Janet Jackson performs Dammn Baby & I Get Lonely live State Of The World Tour,Concert Daily,82199,1194,51,194
Ie50Nw9NkOk,Jordan Peele and Spike Lee Team Up for Movie About Black Cop Who Infiltrated the KKK,Complex News,41962,1445,50,268
tt2k8PGm-TI,ZAYN - Dusk Till Dawn ft. Sia,ZaynVEVO,36323498,1431683,28049,100661
mGqR9sgMIyA,Orlando braces for Hurricane Irma,Fox News,25652,73,11,62
D1KpuWg2hc0,IT's Nicholas Hamilton & Chosen Jacobs Play RAW's Whisper Challenge,RAW,7563,344,1,21
qh7QJ_jLam0,Green Day - Too Dumb to Die (Official Lyric Video),Green Day,845694,64515,625,4325
XovZ04gmQgE,Hailee Steinfeld & Alesso (ft. Florida Georgia Line & watt) - Let Me Go (Official Audio),Hailee Steinfeld,316616,10084,104,331
Zy6vBxqlapw,Kelly Clarkson - Love So Soft [Official Video],Kelly Clarkson,3027926,76505,2880,6414
VEoITVHfyGg,Harry Potter Theory: The History Of Hagrid’s Wand,SuperCarlinBrothers,463409,19286,393,2304
XwW6ZWaQ4bs,"Hurricanes Irma, Jose, and Katia, all at once on 9/6/17",WKRG,4761358,50802,1128,8606
Lv5DFKceFac,Thomas Rhett - Sweetheart (Static Video),ThomasRhettVEVO,376381,8909,170,334
4v38ugGj3u0,Suburbicon - Trailer 2,Deadline Hollywood,30851,261,65,49
dA5qYrboTUE,Live footage as Hurricane Irma destroys Maho Beach Cam in St Maarten   9/6/2017,PTZtv,13752002,46101,4898,0
H_A0Z4S30Ds,Avenged Sevenfold - As Tears Go By,AvengedSevenfoldVEVO,433708,24188,712,2383
ton42cZ6ZYU,Acting Out My REAL Childhood Stories (PART 1),IISuperwomanII,2465146,179085,1567,11973
ZXvbz8cqafM,Taylor Swift NOW Presents: See What Taylor’s Up To NOW | AT&T,AT&T,836472,19314,1206,0
lBspB4K-F-c,American Horror Story: CULT BEE HIVE,Madeyewlook,599780,29851,299,453
mTnRc4pVu4w,Lecrae - Hammer Time (Dance Visual) ft. 1K Phew,LecraeVEVO,106186,4695,193,396
xo2B67vz4HA,Small Hands Samsung Galaxy Note 8 Review,Linus Tech Tips,626600,20553,1033,2138
rAh_16nooZA,"ONLINE SHOPPING HAUL 2017! (with me, a shopaholic)",Amber Scholl,384682,21302,353,1559
PPg1gN_ey2o,Liza Koshy's Dream Office Makeover | OMG We're Coming Over | Mr. Kate,Mr. Kate,2451184,176110,1017,6257
k0WRpQU9zK0,R3HAB & Quintino  - I Just Can't (Official Video),R3HAB,480279,26662,241,557
-1fzGnFwz9M,9 Things You Need To Know About Kittens - Simon's Cat | 101,Simon's Cat,189414,7070,112,288
ezgtjMfgxos,Watch Live Satellite Images Of Hurricane Irma: Evacuation Orders In Place In Florida | TIME,TIME,103666,196,67,80
fM8yID63CSA,GAGA: FIVE FOOT TWO Press Conference | Festival 2017,TIFF,74494,2218,37,159
CYoRmfI0LUc,"Hello, world. Meet our baby girl: Alexis Olympia Ohanian, Jr.",Alexis Ohanian,1110865,11255,1817,3631
cNgT8qEQJ3w,Alexa: Guess My,Norm Krumpe,235562,1801,78,96
scIizw2asro,Bill Skarsgård's Demonic “IT Smile  - CONAN on TBS,Team Coco,1798895,26425,465,2278
K4wEI5zhHB0,iPhone X — Introducing iPhone X — Apple,Apple,12200526,258842,44339,0
XpVt6Z1Gjjo,1 YEAR OF VLOGGING -- HOW LOGAN PAUL CHANGED YOUTUBE FOREVER!,Logan Paul Vlogs,5457497,349857,17479,52483
WYYvHb03Eog,Apple iPhone X first look,The Verge,3654879,30836,6101,16713
xHvVhhFvLtY,SPIKED by a Sea Urchin?,Brave Wilderness,1398322,35880,619,6246
F4ELqraXx-U,Lana Del Rey - White Mustang (Official Video),LanaDelReyVEVO,1568852,174771,2166,19191
bvomHFZO0mk,Official US Find Your Voice Trailer - Disney/Pixar's Coco,Disney•Pixar,558820,4847,259,1083
9YyB6sQ4iwA,iPhone X and iPhone 8!,iJustine,761705,32608,1562,6864
cLdxuaxaQwc,My Response,PewDiePie,6997601,626155,46445,190979
0eKdNcP4xrM,"SOY PABLO Extended Trailer  -- A Bad Lip Reading of Narcos, a Netflix Original Series",Bad Lip Reading,504827,29220,457,2233
QQVWMp_xgGg,The Opposition w/ Jordan Klepper - Opposing the Resistance in Phoenix,Comedy Central,580441,2520,533,977
sjlHnJvXdQs,iPhone X (parody),jacksfilms,2084309,128402,1136,8733
l864IBj7cgw,Jennifer Lawrence Challenges Jimmy to an Axe Throwing Contest,The Tonight Show Starring Jimmy Fallon,909358,14539,672,1353
8wNr-NQImFg,"The Check In: HUD, Ben Carson and Hurricanes",Late Night with Seth Meyers,1119034,12843,560,1367
_HTXMhKWqnA,iPhone X Impressions & Hands On!,Marques Brownlee,3087549,93812,3067,19758
YSVlSmZWzm0,The real reason To Kill A Mockingbird became so famous,Vox,380266,11558,1286,1783
cOboLQMO4tQ,Sarah Huckabee Sanders on Jemele Hill,TP Clips 8,83219,157,190,406
cMKX2tE5Luk,The Disaster Artist | Official Trailer HD | A24,A24,1673317,40496,678,3915
4MkC65emkG4,Hand In Hand A Benefit For Hurricane Relief | MTV,MTV,393968,10053,596,1191
vu_9muoxT50,Colin Cloud: Mind Reader Predicts Your Tweets - America's Got Talent 2017,America's Got Talent,990274,22897,639,2430
TdH_NL35Nbw,Riverdale | Motive Trailer | The CW,The CW Television Network,86119,1835,18,230
-Ifnaxi2LQg,Fergie - You Already Know ft. Nicki Minaj,FergieVEVO,1668188,88182,5893,7373
CsdzflTXBVQ,Best Floyd Mayweather Interview | Awkward Puppets,Awkward Puppets,705475,34506,549,3180
eERPlIdPJtI,Weight Update: 6 weeks Post Surgery! 93 pounds!,boogie2988,515740,37881,538,8313
R6ja9qNmOaM,Stephen A. Smith calls ESPN's #NBArank 'garbage' for Carmelo Anthony rating | First Take | ESPN,ESPN,367178,5296,199,2422
1L7JFN7tQLs,iPhone X Hands on - Everything you need to know,Jonathan Morrison,751902,22556,870,4638
zgLtEob6X-Q,Honest Trailers - The Mummy (2017),Screen Junkies,1341911,33111,1035,4709
ZQK1F0wz6z4,What Do You Want to Eat?!,Wong Fu Productions,413029,18228,404,1671
_ANP3HR1jsM,ATTACKED BY A POLICE DOG!!,RomanAtwoodVlogs,1637683,76343,936,6052
zAtHxJvSczA,Does Maggie Gyllenhaal Have Taylor Swift’s Scarf? | WWHL,Watch What Happens Live with Andy Cohen,87153,220,43,115
Ayb_2qbZHm4,Honest College Tour,CollegeHumor,1130469,39886,876,2347
xzPRACH6YwE,Fifth Harmony: He Like That,The Late Late Show with James Corden,378178,25046,1112,2510
zcqZHYo7ONs,Bell's Theorem: The Quantum Venn Diagram Paradox,minutephysics,292585,16909,325,1845
4X6a3G_0HjY,Bella Hadid Roughs Up Security Roughing Up Female Photog | TMZ,TMZ,41452,485,244,318
unIkqhB2nA0,iPhone X Face ID Unlock Fail,Unbox Therapy,2741837,72782,7146,18239
w8fAellnPns,Juicy Chicken Breast - You Suck at Cooking (episode 65),You Suck At Cooking,586091,26816,778,2165
UCrBICYM0yM,Downsizing (2017) - Official Trailer - Paramount Pictures,Paramount Pictures,2995809,9467,371,1709
A0lYm7Qsbak,iPhone X vs iPhone 8 Hands On - What’s the Difference?,UrAvgConsumer,712467,33015,863,4018
JhA1Wi9mrns,Kid Rock - Tennessee Mountain Top [Lyrics],Kid Rock,159643,4389,651,603
T_PuZBdT2iM,getting into a conversation in a language you don't actually speak that well,ProZD,1805185,72625,1714,4056
FMVw_Ty8qTY,VLOGTEMBER NYC ∙ RUNNING AROUND | heyclaire,Claire Marshall,71109,4127,50,299
QBGaO89cBMI,Radiohead - Lift,Radiohead,1091878,49500,538,3886
3qVHkOOyD5s,"Demi Lovato performing 'With A Little Help From My Friends' at Hand In Hand - September 12, 2017",Demi Lovato News,53673,1208,45,118
B7YaMkCl3XA,Hurricane Irma death toll rises to 10 in Cuba,Al Jazeera English,396448,1557,292,1368
ZtXkNMbjOEE,Tori Kelly & Luis Fonsi - Hallelujah | Hand In Hand Benefit 2017,tkvids,50518,1237,30,118
LcZ2AuvxXNA,Nerf Bow Trick Shots | Dude Perfect,Dude Perfect,11475555,398514,8158,24861
ql0Op1VcELw,What's Actually the Plane of the Future,Wendover Productions,772128,21783,813,2839
4Yue-q9Jdbk,SUPERFRUIT REACTS TO TEENS REACT TO SUPERFRUIT,SUPERFRUIT,310527,23994,373,2224
l_uNfGY3v8E,"From the air, Irma's catastrophic wrath is undeniable",USA TODAY,232505,498,793,642
EwujR1ARsog,‘Mystery Van’ Helping Self-Driving Cars Communicate with People | Autonomy | Ford,Ford Motor Company,22004,38,15,6
xA70bP5uzao,FENTY BEAUTY By Rihanna Review + Wear Test,Amy Macedo,55614,2433,84,453
IYvEhgYy35I,The xx - On Hold (Jamie xx Remix),The xx,111776,4857,68,311
JO7X9ZPoAp8,Blind People Describe Beauty,WatchCut Video,240156,7977,189,798
q9o_VjdugHw,Sarah Sanders: ESPN's Jemele Hill Committed 'Fireable Offense',NTK Network,17777,15,0,6
HcNcOnIkQQU,Imagine Dragons - Whatever It Takes (360 Version/Lyric Vide​o),ImagineDragonsVEVO,478747,54551,306,3702
QH0fGSqow3c,Selena Gomez hand in hand,THE RESISTANCE Mind Tripper,19105,154,20,20
h_mpwaCJUrY,Usher and Blake Shelton - Stand By Me |  Hand In Hand A Benefit For Hurricane Relief | MTV,Alvaro Veloz,13459,223,2,23
MdzGZv3zQ-U,"Action Bronson and Sean Evans Have a Sandwich Showdown, Judged by Mario Batali | Sean in the Wild",First We Feast,579532,17845,277,1852
62cWuFjzOgs,Apple Watch Series 3 hands-on live from Apple Event 2017,Engadget,65650,403,57,175
EVp4-qjWVJE,Chargers vs. Broncos | NFL Week 1 Game Highlights,NFL,829793,6501,386,2582
2wxyDrfwlXQ,What's In This 90s Mystery Caboodle?,grav3yardgirl,429138,18017,343,3900
lv5uC6cfO5c,Stone Sour - Rose Red Violent Blue (This Song Is Dumb & So Am I) [OFFICIAL VIDEO],Stone Sour,91333,6871,183,705
uBGECC5U09Q,Everything Wrong With Alien: Covenant In 16 Minutes Or Less,CinemaSins,1461358,35312,1062,6077
F1DxLQbx_bU,5 DELICIOUS CHOCOLATE CUPCAKES IN 5 MINUTES! - The Scran Line,The Scran Line,22490,1939,15,156
H8t5M9_Tvzk,Depeche Mode - Cover Me,DepecheModeVEVO,93030,6162,81,564
