comment_user,content,comment_time
Indraj Meena,If you didn't come from tiktok raise your hand ,3 days ago
James,It kind of reminds me of the Nokia Lumia 1020 I think it was. The one with the amazing camera.,3 days ago
Sanjay,"I've been a proud user of the Oppo Reno 10X Zoom - the fastest phone on the market when I bought it (well, faster than the Samsung equivalent and had a better camera). 4-years later it's still going strong but the battery is now barely a day so looking for an upgrade. Surprisingly the pop up cameras are still fully functional and used dozens of times a day. However, the Find X6 Pro has definitely piqued my curiosity ",2 days ago
The HolographicSweater,"smartphones have come a long way - it’s wild. the specs have increased in pace with computing tasks, which equates to the same user experience of 2011. truly mind blowing incredible progress",3 days ago
O K,1998: Cheap pvc fake leather,3 days ago
Fettuccine,"I really liked that leather era of phones, now everything has to be a glass sandwich with sharp metal rails, my favorite phone designs were the LG G4, and the iPhone 5c, both phones were not going for a premium feel but they both felt incredibly premium and beautiful in their own way, I would love to see more ""unapologetically plastic"" phones in the future lol just imagine a 15 pro Max with the same design as the 5c unibody plastic",2 days ago
Joe Murphy,"I think the processors and the camera systems have come a really long way in the past 5 years.  From something like the Galaxy S9 series to the current S23, it's come such a long way, it's barely recognizable.",3 days ago
Mashhood Ahmad,"The moment when the phone's so good, you start philosophical and nostalgic debates. That's a new",3 days ago
antikovt,"Never was a fan of Oppo, still not one, but damn, this design strikes right up my alley. The dual color, the symmetry, the nice beige colour, the contrast of materials, holy shit I'd be proud to carry something like that with me",3 days ago
Cellunlocker.net,Very interested to see how the camera/video compares against the other phones.,3 days ago
Nate Gardner,The design is fantastic. Based on the sample images the photo processing software seems pretty lacking though. Do they have a pro photography mode for less processed images?,3 days ago
U.E. U.E.,I like how the upper edge of the leather/2nd backside color lines up with the matte glass! ,3 days ago
Salih Saleh,Huge appreciation for using a metric unit! It shows that you recognise your international fan base. Amazing work as always ,2 days ago
pseudo nym,"It's amazing how far phone cameras have come hardware wise. Having several cameras available for wide angle up to (low) telephoto shots adds a lot of versatility and I love that a 1"" sensor is no longer an extreme feature on a prototype, but something you can get with several regular flagship phones.",3 days ago
Xavier,I love how distinct leather phones are when compared to  glass phones.,2 days ago
vidIQ,"Argh, you lost me at 6.82 inch display!",3 days ago
Burffy James_vlogXs,7:20,3 days ago
JaeArtz,"Using a Find X5 pro for nearly a year now, still love it. Hope they can sell in Europe and US again soon",3 days ago
Fidelator,"As an Oppo Find X3 Pro owner, I'm deeply saddened about this phone not being released worldwide, Oppo flagships have been killing it in all departments the last few years and I'd have loved to upgrade to this one.",3 days ago
Jessika Graley_Ways,i like to watch your reviews cause you provide actual information ,10 hours ago
thisisnotajoke,"I don't mind big camera bumps.. the last feature phone I owned was a Sony Ericsson K800i, with a camera that was kind of insane for it's time.",3 days ago
Jibrin Danladi Liam,"From powerful processors to high-quality cameras to great display, there's so much to appreciate about the  hardware",3 days ago
Yusuf T-Deen,The way they've retained a massive camera bump but still tried to integrate it into the back and also added a 2-tone back with vegan leather just makes it look classy as hell.,3 days ago
Mushious,"Looks like OPPO is still trending in the right direction, I have a Find X3 Pro that I daily drive and love, haven't really thought of upgrading since originally buying it but when I do, I think I'll stick with the OPPO line-up. So long as they don't keep up the China exclusivity going forward.",2 days ago
Alexandru Hanganu,I used to have a Nokia Lumia 1020 and it was amazing. The huge camera bump on the back of the phone was great to rest your finger under it so you can better hold the phone one-handed.,3 days ago
Aidey P,It's a shame they're not bringing it to the Western Regions. I really liked my Oppo Find X2 Pro with the 5x periscope zoom,3 days ago
Pikan,you know MKB is hyped when the dad jokes come out ,3 days ago
KanyeT,"I agree, the technology of phones has gotten so crazy good over the last few years. I am just amazed by the rate of innovation these manufacturers are coming up with.",3 days ago
Jortus Pelatus,Flagship smartphones at this point are becoming more and more of a niche segment because of rising prices & features 80-90% of users can't really take advantage of. Mid-range & upper mid-range segment is where it's at.,3 days ago
Susindhran Sridhar,"Imagine making the OnePlus flagship with this form factor mainly the circular camera bump with almost stock like Android UI.. that would be a nice deal, the only deal breaker for me in these Chinese phones are UI. Planning to buy the nothing phone 1 even if it is mid ranger it's absolutely a good user friendly phone with glyph ",3 days ago
Arrad Rahman,You should do a video similar to this comparing a midrange phone from today that is great for the money with something from 10 years ago. It may make a great video idea ,2 days ago
Andrew Song,"I remember seeing this phone when it first hit stores in Shanghai, it is a pretty sick phone ngl.",3 days ago
Jose B,"Wanted to hear a lot more about the camera. I have the Galaxy s23 Ultra and the camera is good, but not as good as I thought it would be, especially the selfie camera.",3 days ago (edited)
Nicklas,"Wish this would come to the us/eu, sounds like a beast of a phone ",2 days ago
Lisa,"Amazing specs from top to bottom, the cameras alone are amazing. Hard to believe all that computing power is almost taken for granted now. Great review as always. TY",3 days ago
Xiaobin Zheng,"Surprised to see so many OPPO overseas users. OPPO did a great job in X and X2, but X3 & X5 are not satisfying (at least in mainland market). I think X6 has found their original idea to make a flagship to be only TOP  at least in one spec, and X6 now has the best camera and brightest screen. Really hope it could earn its applause back!",3 days ago
LuCiFeR,The first video I watched on your channel was the Oppo FIND X and I remember how my mind was blown by that pop up mechanism,2 days ago
Marcel,"I actually like how it looks. It's kinda retro, like a vintage Fuji camera or something.",3 days ago
André Alcântara,It looks like the Lumia 1020! 41 Megapixels was crazy back then. Good times.,3 days ago
Eduard,"This is a serious contender for the most improved phone award. Apart from the massive jump in performance and battery that the new chip brings, the new camera just took it to another level. They went from having one of the worst telephoto sensors to arguably the best",3 days ago
Jim Rasch,This is wild. I'd love to give it a go,3 days ago
candlercando,"A decade ago, Blackberries had integrated rubber (""vegan leather"") cases and could last 2 maybe 3 days on a charge.  That includes the BBOS and BB10 phones where BB10 was a more modern smartphone.",3 days ago
Maxi Gabi Me,"The thing I hate the most on the newer phones, are the big camera bumps, I don't like them at all. I love how the photos look, but it bothers me a lot haha Thanks for the great video!",3 days ago (edited)
Oscar Martinez,I really like the back design. Nice brown with silver and the giant camera bump.   Psychlops  vibes,3 days ago
Mitch Baltazar,I absolutely love the leather back. The big circle up top kills it for me though,2 days ago
》Baku《,The amount of suttle details he puts in his videos always leaves me astounded.,1 day ago
William Utley,It would be great if we could get some of these over seas Android phone in the US. The tech in some of these is crazy.,3 days ago
Jim Howardbatey,Keep in mind when citing camera lens apertures that the f1.8 for the Oppo sensor is equivalent to a significantly larger number for a 35mm sensor.  Multiply the f-stop by the crop factor.,3 days ago (edited)
Big Tipper,"It reminds me of my old Nokia Lumia 1020 windows phone, that absolute beast of a camera bump!",3 days ago
PurVue,I love the design.  I just got my s23+. Maybe next year (or 6 months from now lol) ill see what they are up too,3 days ago
vitali,Yes Marques!!! Thank you for fighting for flat displays!!! The world needs more of them.,2 days ago
Mups,I appreciate the hard work you put in making these videos ,2 days ago
Luke B,"As an S22 Ultra user, I do find myself a little jealous of these camera specs. They aren't a clean sweep beating Samsung in every area - the 10x periscope zoom is still such a cool camera feature and very fun to use. But I am very impressed with the larger sensors for the ultra-wide and 3x telephoto. The ultra-wide on the S22 Ultra certainly isn't bad, as far as phone ultra-wides go it's at the top end of the market but there still is a noticeable quality drop when switching from the main camera. So boosting the sensor size whilst also having the same aperture will make a big difference. I'm guessing all of the cameras on this phone pixel bin down from 50MP to around 12MP in default settings - that would make sense, enabling a 4:1 pixel binning. Seen as most higher end phones do this I'm sure the Oppo does too - they will want to get the most out of this lovely big sensor, and 12MP is easily enough for a normal photo that has already been framed with the desired zoom level.",1 minute ago
Mark One,"Damn, what a phone!! I love companies that do these new things and try to be unique! Oppo is not a company I know a lot about, but the X series has been on my radar this past year! And this phone blows everything out the park! Would love to get my hands on it, but I can't afford it yet",3 days ago
Gandalf The Swoll,"I've been using Oppo phones for 5 years now, and i have never been let down by their quality. Glad to see that they're becoming a top dog in the smart phone market ",3 days ago
DrYwAlLpUnChEr,I would think it be interesting if a wireless charger could be made that would regulate its temperature to prevent your phone from getting blazing hot while you’re charging wirelessly,3 days ago
Zach Weiler,I would pay a lot of money for really good hardware paired with pixel like software,3 days ago
BariumCobaltNitrog3n,"Hasselblad set the gold standard for cameras with Zeiss lenses when film was a thing. They made primarily medium format twin lens (2 1/4 or 120 and 220). The camera bump is the size of the lens and the film (now its a sensor) was the size of a credit card. I doubt they make any part of this phone, just renting the name. Maybe consult.",2 days ago
Alex Schendel,"I just realized noticed that Bard is open for beta sign-ups :O I'm hoping we can expect a follow-up to your assistant shootout, but now with a LLM shoot-out pitting Bing against Bard! I'll definitely do my own testing, but I'll look forward to seeing what sort of testing you might have!",3 days ago
Jonathan Carranza,Camera review of this beast is required please. Hasselblad never disappoints,3 days ago
Rotciv Ikias AKA Saiking,This phone looks so suprisenly good with that color design,3 days ago (edited)
PNW Meditations,"Re: Battery. With the advent of wireless charging, the subjective experience for me is that by phone feels like it has infinite battery. With chargers that double as desktop stands, nightstands, car mounts, etc - places where I'd set my phone down anyway, it's just a thing that always has juice. Bonus points that I'm not wearing out the charging port on my phone.",3 days ago
The Scottish Accent,There's a kind of vintage Olympus camera look to the back of the phone due to the two-tone design with that leather colour. Pretty funky.,3 days ago
Jack,"Immense quality, intense content. The usual Marques, keep it up. ",3 days ago
Yoni bz,I would like to see it's cameras vs other flagships,3 days ago
Dávid G,"It's not just the higher capacity battery, but also the SoC and OS being a lot more energy efficient.",3 days ago
Tridib Banerjee,Dude the UI looks smooth af ,3 days ago
Ty Yohr,Love your videos the phone looks great hope it gets a global launch and those hoodies don’t get a lot of respect that it deserves!! Hoodies on ten!!!,3 days ago
futureshocked,My jaw honestly dropped at the 50W wireless fast charging. Damn!,3 days ago
Alberto Perez,Marques and his team have really got their hands on every hobby. Nice Aristides 070s 7 string guitar on that couch at ,3 days ago
fumblerooskie,I LOVE that it has Hasselblad cameras.,2 days ago
Xander89m,Really love this design! Very clean and fingerprint free too!,3 days ago
Dain Bramage,"Batteries today are insane, even AAs. I played Link's Awakening on my Gameboy Color, played it for 37hrs before I beat it. And that was all on one pair of AA batteries. When I was a kid batteries would last up to 10hrs and then die. Batteries have advanced so much since the late 90s",3 days ago
Leaard D,Can we take a moment to appreciate the smooth ass box to logo transition at the start? ,3 days ago
Stephen,"I know that super fast charging has been proven to be safe at this point, but I still get a little bit of anxiety about a battery going from 0-100% in thirty minutes. Like... how does it not explode??",3 days ago
Carson Cheung,"I like this big, round, one piece camera module design.",3 days ago
Majestic Chicken,MKBHD uploading at 6 AM is a vibe.,3 days ago
The Malcolms,I love how you lost me completely halfway through talking about the camera specs ,3 days ago
bar levi,"I think the next leap in smartphone technology is returning back to compact and lightweight. Im was afraid moving from my iPhone 6 to iPhone X, and now im pretty much forced to go bigger and heavier with the 14 Pro.",3 days ago (edited)
Gary Yamane,Phones are getting so big now that one needs a support in back to hold them!,3 days ago
Andrew Walker,I feel like the first time a slab smartphone ushered in this era of pretty much all the hardware being great was the OnePlus 7 pro. I still use mine and haven’t seen anything I’m excited to replace it with.,3 days ago
matthi,"i wonder when they're gonna get the under display selfie cam perfected, hope my oneplus 7 pro holds out until then",3 days ago
Loc'd Biker,Who else smashes that like button before you watch it because you know its going to be a great video?  MHBHD always bring it.,3 days ago
Monty Gill,I Hope Oppo release it Worldwide one day.,3 days ago
Shubham Pandya,Bro really takes on a journey in each of his videos,3 days ago
Luca connor,imagine just for a second a phone company would develop a phone and let the user decide/program the characteristics of the shot and how it should look. just imagine.,3 days ago
drew miguel,Phone looks awesome and it's kinda interesting to see the camera performance. Unfortunately it ain't gonna go anywhere far from the manufacturing base which IS too bad! ,3 days ago
Dariusz Tech,Love it's design. Brilliant rear camera set up but selfie 1080p for a flagship phone definitely not good enough ,3 days ago
Swordkid,I love this channel already ,3 days ago
Vipin Robi Kurishingal,Good package except for the absence of front 4k...I hope next year's OnePlus will get the same package which we missed this year with front 4k....,3 days ago
Sugurain,"I had a Nokia 808 Pureview, the lord of camera bumps, and I loved that thing SO much I would probably daily drive it if it could run modern apps.",3 days ago
SMS2884,Seriously when I had my Oneplus 9 pro the fast charging was crazy nice. I have a pixel 7 pro. And granted I'm able to charge while out but still. That quick charge is nice and should be a necessity,3 days ago
Dan Davis,I've had my Find x3 pro getting it's battery replaced over here in the UK since January. They keep pushing back the deadline on when it will be fixed as they're waiting on parts. They even lost the phone at the beginning. My experience has been so bad I would NEVER buy/recommend an Oppo device again.,3 days ago (edited)
Jaja Huggins,I just want to say thank you @mkbhd for making hoodies with longer sleeves for us 6 foot 6 inch slim guys. I got the Chevron and Core Logo and they are perfect. Much appreciated!,3 days ago (edited)
Mathew Adamson,would love Google to marry that kind of hardware with their software - hope the Pixel 8 (pro) is close. Is that the only color it comes in?,3 days ago
MyNameSucksBad,Had the Find X3 Pro before getting the S23 Ultra and genuinely found the Oppo comparitive and a beast for the price. They don't seem to get the love they deserve in the UK,3 days ago
sgct89,"On the plus side, I feel Oppo is trying to remind it's customers it's all about the photographic experience.",3 days ago
Arash Parseh,"MKBHD, you are among the pioneers of youtube and you are always getting better and better.",2 days ago
Coy 989,"I like the leather backs, glass is heavy and breaks easily. I wish Oppo and other competitive brand were in North America.",3 days ago
Noah Bersier,"I was planing to get this phone, but as it's not coming to Europe, I just got myself the s23 ultra. The only thing that is a bit annoying is the slow charging of about 1 hour untill full. Oppo and Xiaomi are better there. However, Apple and Google take one hour more.... I did not get a Xiaomi because of the bad update support and I don't like the software. But at the s23 ultra the camera, software, s pen, display, fingerprint reader and the fast software updates are great. Plus the battery life with the 8 gen 2 for galaxy is amazing 10 hours of screen on time and about 1.5-2 days of ussage is no problem. So i don't mind charging it for about an hour.",3 days ago (edited)
Ian Thomas,"Despite the impressive features of this phone, I still feel like new devices need new functionalities - I foresee satellite connectivity becoming a new arms race relatively soon. I would also be interested in things like bringing back IR blasters, more ports, radio-based local communication (walkie-talkie style or like a local network), maybe a laser rangefinder... I would happily accept a phone that is twice as thick as current devices if it had features like these. Making devices massively more robust, rugged, and capable of longevity is another thing I am interested in too.",3 days ago
Andrew L.,"""Getting crazy"" is the closest that MKB will ever be to say good things about Android phones. Crazy!",2 days ago
Maurice Himmelmann,"My first smartphone, around 10 years back was the sony xperia GO in bright piss yellow. Loved that thing to bits. But man, it doesnt even come close to todays smartphones. Back then it had trouble playing temple run smoothly. Put todays basic android on and you can no longer use your phone haha",3 days ago
Mohamed Naflan,This goes to show how important Sofware and Design is ,3 days ago
heySpookyBoogie,If they just found a way to waterproof/fit a replaceable battery (even if it’s not as convenient as old school phones) then you wouldn’t have to worry about damaging your battery from charging “too fast” etc.,3 days ago
DaveTheFreak,"Now this with the option to disable all post processing would be awesome, especially for video (I'm so tired of the oversharpened smartphone look).",3 days ago
Maksym И,Dude I still remember the first Find X which has the full screen display and the crazy moving camera! ,3 days ago
Duffy,"just one question, if it were to load itself to heat up the battery while charging, would it not also consume battery power at the same time??",3 days ago
The Lonely Loner,Shout-out to everyone who worked on this amazing intro ,3 days ago
Nicolás Camacho,Looking forward to the day when batteries last a day with 10+ hours of screen time,3 days ago
Anthony Bush,I remember in 2014 when the lg Optimus g pro came out and i thought it had really good battery life. I still have mine and its a good phone,1 day ago (edited)
V_STANDS_FOR_VALUE,"Idk man, my 13 Pro 512gb is an animal in everything it does, as power user I hardly find a reason to upgrade these days",3 days ago
Traceur Snow,"I low key want a slow charging feature. Like i don't need fast charging when I'm putting my near dead phone to charge over night. Like, i want to maintain the health of my battery, and something about leaving my phone fast charging over 6 plus hours sounds detrimental in the long run for that battery's overall health. Maybe I'm wrong and I'm just over thinking things lol. But after dropping nearly 1g on phone i kinda sorta want it to last longer than a year",3 days ago
Moe Thet Nyi,"You should try Night photography with that phone, it's pretty good and amazing",2 days ago
A P,"Man, I really expected MKBHD  to say the battery gave a full 3 days charge based on how started the video. ",3 days ago (edited)
sundaynightdrunk,I grew up in the '80s and wanted nothing more than to see the future.  It seems like it's finally here.,3 days ago
Adrian21,The ultrawide and telephoto sensor size is the exact same as the main sensor in the s23.,2 days ago
Finn Ekberg Christiansen,Wonder if you in some way could make a camera with nearly software only. One simple lens and the software takes care of the rest of it.,3 days ago
Zaosh Elavia,Is it just me? Or is the 2 Tone leather look just the most beautiful thing you have seen on a smartphone with such insane hardware?,3 days ago
Grab Adventures,I just want a phone that does what it's supposed to do.,3 days ago
MrMurray88mph,"Impressive machine. There is one thing I cannot seem to be able to understand about the Android world unfortunately. Why on earth the top flagship from a big manufacturer can just ship with a chin.. again... in 2023.. And I feel it's just me, everyone (but Apple and Nothing) seems to think that this is fine. ",2 days ago
mac mac,super good camera. Nice design. I really love it.,17 hours ago
Lumma's Travels,"The latest phones are impressive but, they simply don't blow me away. Like you said, when phone screens went 300dpi and you could no longer see the pixels, what's the point of going further? The last giant leap forward I had with phones was when I switched from IPhone 5 to Samsung S7, the bigger screen and better camera was incredible. Next I went from S7 to Note 8 and it was just the full front screen without the home button. Next was the Note 10 I'm still using and when I went back to the 8 for a short while when I had a broken screen I hardly noticed any difference. Newer phones have removed features that i care about (headphone jack, SD card expansion). I'll probably hold onto this until it no longer receives updates.",3 days ago
Ali Ettienne,"I can definitely spend frivolously on that Oppo phone just for the camera, ""please take my money""",3 days ago (edited)
Jaakko Airaksinen,The camera bump immediately reminded me of Lumia 1020,3 days ago
Salah Salem,What a beautiful phone ,3 days ago
PRABESH PURI,This is one of the best looking phone out there.. yeah its oppo but that aesthetic is crazy,2 days ago
da911beast,Thats like the equivalent of putting your car on a dyno and flooring it to warm the engine  (or battery now) up,3 days ago (edited)
kyle litwack,I actually think display is one area where things haven't come that far. Eight years ago back in 2015 the gallery s6 had a 1440p OLED display. It was a different aspect ratio but around the same ppi. I went with the LG G4 back then which also had 1440p although I think it was LCD and it still loocked incredible. That was my favorite phone ever. I miss LG.,3 days ago
goqu,That's one beautifully designed phone.,3 days ago
Jan Pruijser,"It be cool if you did a 10 year interval change for a few things. E.g phone, car, television, fridge and vacuum cleaner and see what has changed the most and if you can draw any parallels. ",3 days ago
Nathan Lee,Awesome video once again MKBHD. Always love them!! Thanks!,3 days ago
FingerShoot,I think fast charging technology integrating with a bunch of cool stuff which smartphones are doing for us is more than enough.,3 days ago
Anzal sherif,"Kinda makes me wonder if something like the Samsung Galaxy camera wouldve sold better now, with the market being more chill about the thickness of camera bumps and the overall size",3 days ago
spahi4,"I'd like to see some comparision between cameras on this and Samsung, Pixel, iPhone",3 days ago
James Rieth,My nostalgia is the droid with the mods including a hasselblad camera. Loved the gen 2 speaker it had too. This thing looks bitchin,3 days ago
Silica Strong,Mkbhd is still the best. I normally watch on 2x speed but for you I like and 1x. Keep it up :),3 days ago
JDBass36,This is a phone I'll probably never see in person. But definitely looks interesting,3 days ago
Andy Smith,"I never care about charging if my phone lasts all day. I have the S23 ultra at the moment and yesterday it had been off charge from 04.30am, 17 hours 55 mins. I had 4 hours 30 screen on time and went to bed at around 10.30pm and still had 51% battery left. I almost feel guilty not only using half its power storage ",3 days ago (edited)
RJ B,I miss the old MKBHD intros. They were quite epic.,3 days ago (edited)
Irfan Jamaluddin,"Even the find x5 pro is that good, can't imagine this one.",3 days ago
