comment_user,content,comment_time
Lance Lindle Lee,"Feel that Marques only added the stuff about how phones were 10 years ago because he didn't really say anything special about the phone, not much to talk about. It's a high end phone with specs about what you'd expect from one. Didn't feel that mentioning the old stuff is necessary in a phone review. This is not a retrospective.",3 days ago
CryptofanNJ,"Another awesome phone that we in the US can fully use, guess we are destined to be stuck with Apple, Samsung, Google...sigh",1 day ago
Pointern,If they gonna put the camera poking out like the samsung phones and this one does.. why not make the battery bigger and make the camera flush ??? I use my phone ALOT (s22 ultra) and i need to charge 2-3 times pr day.,3 days ago
Terry Watts,That phone is gorgeous,1 day ago
S Gill,I got like 300 apps on my samsung fold 4. Its amazing he battery is still good,23 hours ago
sumitabha chatterjee,"All the hardware and tech reviews aside, i want to know what's the Daft Punk helmet doing in the desk behind?",3 days ago
Mohammad Ali Fouani,"If camera bumps are getting bigger and everybody is okay with it, why not make the whole back side flat by adding more battery? Phones are not supposed to drug addicts, who need to get a shot every few hours!",1 day ago
VBR,That merch is calling for my money,3 days ago
Adhiraj Mittra,Skipped 4 ads to watch this video,3 days ago
Yackable Johnson,The battery charging feature seems like the worst feature in the entire world. It's basically overloading the CPU and stressing the components because people don't have the patience to wait for their phone to charge? Sounds ridiculous.,3 days ago
Peter Milanovski,All day battery? Doesn't exist! Has never existed for me! ,1 day ago
Ricky Firth,"Americans: 'You're in Canada, it's winter...something crazy'",3 days ago
Neeraj Sharma,"though I wont buy Oppo or any true Chinese brand, I must say they have really taken to smartphone innovation. They are what OnePlus should have been. Their Flip phone is better than Samsung's. Though samsung had early lead advantage and been doing it for years, Oppo just drove past them",22 hours ago
bigmonstermandd,Been hanging out with @mrwhosetheboss with those puns ,1 day ago (edited)
Cody Hickenbotham,Nice Daft Punk helmet back there.,3 days ago
benjamin rossignol,"It could be interesting to consider buying stuff that comes from ""friendly"" countries. And not be fooled by the crazy spec sheet. It's just a phone...",3 days ago
Captain Price,man your hoodie is dope,2 days ago
Alex,My mind: 8/9 years ago you mean 2000 right?,3 days ago
Noah Bersier,"I think Marques overhypes this phone a bit too much. Good Battery life is nothing new to the market, good display with 1-120hz and adjustable colours, nothing new. Heating up the battery? Why tough? Who is charging his phone outdoor at 0 degrees C? Optical Fingerprintreader is alright, ultrasonic in Vivo, Honor and Samsung is better tough. Camera is great but looks not like something S23 Ultra and Xiaomi 13 ultra can't keep up with.",3 days ago
SamiK,Marques is too young to remember the times when phone batteries could last a week.  ,3 days ago
Grilled Cheese,As smartphone tech advances I begin to wonder if I’m the only one who doesn’t care at all about the camera.,3 days ago
Michal RV,20 years ago: What's a good battery life? 7 days....,7 hours ago (edited)
AB Pro,What we learnt from this video: perform heavy tasks on ur phone before charging it in a very low temperature room,1 day ago
Lynxx Lancer Plays,fast charging kills battery longevity though.,4 hours ago
themrjones,"Software on cell phones has just caught up to where custom ROMs were 8 years ago. So funny. This girl does anybody remember the Galaxy S5 days with the custom ROMs where it had the walking mode? Where would overlay a camera shot over? Anything you were doing on your phone so you could essentially just go about your day walking but you could see in front of you and you could still do what you need to do on your phone. It had both images on the screen at the same time overlaid over top each other. Plus overclocking, underclocking, under volting, CPU and GPU. Hell they had a toggle for everything, hell it feels like we are going backwards. Pixel phones rite, you open the camera, switch it to video because I never take pictures. I only take videos. Go back home or go to another app real quick and then go right back into the camera. And what does it do it switches from the video to the camera. I didn't close out the app so it shouldn't restart. Why does the camera restart every time I go into it?. Google your tripping. We don't have a toggle for the 5G so we could turn that on and off real quick. Charging slow as hell. I mean this s*** is crazy. I swear I had my old phones clocked almost three gigahertz that was 8 years ago. And I remember my phone running so much better than phones these days.",3 days ago
Βασίλης Ιατρόπουλος,i believe  phones companies except Apple and Samsung will never be accepted by MKBHD although they are pioneers . Just a small piece of admiration,1 day ago
eren gökduman,Can I get multiple entries for ,3 days ago
King Abdallah,Nice keyboard ,1 day ago
Devrim Akpolat,My heart goes to the entire community for Amazons AWS33X building up something even my old dad can understand. This is so smart by them to launch it to shatter the doubts and fears of the common folk which is not even correct to begin with. Everyone knows the state of inflation and recession now and the way out is already in progress. Now it's just about catching the big fish,3 days ago
satyajeet sondarva,"No matter how amazing this phone is, still it’s not going to be a your daily driver for you as you’re a Apple, Samsung and Google fanboy. ",3 days ago
V0LDY,"Skeptical about the ""vegan leather"" part.",3 days ago
Gregg F,What exactly was that sound at ,3 days ago
L A,The Samsung S 23 ultra will still slap the crap out of it. It’s not even close.,3 days ago
Andrei Andreev,"Honestly, phones, (starting with 2019ish?) have lost my interest altogether. Their prices on the top end more than doubled but the highest tier of low end phones or starters in Mid-tier are just SO good that getting anything more expensive is like going to a restaurant just to order a bottle of water and pay 5x times more than going next-door and get it from a grocery store. You're spending just to spend.",3 days ago (edited)
King-0f-Hero,Am I the only one finding it strange that this video is solely focused on hardware and doesn't really lose a word about thr software of this phone?,3 days ago
Piyush Arya,240 Hz touch sampling rate?,2 days ago
Xiefux,if only iphone had this camera.,3 days ago
Jonny Mags,So you’re gonna sit there and tell me that’s not an apple logo reflecting on the steering wheel? ,2 days ago
Eleftherios Piperakis,I don’t see any substancial difference from the S23 Ultra tbh,2 days ago
Kelvin,"Felt like an ovestatement/overreaction/paid-promotion to talk about this phone. Yeah I get the evolution of hardware/software we've faced from the past few years, but that could easily be talked about in ANY smartphone video, or just a discussion video in general, like you always do... somehow you used this to praise a specific smartphone that by far, does not represent such advancements, I mean, yes it's a new phone so it brings some exciting stuff, but let's be honest, there's nothing special about it, there's nothing that the title suggests, almost all of its features are present in other phones as well, or will be in the really near future. This is as boring as a phone can be. And that's coming from a person who owned the Find X5 Pro for about 4 months, got excited at first but realized there's not much in there at all. And about the design, come on... I know that visuals is personal, each to their own... but comparing this ugly camerabump with the previous gen (Find X5 Pro) is a huge sin. At least the X5 Pro was sleek, was unique and had amazingly beautiful curves... this one is just boring AND ugly AND repetitive (Xiaomi 12S Ultra, Oneplus 11, Huawei Mate 50 Pro, Vivo X90 Pro, etc).",3 days ago
thedarkknight1971,7:58,2 days ago
George Heiler,"Not a great take on battery tech from Marques here, IMO. Certainly rosy. Poll the world and I would imagine 99% of people would take longer battery life over charge speeds...we can all leave it plugged in while we sleep. Imagine a week of battery life.",3 days ago (edited)
Russell,Lol they going back to the 1+ 7T oreo camera setup,3 days ago
Ghostfenix,Do another DREAM PHONE video! 2023 Edition ,3 days ago
Shayneel Chand,Snapchat just told me it has AI now,3 days ago
Romeo,"Honestly, idgaf about amazing cameras on a phone anymore. I feel like there's too much emphasis on cameras atm.",3 days ago
M.Chip,Wake me up when new batteries allow phones to last at least 3 days full use and a week on low use.,3 days ago
McKay Bleak,The lack of alliteration leaves me languishing over the legitimate likelihood that this was written by ai,3 days ago
gracenecks,"One thing great about apple products is THE SOFTWARE, other than that chinese companies are far ahead.",3 days ago
Salifu Razak,"@MKBHD, I hopelessly NEED that hoodie! 🥹",3 days ago
Damon Zhao,we need to figure out how to get this phone in the USA..,1 day ago
Joe Castellon,"It's a shame this phone is China only. Also, I'd love it if they would call it simply faux leather instead of vegan leather ",3 days ago
The Grizzly Six,TLDR: This phone is a boss,3 days ago
MrDunger99us,"so what does the camera quality looks like, that is my entire concern",15 hours ago
Gaming Tech,Why every YouTuber says curve on a screen is a bad thing...and because of that company started to decrease the curve more and more.... ,2 days ago
Dame ChrissiX,that camera ring demands to be a volume control or something.,1 day ago
Kyle Castellino,Was it just me who thought it was gonna be a OnePlus phone ,2 days ago
vj,The whole video I was only watching his fingers gesture ,2 days ago
Oleksandr Sharko,But how good this phone do the moon photos?,2 days ago
bboy Panda,1M views in first 10h...NICE! That's 28 people every second for 10hours straight..,3 days ago
Sean Darlow,"Expect to see this in a few months in black, with a OnePlus label slapped on it.",6 hours ago
pleasantcrew,Damn...another interesting phone that's not available in the states,3 days ago
Siran,MKBHD Android lover ,3 days ago
William H. Jefferson Jr. (Billy),Looks like  the One  Plus  11.,2 days ago
Kala Techy,"Basically, Its a oneplus 11 pro but with an oppo logo.",3 days ago
MrHumatang,my wife was looking over my shoulder and she cringed and actually gagged at the hoodie pun,3 days ago
Nico Breivogel,What's that guitar in the background at ,2 days ago
AustinL,MKBHD : ,2 days ago
Rascu Valentin,Nothing crazy,2 days ago
Rex Incognito,Counting the air quotes ,3 days ago
Sreeram Nattath,"If you are using a lot of power to heat the battery, will it not slow the charging because now the Phone is using more power ",2 days ago
Billy O'Neal,Is this a Lumia 1020? ,3 days ago
Sakib Tasin,7 inch display???,3 days ago
The Bold Hairspring,"No 4K60 for the front camera? Why? Only Samsung, Iphone and Google Pixel seem to offer it so far ",2 days ago
Jhaco Meemo,Why's it say in the description. It's not getting released outside china?,2 days ago
ahmed saud,I’m switching from iPhone ,2 days ago
NFT WatchDog,Best still OnePlus then,3 days ago
Sachin shah,Make video on Vivo x90pro+,2 days ago
Adonis Aydalla,Lumia 1020 ,3 days ago
Kevin Everett,It's the Oppo find Lumia 1020 leather,3 days ago
CodeF53,phones still can't do all day battery,3 days ago
moves2008,what smartphone is this?,2 days ago
Prankur Verma,That Darf Punk helmet at the back ,18 hours ago
xLi41,and it all started with a nokia..,3 days ago
Vishal Lodhari,"Comparing new phone with old era phones. Would've been better to display ""Sponsored Ad"" or a comparison of new iPhone/Samsung/Google phone with old ones",3 days ago
The Wirld world,Super ,2 days ago
Jens H.,"Wanted to buy, no headphonejack. ;(",3 days ago
Jason Chen,Come think of it... I was working on the leading edge smartphone tech back in the days...,3 days ago
kehinde olawuyi,wish we could go back to the backs of phones being flat and not rocking.,3 days ago
Craig Regnier,That is one attractive phone. Wow.,3 days ago
GameFiend127,Whats the price ?,3 days ago
Hannah Timson,Looks better than oneplus 11 which is a oppo clone of this and i bet the software has less bugs than oneplus 11 to boot even though its almost the same software,1 day ago
Being deeply,But...,3 days ago
Havnav,Looks like an air fryer,2 days ago
Aditya,That's a beautiful phone,3 days ago
Leandro!,The Smart phone gimmick is the Apple logo.,3 days ago
thewonderofyou1,What's the Android/security update policy for oppo now . With Samsung doing 5 years they need to be the same..,3 days ago (edited)
FiRi Does Things,What is that sound at ,3 days ago
DODO,I feel like phones are just putting all their efforts into cameras,3 days ago
Niklas Malmqvist (n.m production),"What do you need all that power for? I make some calls.....send some messages, maybe take a photo from time to time and check my Facebook. I would probably be fine with a iPhone 4 or older...",3 days ago
Sam,Oppo the new OP?,2 days ago
Thang Nguyen,Remind me of Nokia phone,3 days ago
AJ Masters,You didn't mention the Chinese spy wear capabilities,3 days ago
EdAnything,"yooo just came from nothings ear 2, heheh, would like to hear what you think about the new buds!",23 hours ago
Aubin Baldonado,"Marques, under the hood? Come on",3 days ago
Beauty Neytiri,what is your problem if your battery only lasts one day or two days if you're lucky ?,3 days ago
Sissako Aboubacar A-TÔNTÔWU,"hello how are you brother, I have a question to ask you, because soon I will buy a smartphone.  In your opinion between the google pixel 7 and iphone 14 what choice do you make, and why this choice?.  thank you so much forever ",1 day ago
Castawayarmy32,Do u guys know if is this coming to the uk ik u only get 256 gb n what date ,1 day ago
Jeremy Lanier,I just saw MKB got arrested for battery.,3 days ago
Gabriel Mesa,Companies need to stop with those curved edges screens,3 days ago
Zeus Starfall,I want buy it know ,1 day ago
anushree jain,How is it different to one plus 11 . Can you make a comparison video,3 days ago
Rhysers,Is it much better than a oneplus 11?,3 days ago
Tanay Vasavada,1.05: MKBHD forgot it's not Auto Focus!,2 days ago
Arjun Chickering,"""Vegan leather"" ",8 hours ago (edited)
Mayank Jairaj,Yass! Periscope is back! ,1 day ago
Bryan Kalloo,Half Vegan leather? Lol is that a thing? Also shoutout to Kearny NJ ,3 days ago (edited)
Umang Krishan Sharma,i love your keyboard,1 day ago
Will Haddock,Wow that UI looks like a direct rip of iOS haha,2 days ago
Sean Omar,Nokia 1020 vibes,3 days ago
Joel Justin,That FunTouch OS is an abomination to run on such a premium phone,2 days ago
Rob Dean,at this point maybe we don't need super thin phones. maybe just make the entire phone a few MM thicker so there isn't a camera bump in the first place?,1 day ago
4meli,That phone is better than my 2015 macbook pro,1 day ago
thedarkknight1971,"MANNNNN! It's PHONE'S LIKE THESE I WISH ran barebones/Pixel/Nokia/Motorola Android... A clean sheet, so to speak. NO overbloat with apps you DON'T WANT/CAN'T remove.... I'd have a Samsung Galaxy S22/23 Ultra IF Samsung STOPPED installing their JUNK Clone apps that CAN'T be uninstalled... Sick of GREAT/Powerful hardware being released, hampered by bloated OS's... ",2 days ago
Tegridy-Farms,"I like oppo but they basically took the Xiaomi 12s ultra,upgraded it to the year 2023,improved some small things and then sell it as a innovation. I don't mean that this phone is not impressive,but when the Xiaomi 13 ultra will be released,the imaging and software will probably be even better then oppos.",3 days ago
Clapper Dan,"""AirVooc Wireless charging""",3 days ago
Jimmy Fire Dragon,@MKBHD. Are you reviewing the Magic5 Pro Soon?,12 hours ago
Mosab Nabil,I See Honor magic 5 Pro ,3 days ago
Eduardo Oliveira,You are wrong… we get -35 to -45c around here in the middle of the winter. ,2 days ago
Alvin Sovereign,Nokia Lumia 1020 vibes FR,3 days ago
John Mac,"Oppo 0 percent US market share, boy they make great phones. Lol",2 days ago
Pablo,What phone had proper all day battery life in 2013?,1 day ago
Floating Peaks,Also is chinese spyware included for feee,3 days ago
Teves 9,Thx for using degrees Celsius! ,3 days ago
Help Me,1:21,2 days ago
Radoslaw Sowinski,nice selling ad ,3 days ago
Adrian Ecea,And if you think the ring came from the Huawei Mate 40 Pro ,3 days ago
Graeme Johnson,"Look mum, my Phone has Vegan Leather.. That's nice son, so dose Grandma's 1970 Dinning Chairs...",3 days ago
Kats072307,"I was ready to order it, but then I heard the leather is vegan, so I said no way",2 days ago (edited)
FROZEN❄️BLAZE🔥,@marques i am getting an iPhone 14 256 gb in a couple of weeks for my birthday and i have chosen airpods 2nd gen as that is the only apple product i could adjust in my budget is that a good decision or should I change it will take any good advice from the community too please help me as i am unable to get to a conclusion,2 days ago
sreejith .v.r,Hi ..M K B H D  please review some Motorola phone’s…..,3 days ago
Dave Is Great,"If it's not an iPhone, don't bother. Since I switched to the iPhone 14 Pro I can tell you the air is fresher, the food taste better, the sun is shinier, the beer is a perfect temperature and the grass is greener.",3 days ago
katsuki,the voice crack lmao ,3 days ago
Donald Stash,Sometimes i just be watching these random vids because its been posted by mkbhd otherwise I don’t really care about the that oppo phone all that much,3 days ago
As-if If-as,If you think smart phone tech is improved you should see smart fresh lights.,3 days ago
Pedro Sanciny,Just give no nonsense compact midrange please.,2 days ago
Chris,If only the screen didn't flicker. Also the periscope camera looks out of place.,3 days ago
MT,I would really think twice to buy a Chinese phone today.,1 day ago
GoodWinEyes,"So what's about the phone, Marcus?)))) ",3 days ago
𝐜𝐥𝐨𝐮𝐝𝐞𝐝 𝐞𝐬𝐜𝐚𝐩𝐞,1:38,3 days ago
Thomas H,Does this phone make any sense with the chinese software I would never use?,2 days ago
Pan CM,"I won't be surprised when all these oohs and aahs have settled down and the the phone is actually out shooting, the software would again be disappointing especially in video, like what's happened to 99% of all Android phones so far.",1 day ago
Bormen,"If there is space for camera bump of this size, then why can't we have a 3.5mm jack bump?",2 days ago
Jeremy Harlem,@mkbhd can someone tell me which video he started by saying 'expectation is the killer of joy',1 day ago
TxxT,"If you're gonna use this phone, you better install grapheneOS cause rest assured they WILL have massive data harvesting going on. You wouldn't be able to fart in a room and not let that data go somewhere ominous.",1 day ago
Simeonov Dimo,Pls review Nubia Z50 Ultra ,2 days ago
vishwa A,possible one plus 11 pro max,3 days ago
Hydro Aegis,I'm ok with slower charging if battery lifetime is longer.,1 day ago
Lubomir,How is it better than Samsung or iPhone?,3 days ago
screenshot,I'm oppo usages very different smartphone I like oppo from Bangladesh Dhaka,2 days ago
hasono hasono,"Look back to 8-10years ago when people heard about mobile phone from china, they would feel like low class and cheap phone. And now one of the most selling flip mobile phone in Singapore is from Oppo brand. ,",1 day ago
Susmit Das,"This is basically a OnePlus 11 with a better camera, thought he would say least mention that",1 day ago
Incrazyboyy,They be really making this crazy hardware and then slap that ugly UI on it,2 days ago
EoRdE6,"""vegan leather"" yeah I remember when the Note series had ""pleather"", they should've branded their plastic leather better I guess...",3 days ago
Ameya Gaitonde,2500 nits??? Woah!,1 day ago
Davut Akkas,This innovation to bring a new generation of assets with the first one obviously being AWS33X,3 days ago
osaman ertasş,Like everybody knows ico projects make x10 x20 in bear seasons I've joined a couple of projects along with ,3 days ago
Y E,9 years ago no one expected a whole day battery. Maybe a few android users walking around with tablets instead of phones. And even they knew its for the first 3 month before samsung releases an update to remove their software lies installed for reviewers (all those geekbech lies and battery updates),1 day ago
Shahadat Hasan,when he call Oppo every time I'm listen  he call Apple ,3 days ago
Valence,Nice Daft Punk helmet lol,2 days ago
SpongeBob SquarePants,Is that a daft punk helmet???,2 days ago
Yulian A.,How much oppo have paid for this?,3 days ago
Iamyoda,We get NONE of those cool phones in the US.,3 days ago
L_SS,Feels like a non-disclosed sponsored review.,3 days ago
a2swebber,Time for handwarmers,2 days ago
christos_x86,can u explain more that vegan leather?,3 days ago
Ramazan Mumsuz,There will be a time everyone talks about AWS33X. Wait it's already happening just noticed,3 days ago
Kalyan Kumar,Okay. What's the intro and outro track?! Can't find it on mkbhd Spotify,3 days ago
Karma Yeshi Namdak,"Mkbh is sold! This feels like sponsored by oppo, this video feels different",3 days ago
Hasan Nazarov,Android/google is getting smart. We are getting notifications on Earthquake.. today for instance there was an earthquake of 7.7 magnitude.. and I got notification just minutes ago being located 311.5miles away from the epicenter.. which is smart!,3 days ago
Kamil A. Ali,Nice hoodie bro ,2 days ago
tipoomaster,Weird that Carl Pei is reviewing this,3 days ago
@Eyoba tech house,I can't wait to play with thise thing,3 days ago
REVIEWSONTHERUN,Cool!,3 days ago
Matt Barker,Oppo lumia 1020,3 days ago
Ravi Yadav,Htc m7 vibes,3 days ago (edited)
Shreyash Dwivedi,I dont get the point of comparing the phones with way back the time.,3 days ago
Oliver Polden,What is under the hoodie?,2 days ago
Harish,Yay Canada!! ,3 days ago
Johan Marais,5000 mAh. Cute. My phone is packing a 8580 mAh battery.,3 days ago
Jutsch80HD,"If your phone needs 16GB of RAM, it’s your software that sucks",3 days ago
Super knullisch,2:05,2 days ago (edited)
Nonukez,When all modern phones are so good that you have to start comparing them to old phones to make them sound good.,2 days ago
TheVeyron81,Doesn’t have the privacy that Apple provides.,3 days ago
Philo J,Those cameras look like eyes,2 days ago
B illerman,"those big camera bumps could go away, I want to charge in my car.",3 days ago
Abulfaz,If you want to do one thing right this year you have to understand AWS33X,3 days ago
88dd881,"The camera reminds me of Hal in Space Odyssey 2001.  Your country is on the brink of information cold war with China; ""run an artificial load in winter... to quickly charge the battery"".  Pretty Trojan horse. ",3 days ago
Luka Wu,wait.........,2 days ago
𝒁𝒖𝒄𝒌 𝑴𝒂 𝒁𝒊𝒄𝒌,Naaah that photo of a water droplet... ,2 days ago
L O S T,The meat riding is crazy,3 days ago
Esteban Outeiral Dias,Daft Punk helmet in the background nice 🇫🇷,2 days ago
Kitso Nkawana,😊,3 days ago
zaid YT,0:38,3 days ago
Aaliq Moin,I wonder why the switch games were out? Testing the next gen switch perhaps?,3 days ago
J*,"Still a hole punch, though",3 days ago
Lern Mor,Does Marques cornstarch his hoodie's pull strings? They barely move or flop around at all as he moves.,2 hours ago
Hunter Hawkins,camera and sensor are half the size of the device and the photos still look like they were taken on an iphone 8 ,3 days ago
FlowPR,Its just a s23 ,2 days ago
Acer0c,"Maybe because it's on YouTube and not full size, but those photos didn't impress me very much. Meh. (not compared to other phones, just in general)",2 days ago
Issac Muhammad,The first HTC Droid,2 days ago
S. H. Kalyan,looks like a silver mobile strapped with scotch tape. lol,1 day ago
s,Marques sir @mkbhd plan a video with Technical Guruji,3 days ago
hakan andaç,When stocks and common assets decrease 70-90% Amazons ,3 days ago
Hall.p,why is every phone that isn’t an iPhone running on an Android OS. Is there not anything else?,2 days ago
آموزش رایگان باغبانی و کشاورزی,Thank You. Be Green and Keep Growing ,3 days ago
Marijn van Aalst,Granit?! “taking it for granit a little bit”?,1 day ago
Finding nirvana,NO TO ITS CAMERA ,1 hour ago
David Goode,"Not gonna lie, love your content Marques, but this video feels like an AD",3 days ago
SilverFang,What is the intro song/music? Couldn't find it on the spotify playlist.,2 days ago
136578268,So soon Oppo will be put on the US sanction list just as his predecessor Huawei,3 days ago
Noah,I feel like Markus says the same thing in every video,2 days ago
Milos,2:29,3 days ago
Kassandra of Odyssey,HAL 9000 as a phone,2 days ago
E Mu,A hassy is like the Bugatti of cameras,3 days ago
Alpert Wang,"Marques's database should be refreshed, more than half of those stuffs are not new.",2 days ago
Janna J,You look so so much like my son everything even the way you talk ,3 days ago
vadergrd,too bad i don't  also want to get spyed on by chinese google or apple is enough for me ( not to mention samsung or sony...),3 days ago
Ryzen Agustin,I don't watch TikTok these months,3 days ago
dmacmakes,"Dave? What are you doing, Dave?",3 days ago
chuck rada,kept staring at that daftpunk helmet...,2 days ago
Baddela Geetheswar,Under the Hod lol,3 days ago
