comment_user,content,comment_time
Shutterclosed,"Seeing this from India, all these 3 points are just sorta normal for us. The camera is the main thing that is different otherwise nearly every second mid range phone is providing these features and more. ",2 days ago
Phonk Equinox,"This one has a more ""sponsored"" feel compared to your other videos",2 days ago
BEKİR ANIT,"Need more smart input on the AWS33X Amazon planned this for years and this way we can conquer the recession, let's go Brandon!",3 days ago
Mathew Omolo,i would be okay with a phone twice as thick and does more in terms of camera. ,2 days ago
Khaza Rouf,"I'm finding it difficult to see the novelty here for the Oppo Find X6. I mean don't the recent flagships from major brands like Samsung, Xiaomi, Vivo and others already have similar features and capabilities? Its certainly a good phone no doubt, but its nothing to write home about either.",3 days ago
SEVENTEEN AWM,1:21,3 days ago
Le_Rat_moneur,"I don't feel the need to upgrade anymore. I got an S20+ still on android 11 with a exynos apparently they're pretty bad but everything from the performance tothe cameras, display abd battery life is enough for me. I don't think most people need more tbh",3 days ago (edited)
Sec109,I love when companies do out of the box stuff with thermals.,3 days ago
Conor Lane,Okay so I NEED to know who has an Aristides guitar in the MKBHD office,2 days ago
James OKeefe,It's funny we've come full circle where phones started doing everything to back out to specialized task drive devices like gaming phones etc. It will be interesting to see how far the specialization goes :) Scientific phones with FLIR and chemical sensors :) the future is very interesting. Thanks MKB!,3 days ago
K-SING–PRODUCTIONS,"Bro, that intro is strait ",3 days ago
Daniel Rieger,I still wish they just made the phone a bit thicker to compensate the camera bump with extra battery,3 days ago
Edward Lam,3:20,3 days ago (edited)
fistinair,"Okay, enough about the smartphones the Logo intro is getting, even more, crazier loved it.",3 days ago
Maximec j,I love the design,3 days ago
Mubarak Graphs,This phones with circle camera bump on the back reminds me...Good old days of Nokia Lumia 1020. Been a decade Marques...,3 days ago
AR.,👍,3 days ago
Tyler,No lie. I thought that was a Nest thermostat on the back of a phone at first glance. ,2 days ago
Serpent Vert,Many places in the states are just as cold as places in Canada. Take New York and Toronto for example. We don't all live in igloos up here MKBHD ,3 days ago
Tim R.,What I'm wondering about...,3 days ago
Żółć,"Dude, I remember phones working ",3 days ago
Kamil Knap,"will any of your youtubers focus on all the functionality we have lost from one generation to another? F.e. oxygen level monitor, quality of 5G antennas in cell phones going down, camera functionalities...",3 days ago
Maximilian Schmid,The light is very nice in the shots with marques - goood job,3 days ago
Dennis Marfo,I know Oppo was killing the game back then with their DVD/BLU RAY / SACD and CD drivers.,3 days ago
4k african wildlife scenes,I like the phone ..I use OPPO find x5 pro..I will upgrade Oppo find x6 pro soon greetings from Nairobi Kenya 🇰🇪,2 days ago
Manuel Stadelmann,That's the smartphone to match Mac's color pattern!,2 days ago
Shanon Francis,Ultra low temperature charging mode. Boy I had something completely different in mind lmao. I thought it will charge at a low power to reduce temperature while charging for a longer battery life.,2 days ago
techienate,That thing is straight up gorgeous,3 days ago
Will Beebe,Hasselblad... wtf?! Dope.,2 days ago
Lee Butterley,The Nokia Lumia 1020 was there well ahead of its time 10 years ago with that giant round back camera bump.,1 day ago
johaarup,I still have my Oneplus 6 with the camera in the center - and that is where it should be!,2 days ago
COD warrior BD,"Oppo find series looks better and better every year. They even upgraded the camera to insanity this year. But the mystery is, why they keep ignoring the selfie cam and video all togather? What's their point? People who are willing to pay top bucks are also expecting top bang for their buck in every department. Not just in looks or still photos. That is the reason people from the international market will keep choosing the likes of samsung or apple ! Oppo better up their game next year if they want to compete on the highest-tier smartphone market internationally !",2 days ago
RECEP Sevük,I bought ,3 days ago
RealTamis,"Marques be like: ""air quote"" ",3 days ago
AMRelts1502,"Had the Oppo X5 PRO  for over a year it genuinely is the best phone I've ever owned or used. It looks amazing, the fastest I've used and that 80w charging is a game changer for me.",3 days ago
Deveon89,I also love my 14 Pro’s camera island for holding the phone.,3 days ago
edits.,Always love the intro,3 days ago
Oliver Helfrich,"20 years ago, my phone would easily last a week when fully charged ... ",3 days ago
BattleRapMultiverse,Vivo x90 pro plus has the same spec sheet and it came out before this phone. Fastest ram and storage.,2 days ago
Kuduva Bharath srinivas,I am waiting for who gonna make gaming foldable phones...,3 days ago
Govind,The design reminds me of Lumia 1020,2 days ago
Diego Moreira,"As a Software Engineer, we hired ARM CPUs in AWS cloud to process route optimizations, Perfect example that smartphone hardware got really crazy past theses years.",16 hours ago
Andrew Barry,"Coming from some of the first digital mobile phones until now, I agree. Phone tech is truly mine blowing how far we have come.",3 days ago
Neeraj Nandan,"Just realized,, I Love this guy so much that I can blindly ignore his awkward dad-jokes! ",3 days ago (edited)
Aleccino,Incredible looking device. God they better launch internationally haha,3 days ago
CodePlay,"He probably knows the phone doesn't work, but just like he did with the Samsung batteries swelling and the fake moon photos, he's gonna keep quiet until someone else says something.",3 days ago
sofaripper,"I think when you said “extreme cold, like 0 to -25 C” everyone in Russia started to laugh;)",3 days ago
Chris P. Bacon,I can't be the only one who sees shocked Pikachu when looking at the camera design. Lol,3 days ago
Chris Haunch,So refreshing to hear centigrade being used,3 days ago
Edd,Kudos for the Aristides guitar ,3 days ago
[insert Name Here],"As much as there's a standard on charging connectors, I feel there needs to be a standard on fast charging across the board.",3 days ago
James Moore,Personally would prefer less capable displays and cameras if it meant for a more streamlined (and better looking) chassis and better battery life.,3 days ago
Timilehin Adetisola,Marques Puns are so dope ,3 days ago
lesslighter,"you know what would be funny.... we will get a one point where we measure LED panels not in nits but in lumens and then we start get in the ""dubious"" territory having phones blaring out 10000 lumens on amazon and ebay",3 days ago (edited)
Charith Kaushalye,Marques is in a good mood today...,3 days ago
Karl,I'm so gutted this is only in China!,3 days ago
Smokerrr,I like these phones in just reviews.,2 days ago
Karan,"Definition of crazy to Marcus, 'Canada in the middle of winter'.... ",3 days ago
Ash C,"I wonder how well that leather would hold up over 1 or 2 years of being put into and out of pockets, being held with dirty, greasy hands, and just general wear and tear.",3 days ago
Flip Cobin,"Celebrities deserve worship, but gadgets deserve love too. Nice to see someone worshipping gadgets for once, hopefully it will inspire others to do the same.",3 days ago
Electricblaze,3:40,3 days ago
Rares Macovei,"If only OnePlus would do proper flagships again, like Oppo does. Their last proper flagship was the 8 Pro, arguably 9 Pro.",3 days ago
Gunnar Norred,The new Model S rims are absolute gas,3 days ago
saša vukelić ⭐cc⭐,"hoodie joke was good, but i've laughed at the ""focus"" one ",3 days ago
Okan Atlı,Bros ,3 days ago
CR Pro,This should be anyones daily driver if could afford it,3 days ago
Shubhangi Lokhande,Your vids are going ,3 days ago
Jerett Franklin,3:04,3 days ago
Wadderfock,Curved screen is a deal killer for me. Too many swipe problems.,1 day ago
palamida gheo,"if camera bump needs to be so big, how about making it even an fill that space with battery and optimize charging for the sleep period of the user?",2 days ago
TM,"i see , Xiomi is surrounded by fierce competition in its own turf.",3 days ago
Diwa Alejandro Galvez,Dat MKBHD keycap is dope.,2 days ago
Eric Marcelo,I like it a lot,3 days ago
SteveJG,"I don't think people comprehend how far we have come because the market has been a little ""stale"" for awhile with the typical ""slab"" phones. Just the other day I was at work and had an older gentleman (in his mid to late 60s I'd guess) who told me he was having phone problems. He said his phone no longer answered or accepted calls when he open or closed it. Immediately I thought oh boy what old flip behemoth is this guy rocking, but to my surprise he pulls out a Galaxy Fold. I asked him why he bought it and he said he could fold it and it fit in the front pocket of his shirt and he hated having a ""big phone."" Just your average guy walking around with a phone that even five years ago I as a younger man would have scoffed and said there is no way these will ever be normal they are too expensive and experimental. We all take it for granted how insane our phones are in this time.",1 day ago
Daniel Henz,Is this the genuine hasselblad shutter sound?,3 days ago
B3NX,this must go global,2 days ago
Daniel,If it will run loads to get it warm enough to charge wouldn’t that just drain the battery and then charge up that portion on top of what you were originally going to charge? …,2 days ago
Arda Emre,Beautiful content im bullish for  ,3 days ago
Carl,Reminds me of the Lumia 1020,3 days ago (edited)
jwr,"Can we just start making phones a little bit thinner, flush with the camera, and start using that space to add battery, or cooling, or just use the space for something else useful?",3 days ago (edited)
Jimmy Liao,Canada in the middle of the winter is apparently something crazy.,3 days ago (edited)
Fethi Ahmet,For the most time of this year if you would invest into anything it is not doing very well I mean that's pretty obvious. But the launch of AWS33X plays a different game and it is less affected by such moves as the utility is simply too strong. Just my bet,3 days ago
Andrew Shiu,"1 x imx989 wide matched with 2 x imx890 for telephoto and ultra wide respectively, IMPRESSIVE",3 days ago
Daniel Eberechukwu,Reminds me of the lumia 1020.,3 days ago
CletP758,When I saw the camera I thought What if that camera had like a rotating bezel that would switch between lenses..,1 day ago
Aapka Naam,"If all these smartphones are getting so close to DSLRs because of their processing power, is it not possible for DSLR manufacturers to use better chips in their cameras and again be miiiiiles better ??",3 days ago
Sándor Bence,"10 years ago we laughed at most Chinese phones, now they have the best HW and keeping it to themselves.",3 days ago (edited)
eren baba,"Can't deny the fact that Amazons AWS33X has the strongest bet to bring lights back to this industry after we suffered FTX, Celsius, Tera and so on. Sure if they don't do well it's done for good but the pressure is too high and I think they will keep proper liquidity rather than these others. Don't see them going bankrupt any time soon, lessons learned.",3 days ago
Mohamed Anas,I wish it would be in Dope Tech,3 days ago
T1 Faker,"literally I can't see how good the hardware is, compared to smartphones nowadays, especially those photos lol",2 days ago
superhydrocarbon,i loved my job at Oppo :),2 days ago
Thee Adjudicator,"I really want the leather to be red,  so it resembles a pokeball",3 days ago
Gary White,Great review as always :),3 days ago
Raman Prajapati,One more informative video regarding teck. Thanks,2 days ago
Adonal Arrington II,"How could you not mention the Nokia Lumia 1020 when talking about those large camera bumps, it was the first to do it!",3 days ago
Rodrigo Ambriz,The Lumia 1050 was ahead of its time,3 days ago
YippieCalle,What if a company just gives you a phone and a camera that is software driven. (Cut cost on the initial purchase) but then we can add lenses and attachments to that software ready phone and provide it the additional hardware (at an extra cost) so we get a flat back and good camera(similar to pixel quality) but for camera/photo loving people you get what you want. (You zooms and close ups and the quality etc). Has there been an attempt on that?,3 days ago
Gerardo Arenas,"yes polo is good specs but also unreliable updates, warranties and costumer service, also trying to get it repaired a nightmare, you pretty much need to order the pieces from China and do it yourself",3 days ago
ThunderGod97,Phones that offer options for charging (fast wired+wireless) are the only phones I'm interested in these days. There's no excuse to not have wireless charging today IMO. I very rarely use the wired charging on my S21. I've had wireless charging in every phone I've had for like 10 years. I refuse to buy a phone that does not have it.,3 days ago
Swapnil Mane,I need that live wallpaper,3 days ago
Dylan Nguyen,Does anyone know the specific name of the WoB keycaps at ,3 days ago
Planet Minecraft,"I love how he says it's got a 2,500 nit display so casually",3 days ago
Dylan James Weggz,"Thank you for using celsius. You're a good human. Also crazy to see what used to be defined ""Pleather"" now its VEGAN LEATHER ",3 days ago (edited)
Manu Yadav,This phone design reminds me about nokia 1020 ,3 days ago
Krishnakant Upadhyay,The whole time while watching this video I was wondering why marques tried to compare with a 6-7 year old phone,2 days ago
Amr Nada,The real question is .. What's the point of Oppo sending review units to YouTubers while the phone is exclusive to the China market?,3 days ago (edited)
Douglas Forrester,I will always appreciate the Daft Punk references.,3 days ago
Bits of Pulp,Phones should let you choose resolutions and refresh rate profiles for specific apps/games and a quick setting change switch/button in the pulldown.,3 days ago
Bormen,"About the battery/charging, my oneplus 7 pro is almost 4 years old and it had a relatively big battery 4000mah and 30W ""fast charging"". It's not really fast by today's standards, but still faster than the current iphones. And huawei went even further a year before that with a similarly sized batteries and 40-50W charging.",2 days ago
Tony Stark,"The holy trinity of good phones: battery, display, and camera.",3 days ago
Professor Booty,1:23,3 days ago
Pragmatic Penguin,"""Canada + Middle of Winter + Cold = Crazy""",2 days ago
Barney Laurance,"So what does does ""1 inch type"" sensor mean. Is it really projecting an image circle to cover that 1 inch sensor? Or is it like the trick I think Sony did where they give you a 1 inch sensor but the lens isn't actually big enough or far enough away from the sensor to make an image that covers the whole sensor so they just use the centre of the sensor all the time.",3 days ago
Coach Isaac SA,Shout out to MKBHD and the Studio team for showing some love to One Piece...hope I'm not the only one who noticed it,3 days ago
CaramelCandyyy,This phone can easily pull off a pokeball color theme on the back,3 days ago
JamSliceVA,Design reminds me of the Nokia Lumia 1020 or whatever it was,2 days ago
The Owl,"I really like the hardware on the Chinese brands, but they really need to go easier on the software. There's too much junk on top of stock Android",2 days ago
Shaurya kansal,this video was great for a lot of reasons! can't put my finger on the hood...,3 days ago
Naughty Shake,"10 years ago batter life was a week, you know the phones I am talking about xD",2 days ago
Josh S,"Nice pun lol. It looks like a Nest thermostat glued to the back of the phone, personally not a fan. All that being said. The specs are fantastic and I’ll be looking into this company and following them closely. Great video as always",2 days ago
Jeyson Tilukk,I need those Daft Punk helmets,3 days ago
Daksh Rokadia,"Uploaded 17 hours ago but still has more than 1.3 million view ,bro has made it so far",3 days ago
Da Fonse,"Actually back in 2014, for my electrical engineering class, I made a presentation that showed how phones and cellphones have evolved and there I said that it’s only going to get crazier from there to the point that people will use their smart phones as their main pc, and most people in my classed pretty much agreed with that statement.",2 days ago
Handi,Why is the pop up camera trend not as popular as it is now?,20 hours ago
Aslan polat Pelik,It's not possible to hide it longer and all of us should take some time to think about AWS33X and what it will do to the economoy. On my side I'm very optimistic with this and there is no better time to know about that than now,3 days ago
TRIPPLE-JAY,And a free hand warmer in winter when charging.,3 days ago
Zouz Louz,Circular is the perfect shape of a steering wheel,2 days ago
Kalonji Kalonji,Thank you for the update,2 days ago
Pegasus 777,"The RAM expansion is A Weird thing, cool that phones want to compete with PCs ",3 days ago
Jayakrishna Balaji,"BBK Electronics, the parent company of OPPO, Vivo and OnePlus, is like the TSMC (chip fabrication giant) of Smartphones, hustling in silence and letting its success make some noise!",3 days ago
Jhan Almonte,For the first time ever I can say that I'm watching this from my s25 ultra,3 days ago
Chris Cheung,Just Hands-on. I am meant to think you gonna have a deeper review for this,2 days ago
The Vlog Boss,"Xioami 12 pro has 120 W wired charger , 50 W wirless charger and 15 w reverse charger.",2 days ago
Johnny Georgopoulos,"IDK about anyone else or anyone else's phones, but back in the day, my Galaxy Note 3 running Zion's SlimKat 4.4.4 with his kernel, I used to get 2-3 days of pretty moderately heavy use with 9+hrs of SOT....I used to have screenshots of proof until one day during a ROM flashing binge on a Note 4 Dev Edition it didn't just factory reset in recovery, it wiped my entire Google account along with thousands of pictures, hundreds of videos inside my Google Photos (back when it was ""unlimited full resolution backup"")...... regardless, two things, one, I'll never use a Samsung phone again, two, that Note 3 used to have not just a straight bar across for hours in battery usage info during sleep, but it would actually slightly increase during it's sleep (while running SlimKat and Zion's kernel lol)....oh those were the days....that and Will03's Slim and and Temasek's unofficial Cyanogenmod ",3 days ago (edited)
saran kartik,This is perfection,1 day ago
LH D,"Hey I hope this is not a dumb question, but are you saying all three cameras are projecting light onto a 1-inch sensor? Meaning, there are three 1-inch sensors inside this phone?",3 days ago
Teddy,4:39,3 days ago
Arbaz Sayed,"We got it, Marques. We know what's under the hood",3 days ago
Florpspork,"I set my Samsung A13 to limit charging to 85% and can comfortably go 2 days without a charge. 25 watt charger isn't super quick, but it's enough. It's faster than whatever Xiaomi is doing with their low end phones.",2 days ago (edited)
ItzEagleT,This is amazing,3 days ago
shycreation,My 2018 lg v40 is 1440 x 3120 with a 527 ppi. You can grab it for 120 bucks on eBay. Still fast and snappy..... They're acting like they're giving us new stuff when in fact they're just remarketing things they realized they could make more money on.,3 days ago (edited)
futts player,oppo finally found X that the teachers were talking about,2 days ago
Derek21,If Google ever put a Hasselblad lens on their phones.. man,3 days ago
Abu Salem,"Now this phone needs a DeX like desktop mode, and could replace the computer of the majority of pc users.",3 days ago
slizgi,"Putting aside all new tech stuff about the device, and a fresh design. I am asking when, we will stop getting devices that have uneven frames around screen, and proportionally rounded corners. Apple does that, some Pixel does, and finally last S-series from Samsung got this. Nothing in the design of a phone is off-putting like uneven or badly rounded corners of the screen... And seriously, F all heavy curved screens, bring back the flat ones all around.",3 days ago
Allan Yacaman,"so say it, ",2 days ago
Drityll Zenuni,"When he said that, Samsung goes the extra mile by adding even more zoom so the companies are trying to zoom in with their cameras as much as possible. This industry has changed so much.",3 days ago
Vitya,"""retina"" displays weren't the first high PPI displays FYI. Samsung's phone had even higher PPI before Apple launched theirs. But as usual Apple was way ahead when it comes to giving catchy names and marketing.",3 days ago
Jerry Hodges,"Honestly, I wouldn't mind picking one up.",2 days ago
Usman Ghani,But I Love New Intro Upbeat...So Relaxing and inspiring...,3 days ago
Connor Hearne,Doesn't the one plus 11 also have most of this?,3 days ago
Bolzack,Freezing temperatures - We have below 0 degrees Celsius in Norway all year except May -> September (never had any problems with any of my phones regardless of the temperature outside though),14 hours ago (edited)
Personal,Respectfully... how is it a surprise that tech got better over 6 years?,2 days ago
Marc-Oliver Duval,I like how extreme cold is a hot winter day in Canada (0°C),3 days ago
Davin Turner,That cigarette colorway goes hard. ,2 days ago
Álmos Brumár,You must get crazy credit score for that review ,3 days ago
Kabir Sewani,"As a Canadian, I’ve never objectively looked at how crazy our weather is… how many other places get -35C in the peak of winter..",1 day ago
A1x,"Ok, will it beat Nokia 1020? ",2 days ago
Priyanshu Gupta,"This technology which you're telling MKBHD, of taking the temperatures homeostatic of batter in extreme cold temperatures. I am having it 10 years before back in 2012 or something when I used to do some normal stuff navigate through samsung UI ( touchwiz probably)  and it would warm a phone just like 38-40°C. Now in present the cool thing is with the exynos processor it keeps the phone warm everytime when I am doing nothing  (the phone is idle in pos.) God knows samsung runs benchmarks everytime 24 hrs on his phone now.( I am having homeostasis on my phone for years now nothin new here)",2 days ago
Virna Michelle Villanueva,That looks like the old instagram logo ,2 days ago
Portik,"Love the Daft Punk helmet, just in time for the RAM Deluxe Edition",1 day ago
Saibin Saibin,WHEN WILL THIS COME TO INDIA,3 days ago
Sidney Depina,Ramadan Kareem,1 day ago
Salim Ciz,My ,3 days ago
ckhallock88,I sure wish that Apple would increase the zoom much more than they currently offer!,3 days ago
Daniel Gyorfi,"As one from EU, I love he uses Celsius ",3 days ago
winconfig,"What is an ""one inch type sensor"" as you say? Is it one inch or not? Sony did that and used twenty percent of the sensor.",2 days ago
River PB,"on that note, my OS7 and BB10 blackberry phones with their ""faux leather"" backs lasts me a good 3 days from way back when",3 days ago
Dicephalous 90,Super sick gorgeous design well done oppo,1 day ago
The Office,At this point they are all similar. The differences are so small that it doesn’t matter which one you pick,1 day ago
General Veki,he really said battery specs are impressive and that you can charge w good speeds and have good capacity... magic4 pro exists with 100w wired coming in box and 100w wireless... the phone came out last year... in april and yet its available outside china,3 days ago
kickbeez,would hate to put a case on some of these phones going forward lol,2 days ago
SUV Tropics,"10 years ago wasn't all day battery life. It was like 2 hours of sot, the good ones had 4. Nowadays phones have 8-10 or more sot. Which is crazy. On top of the additional processing. I'm surprised you're not mentioning that.",1 day ago
James Brown Jr.,Me getting all excited watching all these high-end tech videos when I still use an iPhone XR,2 days ago
Some Random Name,Can you force them to realese it in Europe and the US ;),3 days ago
Muhammed Ali Yalvaç,Needless to say Amazons ,3 days ago
Jigna Wadhera,It seems more like an Noctua collab then hasselblad !!!!,3 days ago
TrustMedia Trust,Hey,1 day ago (edited)
Legofan,and i thought the camera on my pixel 7 is large,2 days ago
Nishikant Tayade,I should buy this as running Reddit does require 16GB of RAM :),2 days ago
Rodel Luis,like the tone of this video it makes me appreciate my device now and reminds me not to chace what's new. ,3 days ago
Ezekiel Quaicoe,"I feel how he pronounce ""battery""",3 days ago
Zo,lg would be proud,3 days ago
Sandis Kops,phones 10 years ago use to last for 5 days xD,3 days ago
Shankar Rameshvasuki,"Plz do vedio on gpt4 , can it replace programmers",2 days ago
PeterCoteGolf,You don’t need to upgrade for years now they are so good. I could happily keep my iPhone 14 for several years. Just need to replace the battery.,3 days ago
KING 8,If only it had a headphone jack and an fm radio and expandable storage.,3 days ago
Bence,I love how synthetic leather is called Vegan,2 days ago (edited)
Shopon rahman,Gutted oppo never came to uk,3 days ago
Андрей Павлов,"Похвалил хорошо, но ждём обзор от лысого, тогда всё точно прояснится ",3 days ago
Fardin Haque,Just a thought ,3 days ago
