comment_user,content,comment_time
Sylvanus  Production,I know I keep talking about the Samsung A series phones but I have to say it is nice to see these advancements because we get to see a trickle down of tech into phones like the A33. With the smallrig 50 battery back it can charge with super fast charging which is nice to have,3 days ago
Isaac Alonzo,"I kinda dig the round bump, tries to be symmetrical and classy. It works.",3 days ago
Denario Atreus,"We've officially reached ""Diminishing returns"" peak of smartphone technology.",3 days ago
Stuart Coulson,It would have been cool if the ring around the camera on the back could act as a scroll wheel like the original iPod scroll.,2 days ago
Ank 1,Always bring the best out ,2 days ago
Cubix Wizard,8:52,3 days ago
AR56,"Thats an awesome phone. Very smooth, fast.",3 days ago
warumbraucheichfüryoutubekommentareeinescheissgooglepluspagefragezeichen,3x seems pretty on the low end for a periscope zoom. At sports events smartphones often are the only permitted cameras for normal spectators. So a large zoom would be appreciated.,3 days ago (edited)
Javier Cedillo,Really the two things that hold me from switching to my phone to this one is:,1 day ago
Bhushan Ladgaonkar,Marques is one of the cool persons out there and at moments like ,3 days ago
Tyler,I feel like the phone community unanimously agrees that a perfectly flat screen is the best screen. I also feel like we've voiced this option plenty. Why the hell are they still curving them? I miss tempered glass screen protectors.,3 days ago
Aaron The DJ,That phone is a beast!,3 days ago
Hammah,This gives me the Lumia 1020 vibes. That phone was dope for its time,1 day ago
IVAN Chemshirov,I haven’t seen Marques as exited for a phone in while.,3 days ago
203basically,The rear design is highly inspired from Hasselblad cameras,3 days ago
Ztcpsp,Are there fast charging battery banks though that can keep up at all with this new fast charging capability?,3 days ago
Neuza Machado,Is there a full review for this phone? I'd love to see it,3 days ago
Games James,That home screen ui couldn’t look more like my iPhone unless it was another iPhone. I thought you did broll with an iPhone instead of this phone lol. Good video.,2 days ago
Nik Fam,If Apple would have this hardware they would manage to sell it for 5 years without changing anything - just by moving the sliders up and down so that cases wouldn’t fit the newer models. I was always wondering what type of business plan Oppo has and how can this be profitable..,2 days ago
Ulrich Sørensen,"Peak brightness is so hot right now, but I wish more manufacturers would show spec for lowest brightness (while on) for late night use.. the lowest setting is often too bright.",1 day ago
G Four Gadget,"Too bad this freaking amazing hardware was held down by its mediocre software, and the fact that it is only available in China doesn't help. Oh OPPO what are you thinking? ",3 days ago
Ali arda anil Cazgır,I feel that the last bull run was bolstered by all the money being printed. Major returns next bull run but I think they will be tamer in my humble opinion. A 100x on ,3 days ago
PhilWill903,"1"" sensors are fantastic for photography. But the lenses do not manage to deliver the required performance. With such sensor sizes, an aperture is required, the quality seems to fall of to the edges and most large-sensor phones seem to have massive problems with lens flare. This is the next thing they have to improve instead of getting even larger sensors.",3 days ago
Nathan Budd,If I'm going to watch an advert about a phone... this is how I want it to be.,3 days ago
leanido quilicot,Amazing design,3 days ago
Zach Meschke,Me watching tech reviewers being hands on with all these great devices that won’t make it to the States ,3 days ago
Yuri Hendrix,"I have the honor magic4 Pro. Looks like this one. Love the phone, was thinking either this one or the find x pro5. But I love it when people look amazed at my camera unit",3 days ago
Andre Howard,Are we taking it fdor granted or iss just the fact 99 percent of people don't need the flagship specs anymore?  I love that they are pusing the envelope and I WISH they would do more with the form factor.  Take risks like back in the fun heyday of mobiles.,3 days ago
Yaarmehearty,"Sure phones can theoretically do a lot more than they could a few years ago, but I would question if they really do, the thing that holds phones back is simply their size and touch interface. It just isn't conducive to being as useful as even a low spec computer. Flagship phones now just seem like they are throwing huge specs and money into something that will ultimately watch some videos, read emails, scroll social media and take a few photos.",3 days ago
MiNat0,"Love your merch man, it's awesome. That hoodie is slapping my eyes, wish I could get it where I am from.",3 days ago (edited)
M,Good to see they’ve grasped the oppo-tunity to release a flagship,3 days ago
Demorthus,"This is an example of a phone of a have your cake & eat it too. So much of the recent flagships just have an immediate, ""But! It can't do... Or- it doesn't have.."" in those 3 specific areas, battery/charging, camera/software, display/color/brightness. And it keeps on being the phones overseas that tend to be several steps ahead of what we all get in the US lol, sadly",3 days ago
MyWayne1993,I'm still rocking Find X2 Pro and still breezes through anything thrown at it.,3 days ago
Traveler Volkriin,I remember when we were LUCKY to get 8 hours on a single charge on a smartphone. NOW we'd be taking it back to the manufacturer for a defective model. Sometimes lineation (the slow phasing out of products) makes us forget how much progress has been made in the technological world. I think we're pretty close to holographic displays being unveiled in the next 20 years.,3 days ago (edited)
Pablo Saucedo,"Also back in the day a ""full day"" of charge was like 3-4 hours of sot, now the same measure is like 7-10 hours while pushing more pixels at 120hz nearly at 2000 nits. It's insane how much we've improved.",3 days ago
Yusuf Türkyilmaz Crafts,I'd like to have smartphones which are as thick as the camera bump to have a bigger battery,3 days ago
Daniel Moksmann,"I love the fact that the Xiaomi 12S Ultra, which this phone's camera bump clearly mimicks, is only ever seen in the video, but never nominally mentioned. ",3 days ago
Nick,That’s a classy looking phone ,3 days ago
JS75,"I feel the iPhones biggest weakness these days is it’s badly integrated camera bumps, between this and the Pixel it’s so much more pleasing to look at, and (not positive on this Oppo) seems to remove some of the terrible rocking on a table.",3 days ago
Rahul Khatri,What if company work on lenses and put one big camera sensor inside the phone and actually have two lenses in the big uper bumped round module to actually switch between the lenses by rotating it. That would be cool,2 days ago
Peter Tselios,the design of the phone is so good!,3 days ago (edited)
Tantien Nguyen,You should do a segment about phones in the past and why they failed.,2 days ago
Gyromic Techy ,"It's pritty good device and the specifications are amazing at this price point & yes oppo making more upgrades on there device , and also great & enjoyable video from MKBHD ",3 days ago
taro96,"I was just casually hearing another video for another phone, but when i watched the 2500 nits...damn thats nuts. But if this keeps going we will hold flashlights in our faces in a year",2 days ago
Raihan Mahmud,i like to watch your reviews cause you provide actual information ,13 hours ago
Arthur Zakaryan,Probably one of if not the best looking smartphone I've ever seen. Oppo really makes some of the best hardware around and this is as top of the line as it gets hands down right now.,3 days ago
bas team,On  ,3 days ago
Anthony,Man how are you not bored as hell reviewing phones ,3 days ago
Jude Musyoki,Speaking as someone who recently moved to a nordic country the feature to clock/overclock the phone to keep it warm in winter to protect the battery is such a clever innovation. It's not a big deal but it honestly adds value to the experience if you live in colder parts of the world. Between this & the Oppo Find N2 Flip I feel like phones are getting creative again(since early 2000s) perhaps. Thanks for keeping us informed as always MKBHD! ,3 days ago (edited)
Mukhtar Khan,You know smartphones are getting crazy when they are calculating 0-100 speeds.,2 days ago
Azzajay Brah,7:20,3 days ago
random ideas,I love how distinct leather phones are when compared to  glass phones.,3 days ago
ʀ ᴏ ꜱ ᴇ-Vlog Go to My Channel,This phone looks so suprisenly good with that color design,3 days ago
Brendan Henry,I thought you meant the leather was 'half vegan' and I was excited to hear how that worked,3 days ago
Rajesh Kumar,10 years ago I did not think that phones will have 1 day battery backup as I was getting 1 week battery backup on my Nokia 1100.,3 days ago
Abdul Kadir Rounak,Holy hell guys!,3 days ago
Young Ho Kim,As a camera nerd would you need a phone camera if your AR glasses were the viewfinder and you could crop it to any size for 2d?,3 days ago
Julia Cora,"Amazing specs from top to bottom, the cameras alone are amazing. Hard to believe all that computing power is almost taken for granted now. Great review as always. TY",3 days ago
Dutch Desire,The sesign of this phone reminds me of my LG G4 with the leather back cover. Still think it was rhe best looking phone of its time,3 days ago
Gabriel Cortes,"Oppo phones are the best, but the only thing they always get wrong is the front 1080p camera.",3 days ago (edited)
zues121510,"Man, the Galaxy S8 came out 6 years ago. I remember being absolutely stunned by the screen in the first trailer and then in person (it was my first ever flagship device)",3 days ago
Dylan Michael,"I think Marques addressed like the sole big issue in smartphones right now in like a minute. I think it's mind blowing that in 10-15 years the only standard for battery is at most ""all day"". Even that is getting kind of weary because we can just fast charge it if it doesn't last all day. Logically smartphone manufacturers like this because it's more charge cycles at higher temperatures you put on your phone wearing it down faster. The real focus needs to be getting to a true 2-3 day battery life and beyond. Most companies won't though because it means consumers would upgrade their phones less often. It's the same logic and method behind why the light bulb industry actually limited the longevity of bulbs in order to maintain consistent sales.",3 days ago
Garrett Reyman,10 years ago I used to joke I wanted an i7 and 8gb of ram in a phone. Now I have a phone with a chip that would eat 10 year old i7's for breakfast (and keeps up with my 5 year old i7 in certain tasks) and 16gb of ram lol it's awesome,3 days ago (edited)
AwesomeBlackDude,"So Oppo is following how the charging station prepares a car battery... Oppo has taken the ideas from Tesla, which has been warming up its batteries this way for years now.",3 days ago
Thilina Randombage,Great intro transition! I love mkbhd videos but I couldn’t help feeling this is a paid advertisement. The phone seems nice but I would have liked to see at least one low light picture from this phone even though it’s not a camera review. Also how many days of battery life does it have? Curious to know.,3 days ago
Ahmed Sh,"Phones have outgrown the specs stage, I can say now that the main determinant of buying a flagship phone is the cameras",3 days ago
huseynn,Ive just realized because english not being my first langauge i had to think to understand what the specifications of this phone when mkb talks about it . If i remember correctly previous videos had screen writings of them,3 days ago
Tech Matt,"What's wild is that Samsung manufacture so many of the displays in the smartphone market, yet they haven't pushed to get to the highest brightness of all of them.",2 days ago
wolverine,"I really don't like this trend of having Camera Bumps, just make the Phone Thicker with a nice flat surface on all sides, the plus size on that is it'll have enough space to put in a Larger Battery too.",3 days ago
Andre Gaga,i got to say... that thing is gorgeous! ,3 days ago
Mihai Gavril,"Hey, Marques! Greetings from Romania",3 days ago (edited)
Farron,Just ordered the Chevron Hoodie as an early birthday gift for myself. Super excited for it to come in ,3 days ago
Hamburgerschnack,"I have a 5 year old One Plus 6 still. Gotta say, I'm way happier with this one than I was with my last phones. Also way better lifecycle. I just remember my iPhone 4 whose battery pretty much died after 2 years ...",3 days ago
Yannick Reid,This was an interesting not-review. I dig it,3 days ago
trullymichael_jr,My iPhone 8 has that Ultra low temperature charging mode…but I think it only works when I’m playing games and editing videos on IG because that’s when it gets warm,3 days ago
clusterstage,2:31,3 days ago
MDMusic,"Wow, the pixel density is higher than the iPhone minis!",3 days ago
Agamjot Singh,"Can you cover major ewaste management companies and how they are processing phone ewaste, especially the batteries? Your platform can really bring them to the front.",3 days ago
H☢mᎥebe𝒶🆁,We need more dual tone phone colors.,3 days ago
Canada for Everyone,Watching this on Wednesday morning and the last time I plugged in my s23 was Monday morning. Still have 19% remaining,2 days ago
Joshua Builds,Ppi is a good indication of screen clarity to me. S21U is at 515ppi. That screen probably sets a new standard in practical use.,1 day ago
Kal-El Of Krypton,I wouldn't mind a large bump for a big sensor behind a lens.,3 days ago
Sebastian Johnson,"Is it possible to take the phone that has the absolute best Hardware for cameras, and then take the best software for cameras from another phone and put them together to produce even better images than anyone else can do? Like have people tried that?",3 days ago
Aksha赤シャ,"Amazing thechnology but I'm still using a Samsung S9 and I don't think I've been inconvienienced by its poor, battery, camera or fast charging performance since I bought it 5 years ago. It's not great for newer games like Genshin impact or Tower of fantasy but it's enough for me. I'm more of a psp guy myself and emulators work great. It's more then enough for everything else tho.",2 days ago
seitlhamo phefo,That camera module just looks like it'll break if you drop one .,3 days ago
Lone Wolf,"So now we all have a benchmark phone to compare to, while buying a new phone!",2 days ago
Niky Tamayo,"1/1.56"" Telephoto. ",3 days ago
Zisan Syed,Bro gave me a reality check with this one ngl!,3 days ago
Benjamin Zomberg,now we know where the real Hasselblad partnership went.,2 days ago
Yanlızlık,AWS33X,3 days ago
Shubham Pandya,Bro really takes us on a journey in each of his videos,3 days ago
Pepe,Smartphone tech has truly hit a brick wall.,2 days ago
AkarZaephyr,"My first phone was Siemens S6 - google it, lol, what a brick.",3 days ago
clonmult,"The camera bump thing is quite entertaining.   Remember the Nokia 808?  Has a camera that still comes up with good quality images, but do you remember the grief that Nokia got in some of the press around the ""huge"" camera bump?  It is needed if you want decent optics.  Nokia were a trailblazer in so many ways, shame that they were also a trailblazer for incompetent management as well.",3 days ago
Aneil_ 4 Cam click Me,Had the Find X3 Pro before getting the S23 Ultra and genuinely found the Oppo comparitive and a beast for the price. They don't seem to get the love they deserve in the UK,3 days ago
Gibber,"""Canada in the middle of winter. Something crazy."" ",3 days ago
Lightning Bolt,1:05,3 days ago
Amit,"I'm not even lying, your intro is reminding me of Nothing more than it is of your own",3 days ago
MaxReplay,This is EXACTLY the phone I wanted the OnePlus 11 Pro to be,3 days ago
Jamual Harris,This dude be on it man. So happy for him. Keep on keeping on bro bro,3 days ago
Harris Bhat,Only headphone user will under stand the pain of having audio in one ear only,3 days ago
Niko Manuelides,That's the prettiest smartphone ever built ,3 days ago
Ruben Moreno,They should just make the entire back a camera.,3 days ago
unstanic,"20 years ago though, would be unthinkable for a battery to last just a day...",3 days ago
th3youtuben00b,"Even if this phone was available in the US, you’ll never catch Marques with this OPPO or any Chinese phone as his “daily” outside of testing, no matter the specs ",3 days ago
Joshua Allison,The fact that this phone's wireless charging is faster than my $1400 S23 Ultra hurts a bit. I love my phone and it's NEARLY perfect but Samsung really should have gave us something better in the charging department. Still can't say I'd trade it for any other phone on the market tho.,3 days ago
FractalPrism,cool specs,3 days ago (edited)
jake holland,2500 nits? That's wild ive been wanting an android with a brighter display than the iphone 14 promax . At work I have to use my phone in the sun pretty often,3 days ago (edited)
Halisa Özer,Thank you for your research. I find your videos are well done. Will ,3 days ago
Abhijeet Sonawane,"If you didnt notice, the camera and the book behind the scene is Hasselblad ",3 days ago
aleksandar stokic,"I still use as my secondary phone find x2 pro...phone is still crazy good!Have battery life better than when it was new,camera are top til this day i done compare with so many 22,23y flagship phones and it is with all of them shoulder to shoulder!Still good QHD 120hz screen, great stereo i mena everything is still top notch! I'll wear it as secondary until it falls apart!",16 hours ago
Yaso,So much choice in the Android world amazing.,3 days ago
Yene,MI 12t Pro (redmi k50) has 120w with 5000mAh battery and maybe the 11tpro as well.,3 days ago
Brian Glaze,The camera bumps being as big as they are now is no problem for me especially if they're going to be given us amazing hardware like one inch sensors that Produce fantastic footage.,3 days ago
Anonymous,This man never disappoints us with his content.,3 days ago
Fred Adeleye,The Intros are unique as always. Great Video,3 days ago
Neo Nkosi,We just gonna glance over the fact that @Oppo has @Hasselblad cameras on it,3 days ago
TheWeakLink,"When it comes to cameras, why are they still using optical image stabilization? If I remember correctly, Apple went to stabilizing the sensor over the optics because they started to get too heavy. Looking at the size of these optics, why hasn’t other companies done the same?",3 days ago
Christian Aviles,"I still wish batteries technology still got better.  Like give me multi day batteries on phones already.  Get me through a long weekend with heavy usage and no concern about a charger.  I know we're not there yet but battery life is such a limiting factor in a lot of technologies as we depend on electronics more and more from smartphones, smart watches and even EVs.  ",2 days ago
fbwthe6,Marques drops videos at whatever hour he pleases,3 days ago
Akshat Gaur,Dude the cinematics in this video.,3 days ago
Kutter Mcneil,"I still have a Note 9 and it's in a mophie battery case so that I get even more battery life. NGL, without my battery case my phone is super sexy but not as practical. With how big the new camera systems are I wish that they would go ahead and just slam a bigger battery in the phone and make the whole thing level instead of having a giant camera bump and then nothing on the bottom",3 days ago
Roger o' Thornhill,"Even though that's really impressive, I'm still happy with my s22",3 days ago
Transplant Helper,If iPhone made a phone to look like that I’d buy one yesterday.,3 days ago
Lindokuhle Dladla,😂,3 days ago
Vespellatio,"Vegan leather is worse than real leather, regarding the Phone back. 1: since there is a meat industry anyways, not using real leather is wasteful. 2:vegan leather is made out of plastic (crude oil). 3: vegan leather breaks faster, making it a wasteful recource. 4: vegan leather doesn't age well with time, whereas if real leather is used it's much more robust and reliable.",1 day ago
SM8855N,"Everything seems outstandingly great except for foot print. Wish they keep 6.7"" as find x5pro or make it smaller between 6.5-6.6"".",3 days ago
Soul of Noctem,"This ""all day battery life"" I've NEVER had. LOL I don't know who's doing what with their phones. Maybe sending texts all day? But my phone maybe lasts to about early evening with 15% if I'm lucky! So, unless that's the ""all day"" then sure. But, I consider all day from morning to late evening. But, that's just me. ",3 days ago
DctrGizmo,That’s not the worst camera bump I’ve seen. Oppo did a good job with it. Too bad it’s only available in China.,3 days ago
K's Records,"Hey, Marques. Can I have your opinion? Which one should I get? Samsung S23 Ultra, iPhone 14 Pro Max or Xiaomi 13 Pro? I normally change phones every 3 or 4 years so I need something that can last (performance wise ",3 days ago (edited)
Ppl0a,This is why we need a competitive companies like OPPO against apple and samsung to give us a new models and other choices,3 days ago
AlwySavage LT,8:40,3 days ago
levzowk,Wow! 1440p. This phone has the same resolution as my S7 edge!,3 days ago
Scott Maclean,8:48,2 days ago
timurhan t,The 7String Aristides 070 looks sick! Well done!,1 day ago
Szilárd Korhetz,The camera bump has serious Lumia 1020 vibes.,2 days ago
Ricardo Veras,And the award for the most enthusiastically delivered puns of the year goes to…,3 days ago
Eric,Man I remember when people clowned the Nokia Lumia 1020 for having that massive camera bump on the back. Now it's a feature.,3 days ago
Joey Nelson,"Marques, if you haven't done it already. Would love to see you do an MKBHD review / interview of / with Hasselblad.",3 days ago
Ian,"Love your content, Marques!! Watching this from my Oneplus 11!",2 days ago
Bustin,1:10,3 days ago
Dr. Arjun Menon,"I appreciate how well rounded this is and how far we have come but nowadays, I'm afraid of using Chinese brands, whether it's software or hardware, it has become a tool for CCP to snoop around, and I personally would prefer an EU based midrange smartphone with strict privacy features over anything cutting edge like this one.",3 days ago
MaxSonicUA,"I appreciate the technical information about the camera, but I feel that Marques deliberately avoids discussing its poor photo quality",3 days ago
Udhi 565,Really would like to see a review on the new red magic phone,3 days ago
SNEAUXDAY,its giving LG G4 vibes. it walked so this could run. loved my curved screen leather back xD too bad it overheated and died of boot looping.,3 days ago
R ken,This is definitely my next phone.,2 days ago
RJ,Bring back pop up selfie cameras!,3 days ago
Adithya Kashyap,"This bumpy camera unit reminds me of the Nokia Lumia phones, I think those Nokia Lumia phones had an amazing camera and was way ahead of its time.",1 day ago
Chris Benson,This video is for Android users only ,3 days ago
usama rasool,I was hoping u will talk about the zoom lense how much it is caple of zoom and hows the quality did it compete with Samsung,3 days ago
MD ZIAUL ARFEEN,I love how marques went like yeah I've got merch now but what i wanna do is talk about this phone so yeah buy if you want maybe ,3 days ago
Xerxes The II,2:45,3 days ago
Tech69,1080p front cam recording. imagine how hard it could get trolled if it launches worldwide.,2 days ago
DovahDiaz,1:47,3 days ago
Adib Ahmed,You are an amazing YouTuber!,3 days ago
umut yıldız,"What a statement, damn. So it's said that Amazons ",3 days ago
Vernon Martin,ahh yes. the old Buick of charging mechanisms. nice touch,13 hours ago
Hmmm......,"This phone is gorgeous, best looking phone of the year?",2 days ago
bakaluffy,That glimpse of nokia 3310! The presence! ,3 days ago
Arvind Venkat,"Back when L1020 came out with a juggernaut camera setup, we went in for small camera holes, neat looking backs without bumps. Now, after what seems like ages, we went from that to backs of phones looking like they've been infected with pox, and now back to a juggernaut camera setup, that bravely stands up.",1 day ago
Yasro Maestro,"I have been an avid viewer of your YouTube channel for a long time, and I just wanted to take a moment to express how much I appreciate your content.",3 days ago (edited)
T A,4:40,3 days ago
Àķ§häț,I really don't care much about phones I just watch his videos because of insanely good video quality and the way he shoots. His videos are very balanced (if you understand what I mean by balance),3 days ago
Box,8:42,3 days ago (edited)
Jimmy Suwangsa,"The only not so great about Oppo and the siblings is their slow, sometime no update to the OS after a year. Wish they do at least as long as Samsung. Other than that, they give a really good price to performance.",3 days ago
felcas,"I would like to see a partnership with Canon. Megapixels are only half the story. Sensor quality is soo important too. Lenses too. Also I would like to see a body camera that you can just attach the phone in the back and extend the phone's camera capabilities, for example, lens attachments or just more zoom lens, body ergonomic,  battery time, etc...",1 day ago
Arlo,"Android went from being the OS for digital cameras, to phone OS, and back to an OS for phones that's basically cameras",3 days ago
Salim Ciz,I was sure last year would end terrible for me but I think Amazons ,3 days ago
